ISBN,書籍簡介
9780814472736,0
9781260092424,"1. The book is written in an engaging literary style, makes extensive use of examples, and is based on the research and consulting experience of the authors.2. The theme of managing services for competitive advantage is emphasized in each chapter and provides a focus for each management topic.3. The integration of technology, operations, and human behavior is recognized as central to effective service management.4. Emphasis is placed on the need for continuous improvement in quality and productivity in order to compete effectively in a global environment.5. To motivate the reader, a vignette of a well-known company starts each chapter, illustrating the strategic nature of the topic to be covered.6. Each chapter has a preview, closing summary, key terms and definitions, service benchmark, topics for discussion, an interactive exercise, solved problems and exercises when appropriate, and one or more cases."
9781785480430,"In the current digital environment, records and information management allows to face outstanding volumes of information, widespread dematerialization of business processes and the proliferation of legal and regulatory obligations. This book offers principles, standards, procedures and best practices for the creation of authoritative records and for long-term conservation purposes."
9798507452033,Nonprofit Management: Full Of Fantastic Information For The Way We Build Our Organization
9782940222711,0
9789811596889,"Dr. Dinesh Goyal is working as Principal at revered Institute, namely Poornima Institute of Engineering & Technology. Acquiring an experience of 20 years in teaching, and perceive keen interest in research area relating Cloud Security, Image Processing and Information Security. With a mission to append more and better skill set, has organized short term training programs as Convener and Co-Convener within during this short career span. He has been instrument in obtaining accreditations for his institutions, from various agencies like NAAC & NBA, He has received Grants for Research, Development, Conference & workshops worth Rs. 24 Lakh, from agencies like AICTE, TEQIP etc. He has been awarded by ""Elets Excellence Award 2017"" at Higher Education & Human Resource Conclave by Higher Education Department of Government of Rajasthan. Under his leadership, Institutions has also excelled in Industry Academia Interface, has established centers with major tech giants like Microsoft, Google & Amazon etc. He has 6 Full patents published & 1 Copyright under his name. He has successfully published 6 edited books with big publishing giants like Springer, Wiley, IGI Global, Apple Academic Press, Taylor & Francis and Eureka. He has published 1 SCI & 16 Scopus indexed papers & is editors of 2 SCI & 5 Scopus Indexed Journals, special issues. He has successfully guided 8 PhD Scholars & 31 PG Scholars. He has also attended more than 25 International Conferences & has been invited speaker for more than 15 Conferences & Seminars. He is life member of ISC & ISTE and fellow member of CSI & ISTE.Dr. Amit Kumar Gupta is currently working as an Associate Professor of Computer Science and Engineering at Poornima Institute of Engineering & Technology. He has more than 14 years of experience in Research and Academic Activities. He has received his Ph.D. in Computer Science Engineering from Suresh Gyan Vihar University, India. His expertise includes machine learning, information security, cloud computing, and CPU scheduling and has written more than 20 international & national papers, 10 out of them are with Scopus. He has also been Guest Editor for various Scopus Indexed journals, namely IGI Global, Bentham Science, Springer, and Inderscience. Vincenzo Piuri has received his Ph.D. in Computer Engineering at Politecnico di Milano, Italy (1989). He is Full Professor in Computer Engineering at the Università degli Studi di Milano, Italy (since 2000). He has been Associate Professor at Politecnico di Milano, Italy, and Visiting Professor at the University of Texas at Austin and at George Mason University, USA. His main research interests are: artificial intelligence, computational intelligence, intelligent systems, machine learning, pattern analysis and recognition, signal and image processing, biometrics, intelligent measurement systems, industrial applications, digital processing architectures, fault tolerance, dependability, and cloud computing infrastructures. Original results have been published in more than 400 papers in international journals, proceedings of international conferences, books, and book chapters. He is Fellow of the IEEE, Distinguished Scientist of ACM, and Senior Member of INNS. He is President of the IEEE Systems Council (2010-2021), and has been IEEE Vice President for Technical Activities (2015), IEEE Director, President of the IEEE Computational Intelligence Society, Vice President for Education of the IEEE Biometrics Council, Vice President for Publications of the IEEE Instrumentation and Measurement Society and the IEEE Systems Council, and Vice President for Membership of the IEEE Computational Intelligence Society. He has been Editor-in-Chief of the IEEE Systems Journal (2013-2019). He is an Associate Editor of the IEEE Transactions on Cloud Computing and has been Associate Editor of the IEEE Transactions on Computers, the IEEE Transactions on Neural Networks, the IEEE Transactions on Instrumentation and Measurement, and IEEE Access. He received the IEEE Instrumentation and Measurement Society Technical Award (2002). He is Honorary Professor at Obuda University, Hungary; Guangdong University of Petrochemical Technology, China; Northeastern University, China; Muroran Institute of Technology, Japan; and the Amity University, India. Maria Ganzha is an Associate Professor at the Warsaw University of Technology (Warsaw, Poland). She has an M.S. and a Ph.D. degree in Mathematics from the Moscow State University, Russia, and a Doctor of Science degree in Computer Science from the Polish Academy of Sciences. Maria has published close to 200 research papers, is on editorial boards of 5 journals and a book series, and was invited to program committees of more than 250 conferences. She is also the Principal Investigator, of the SRIPAS team, in the INTER-IoT project. Here, her team is responsible for use of semantic technologies in the context of interoperability of IoT platforms. Marcin Paprzycki is an Associate Professor at the Systems Research Institute, Polish Academy of Sciences. He has an M.S. from Adam Mickiewicz University in Poznań, Poland, a Ph.D. from Southern Methodist University in Dallas, Texas, and a Doctor of Science from the Bulgarian Academy of Sciences. He is a senior member of IEEE, a senior member of ACM, a Senior Fulbright Lecturer, and an IEEE CS Distinguished Visitor. He has contributed to more than 450 publications and was invited to the program committees of over 500 international conferences. He is on the editorial boards of 12 journals and a book series."
9780357510094,0
9781716066696,"Client Profile Book alphabeticalDesign features: To give you freedom to add more clients under any letter, pages doesn't have any pre assigned letters.Index is divided into 4 sections 6 letters each, to make finding names much easier.Space customizable to suit your needs, Log client formulas, Services done, Allergies, General remarks and more.Size: 8.5"" x 11"" (21.59 x 27.94 cm), To provide enough space to log the information needed and still be easy to carry around.Over 136 page client entries. This log is your helping tool to: -Keep track and organizing clients information.-Advertise your new services and offers effectively to your customers database.-Be organized and increase profits.-stay conncted with your clients.-Find customer contact information and manage appointments.Client Organizer Planner and Appointment Log Book to Keep Track of Your Customer Information The client data organizer log book is an easy way to organize your client's data or appointment. This client contact info log book is 8.5x11 inches and it helps you organize your client list, client name, address, phone, email, occupation, birthday, service type, price and more. This client notebook organizer is perfect for the business owners or managers to keep record customer information.vb"
9789387698307,"P Balasubramanian (Ph.D.) is the University Librarian & Head of Manonmaniam Sundaranar University, Department of Library and Information Science, Tirunelveli, Tamil Nadu, India. He holds MA, MLISc, MPhil, MCA, MBA, PGDPR, and PhD. He is a life member of various professional bodies. His books on library & information science are very popular among the research scholars and library professionals. He has published 52 books on library & information science and other topics. He has published 119 papers in seminars, conventions, conference, and refereed journals. He has organised many international and national seminars, workshops on various emerging topics in library & information science. He is also guiding MPhil and PhD research scholars in library & information science. He has produced 9 MPhil and 27 PhD scholars. He has also completed one major research project funded by ICSSR, Govt of India. He has been teaching Library & Information Science for 20 years."
9781664210028,"The book ICT and School Management in Nigeria is a practical approach to the needed information for both students and practitioners in Educational Management Information System in our contemporary society. The various chapters had comprehensive coverage of the theme of the book. Chapter one, focused on various concepts of Information, Communication and Technology. Chapter two, discussed ICT integration and deployment in planning, staffing, motivation, directing, monitoring, coordinating staff, students, and other education resources, further discussed ICT tools such as e- learning, blended learning, video conferencing, and interactive radio counseling. Chapter three focused on ICT and Management of Primary schools, Chapter four on ICT and Management of Secondary Schools, and Chapter five on ICT and Management of Tertiary Institutions . The book is a compendium of knowledge in ICT and Schools' Management"
9781664210004,"The book ICT and School Management in Nigeria is a practical approach to the needed information for both students and practitioners in Educational Management Information System in our contemporary society. The various chapters had comprehensive coverage of the theme of the book. Chapter one, focused on various concepts of Information, Communication and Technology. Chapter two, discussed ICT integration and deployment in planning, staffing, motivation, directing, monitoring, coordinating staff, students, and other education resources, further discussed ICT tools such as e- learning, blended learning, video conferencing, and interactive radio counseling. Chapter three focused on ICT and Management of Primary schools, Chapter four on ICT and Management of Secondary Schools, and Chapter five on ICT and Management of Tertiary Institutions . The book is a compendium of knowledge in ICT and Schools' Management"
9781989744888,"All the worksheets are below the various charts and graphs in each section as well as in the appendix. There is the excel workbook that contains all the worksheets. Don't go lean in your office without this valuable resource Here's a preview of what you'll learn...- Improving customer satisfaction- Eliminate business waste- Differences between push and pull strategies- Lean six sigma tools- Lean engineering analysis- How to play close games- How to use value stream mappingImplementing this methodology will bring a new set of functions and systems into your organization, ensuring tangible results. You will achieve your goals, and your customers will get exactly what they want. "
9781716311093,"Keeping a precise record of the entirety of your customers is crucial and more. You may be amazed to discover there are in reality a ton of significant purposes behind keeping up an exact record of every one of your customers.Precise Client Records Ensure Your Marketing Is On-PointThe more you work in the business, the more you'll see patterns among your customers.Keeping up An Accurate Sales Record for Tax PurposesIt is additionally significant that you keep up a paper trail of all exchanges on the off chance that the IRS questions the sum you state you earned.Keeping Track of Your ScheduleA few customers make month to month arrangements. On account of these customers, tracking when they come in will assist you with tracking your own timetable."
9781801119412,0
9781493219599,"Master SAP ILM, from retention management to lifecycle management for custom code. Follow step-by-step instructions and walk through all major functionality including policy creation, legal case management, data archiving, and more. Whether you're on SAP S/4HANA, SAP S/4HANA Cloud, or SAP ERP, you'll find the details you need to configure and use SAP ILM. Control and protect your data Highlights include: 1) Retention management2) GDPR3) Data security4) Blocking data5) Data deletion6) Archiving data7) Legal case management8) Data controller rule framework9) Custom code data lifecycle10) SAP S/4HANA11) SAP S/4HANA Cloud12) SAP ERP HCM"
9781953557087,0
9781925823837,0
9781649441874,0
9781649441560,"This Chronic Pain Journal tracker, diary is a perfect tool to help you document what you are feeling from day to day. This information is useful both for you & your doctor. It will help you to keep an accurate record to track the location of your pain, tracking & identifying patterns of pain, such as time of day or level of stress, or pain triggers from certain activities. Each interior page includes space & section to write: Contact Page - Write your name.Date, Weather, Temp, Conditions, Humidity - Record the weather to see if there are correlations with your pain.My Symptoms - List your symptom or symptoms.How Well Did You Sleep - Rate on scale of 1-10.How Was Your Pain Today - Rate the severity of your pain on a scale of 1-10.How Was Your Fatigue Today - Rate on a scale of 1-10.How Was Your Brain Fog Today - Rate on a scale of 1-10.How Was Your Mood Today - Rate on a scale of 1-10.Body Diagram - To track the location of your pain.Stress Levels Assessment At Work - Rate on a scale of 1-10.Stress Levels Assessment At Home - Rate on a scale of 1-10.Code & Color In Your Pain Level Sections - Monitor your pain by coloring in the description of your pain (Shooting, stabbing, burning, numbness, aching, pins & needles, other).Food Tracker - List what you had for breakfast, lunch, dinner, snacks & drinks.Medication - List your medications for the day.Supplements & Vitamins - List your supplements & vitamins for the day.Notes - For writing any other important information such as, other health or medical issues, migraine, headaches or headache, duration of pain, any illness, how you got relief, well check ups at the doctors.Easy to use & look back on. Also may make a great gift for anyone in your life who suffers from chronic pain. Journals are a great way to keep your important information all in one place. Size is 6x9 inches, 91 pages, soft matte finish cover, quality white paper, paperback. Beautifully designed. Get your copy today."
9781683925866,0
9798648459946,0
9780367252502,"Today, there are few in senior management positions who can afford to ignore modern information technology, and few individuals who would prefer to be without it. Modern IT is key to organizational performance; yet we often assume the benefits will occur without forethought or effort. As managerial tasks become more complex, so the nature of the required information systems changes - from structured, routine support to ad hoc, unstructured, complex enquiries at the highest levels of management. If taken for granted, serious implications can arise for organizations. This fifth edition of Strategic Information Management has been brought fully up to date with recent developments in the management of information systems, including digital transformation strategy, the issues surrounding big data and algorithmic decision-making. The book provides a rich source of material reflecting recent thinking on the key issues facing executives, drawing from a wide range of contemporary articles written by leading experts in North America, Europe, and Australia. Combining theory with practice, each section is fully introduced, includes further reading and questions for further discussion. Designed for MBA, master's level students, and advanced undergraduate students taking courses in information systems management, it also provides a wealth of information and references for researchers."
9783832550813,"This dissertation proposes and develops a data retrieval system for chemistry, the system consists of (1) ChemScanner a software library that can be used for the extraction of chemical information from scientific documents that contain ChemDraw sketches, (2) the ChemScanner User Interface visualizes sketches and provides an interface for data management, and (3) the integration of the ChemScanner library into the Open-source Electronic Lab Notebook, which would make the software easier to use via the web application user interface, and a better management mechanism for the information retrieval system. The research project contributes to the development of chemical databases, facilitates and accelerate users in building chemical datasets from accessible documents."
9789004428997,"In Data Innovations for Transboundary Freshwater Resources Management: Are Obligations Related to Information Exchange Still Needed?, Christina Leb discusses how technology innovations disrupt the conventional methods of data and information exchange and the potential impact this may have on international water law.  Cross-border data and information exchange is one of the most challenging issues for transboundary water management. Only a small number of treaties include direct obligations related to mutual data and information exchange. Technological innovations related to real-time data availability, space technology and earth observation have led to an increase in quality and availability of hydrological, meteorological and geo-spatial data. These innovations open new avenues for access to water related data and transform data and information exchange globally. This monograph is an exploratory assessment of the potential impacts of these disruptive technologies on data and information exchange obligations in international water law."
9781787781993,"An ideal primer for anyone implementing a PIMS (privacy information management system) based on ISO/IEC 27701ISO/IEC 27701:2019 is a privacy extension to the international information security management standard, ISO/IEC 27001. It has been designed to integrate with ISO 27001 to extend an existing ISMS (information security management system) with additional requirements, enabling an organisation to establish, implement, maintain and continually improve its PIMS.ISO 27701 provides guidance on the protection of privacy, including how organisations should manage personal information, and helps demonstrate compliance with privacy regulations around the world, such as the GDPR (General Data Protection Regulation).ISO/IEC 27701:2019: An introduction to privacy information management offers a concise introduction to the Standard, aiding those organisations looking to improve their privacy information management regime, particularly where ISO/IEC 27701:2019 is involved. It is intended for:   Individuals looking for general information about privacy information management; and Organisations implementing, or considering improving, a PIMS, particularly where the use of ISO/IEC 27701:2019 is being considered.  It will enable you to understand the basics of privacy information management, including:   What privacy information management means; How to manage privacy information successfully using a PIMS aligned to ISO/IEC 27701; Key areas of investment for a business-focused PIMS; and How your organisation can demonstrate the degree of assurance it offers with regard to privacy information management.  This guide will prove useful throughout a number of stages in any privacy information management project - buy your copy today "
9781780175188,"Commercial, personal and sensitive information is very hard to keep secure, and technological solutions are not the only answer. In today's technology-driven environment, there is an ever-increasing demand for information delivery on various devices in the office, at home and in public places. A compromise has to be struck between security of information and its availability. This book provides significant first steps along the path of dealing with information assurance in a realistic and comprehensive manner. The third edition has been updated to reflect changes in the IT security landscape and updates to the BCS Certification in Information Security Management Principles, which the book supports."
9780838918739,"The recipient of rave reviews from far and wide (Journal of Hospital Librarianship deemed it ""a librarian's dream ... very forward-thinking""), since its initial publication this text has served as an essential resource for both LIS students and practitioners. The new fourth edition offers an updated, comprehensive examination of the myriad of basic skills effective library managers must exercise throughout their careers. Throughout, Evans and new co-author Greenwell pay close attention to management in ""new normal"" straitened economic conditions and the pervasive impact of technology on a library manager's role. This book's coverage includes  a new focus on how being in the public/nonprofit sector influences the application of management basics such as planning, accountability, trust and delegation, decision making, principles of effective organizational communication, fostering change and innovation, quality control, and marketing; the managerial environment, organizational skill sets, the importance of a people-friendly organization, and legal issues; key points on leadership, team-building, and human resource management; budget, resource, and technology management; management ethics, with a lengthy discussion of why ethics matter; and tips for planning a library career, with a look at the work/life debate. "
9781783304523,"The recipient of rave reviews from far and wide (Journal of Hospital Librarianship deemed it ""a librarian's dream ... very forward-thinking""), since its initial publication this text has served as an essential resource for both LIS students and practitioners. The new fourth edition offers an updated, comprehensive examination of the myriad of basic skills effective library managers must exercise throughout their careers. Throughout, Evans and new co-author Greenwell pay close attention to management in ""new normal"" straitened economic conditions and the pervasive impact of technology on a library manager's role. This book's coverage includes  a new focus on how being in the public/nonprofit sector influences the application of management basics such as planning, accountability, trust and delegation, decision making, principles of effective organizational communication, fostering change and innovation, quality control, and marketing; the managerial environment, organizational skill sets, the importance of a people-friendly organization, and legal issues; key points on leadership, team-building, and human resource management; budget, resource, and technology management; management ethics, with a lengthy discussion of why ethics matter; and tips for planning a library career, with a look at the work/life debate.  This book, to quote Australian Library Journal, is ""a recommended text for library science students, but is also an excellent source of information for career librarians wanting to refresh their knowledge of library management in a fast-moving information services environment."""
9781484254127,"Discover the simple steps to implementing information security standards using ISO 27001, the most popular information security standard across the world. You'll see how it offers best practices to be followed, including the roles of all the stakeholders at the time of security framework implementation, post-implementation, and during monitoring of the implemented controls. Implementing an Information Security Management System provides implementation guidelines for ISO 27001:2013 to protect your information assets and ensure a safer enterprise environment.  This book is a step-by-step guide on implementing secure ISMS for your organization. It will change the way you interpret and implement information security in your work area or organization. What You Will LearnDiscover information safeguard methodsImplement end-to-end information securityManage risk associated with information securityPrepare for audit with associated roles and responsibilitiesIdentify your information riskProtect your information assetsWho This Book Is ForSecurity professionals who implement and manage a security framework or security controls within their organization. This book can also be used by developers with a basic knowledge of security concepts to gain a strong understanding of security standards for an enterprise."
