ISBN,書籍簡介
9780244149550,"In this book, the following subjects are included: information security, the risk assessment and treatment processes (with practical examples), the information security controls. The text is based on the ISO/IEC 27001 standard and on the discussions held during the editing meetings, attended by the author. Appendixes include short presentations and check lists. CESARE GALLOTTI has been working since 1999 in the information security and IT process management fields and has been leading many projects for companies of various sizes and market sectors. He has been leading projects as consultant or auditor for the compliance with standards and regulations and has been designing and delivering ISO/IEC 27001, privacy and ITIL training courses. Some of his certifications are: Lead Auditor ISO/IEC 27001, Lead Auditor 9001, CISA, ITIL Expert and CBCI, CIPP/e. Since 2010, he has been Italian delegate for the the editing group for the ISO/IEC 27000 standard family. Web: www.cesaregallotti.it."
9781799817864,0
9781284153897,"Adaptive Health Management Information Systems, Fourth Edition is a thorough resource for a broad range of healthcare professionals-from informaticians, physicians and nurses, to pharmacists, public health and allied health professionals-who need to keep pace the digital transformation of health care. Wholly revised, updated, and expanded in scope, the fourth edition covers the latest developments in the field of health management information systems (HMIS) including big data analytics and machine learning in health care; precision medicine; digital health commercialization; supply chain management; informatics for pharmacy and public health; digital health leadership; cybersecurity; and social media analytics. This thoroughly updated text offers extensive features to encourage thinking and discussion including: - Comprehensive coverage of essential HMIS concepts, including emerging perspectives in health information systems (Health IS/IT), digital health enterprise software, patient-centric technologies, HMIS interoperability, HMIS strategic planning, and management, HMIS standards, governance and international perspectives, and the latest health technologies and innovations. - Realistic practice-based scenarios open each chapter, setting the stage for topic discussion and understanding of major topics. - Updated mini-cases that illustrate concepts along with related questions to promote thinking or discussion. - NEW Technology Reviews concisely covering emerging trends in healthcare technology such as big data analytics, cloud computing, and use of geospatial technology. - NEW Policy Reviews the address key policy issues relating to health information access, leadership responsibilities, and Health IT standards adoption. - Probing chapter questions to stimulate thinking and comprehension. - 5 New Major Cases relating to newer major themes of IT/IS provide students and teachers opportunities to interact and debate. - Access to Navigate 2 online learning materials, including a comprehensive and interactive eBook, student practice activities and assessments, learning analytics reporting tools, and more."
9780655933793,"Is a sample receipt function provided with the system? How is this used to monitor inventory for example? Are user configuration changes supported by the vendor? What reasons account for your not having used LIMS before? What reporting tools does the system support?  Defining, designing, creating, and implementing a process to solve a challenge or meet an objective is the most valuable role... In EVERY group, company, organization and department.  Unless you are talking a one-time, single-use project, there should be a process. Whether that process is managed and implemented by humans, AI, or a combination of the two, it needs to be designed by someone with a complex enough perspective to ask the right questions. Someone capable of asking the right questions and step back and say, 'What are we really trying to accomplish here? And is there a different way to look at it?'  This Self-Assessment empowers people to do just that - whether their title is entrepreneur, manager, consultant, (Vice-)President, CxO etc... - they are the people who rule the future. They are the person who asks the right questions to make Laboratory Information Management System LIMS investments work better.   This Laboratory Information Management System LIMS All-Inclusive Self-Assessment enables You to be that person.  All the tools you need to an in-depth Laboratory Information Management System LIMS Self-Assessment. Featuring 958 new and updated case-based questions, organized into seven core areas of process design, this Self-Assessment will help you identify areas in which Laboratory Information Management System LIMS improvements can be made.  In using the questions you will be better able to:  - diagnose Laboratory Information Management System LIMS projects, initiatives, organizations, businesses and processes using accepted diagnostic standards and practices  - implement evidence-based best practice strategies aligned with overall goals  - integrate recent advances in Laboratory Information Management System LIMS and process design strategies into practice according to best practice guidelines  Using a Self-Assessment tool known as the Laboratory Information Management System LIMS Scorecard, you will develop a clear picture of which Laboratory Information Management System LIMS areas need attention.  Your purchase includes access details to the Laboratory Information Management System LIMS self-assessment dashboard download which gives you your dynamically prioritized projects-ready tool and shows your organization exactly what to do next. You will receive the following contents with New and Updated specific criteria:  - The latest quick edition of the book in PDF  - The latest complete edition of the book in PDF, which criteria correspond to the criteria in...  - The Self-Assessment Excel Dashboard  - Example pre-filled Self-Assessment Excel Dashboard to get familiar with results generation  - In-depth and specific Laboratory Information Management System LIMS Checklists  - Project management checklists and templates to assist with implementation  INCLUDES LIFETIME SELF ASSESSMENT UPDATES  Every self assessment comes with Lifetime Updates and Lifetime Free Updated Books. Lifetime Updates is an industry-first feature which allows you to receive verified self assessment updates, ensuring you always have the most accurate information at your fingertips. "
9781787781368,"Protect your information assets with effective risk managementIn today's information economy, the development, exploitation and protection of information and associated assets are key to the long-term competitiveness and survival of corporations and entire economies. The protection of information and associated assets - information security - is therefore overtaking physical asset protection as a fundamental corporate governance responsibility. Information security management system requirementsISO 27000, which provides an overview for the family of international standards for information security, states that ""An organisation needs to undertake the following steps in establishing, monitoring, maintaining and improving its ISMS  ...] assess information security risks and treat information security risks"". The requirements for an ISMS are specified in ISO 27001. Under this standard, a risk assessment must be carried out to inform the selection of security controls, making risk assessment the core competence of information security management and a critical corporate discipline.Plan and carry out a risk assessment to protect your informationInformation Security Risk Management for ISO 27001 / ISO 27002   Provides information security and risk management teams with detailed, practical guidance on how to develop and implement a risk assessment in line with the requirements of ISO 27001. Draws on national and international best practice around risk assessment, including BS 7799-3:2017 (BS 7799-3). Covers key topics such as risk assessment methodologies, risk management objectives, information security policy and scoping, threats and vulnerabilities, risk treatment and selection of controls. Includes advice on choosing risk assessment software.  Ideal for risk managers, information security managers, lead implementers, compliance managers and consultants, as well as providing useful background material for auditors, this book will enable readers to develop an ISO 27001-compliant risk assessment framework for their organisation and deliver real, bottom-line business benefits. Buy your copy today  About the authors Alan Calder is the Group CEO of GRC International Group plc, the AIM-listed company that owns IT Governance Ltd. Alan is an acknowledged international cyber security guru and a leading author on information security and IT governance issues. He has been involved in the development of a wide range of information security management training courses that have been accredited by IBITGQ (International Board for IT Governance Qualifications). Alan has consulted for clients in the UK and abroad, and is a regular media commentator and speaker.  Steve G Watkins is an executive director at GRC International Group plc. He is a contracted technical assessor for UKAS - advising on its assessments of certification bodies offering ISMS/ISO 27001 and ITSMS/ISO 20000-1 accredited certification. He is a member of ISO/IEC JTC 1/SC 27, the international technical committee responsible for information security, cyber security and privacy standards, and chairs the UK National Standards Body's technical committee IST/33 (information security, cyber security and privacy protection) that mirrors it. Steve was an active member of IST/33/-/6, which developed BS 7799-3. "
9780655813125,"How do you monitor usage and cost? Are all staff in core Information Security Program Management subjects Highly Qualified? Who will be in control? Has a Information Security Program Management requirement not been met? What needs to stay?  This best-selling Information Security Program Management self-assessment will make you the trusted Information Security Program Management domain visionary by revealing just what you need to know to be fluent and ready for any Information Security Program Management challenge.  How do I reduce the effort in the Information Security Program Management work to be done to get problems solved? How can I ensure that plans of action include every Information Security Program Management task and that every Information Security Program Management outcome is in place? How will I save time investigating strategic and tactical options and ensuring Information Security Program Management costs are low? How can I deliver tailored Information Security Program Management advice instantly with structured going-forward plans?  There's no better guide through these mind-expanding questions than acclaimed best-selling author Gerard Blokdyk. Blokdyk ensures all Information Security Program Management essentials are covered, from every angle: the Information Security Program Management self-assessment shows succinctly and clearly that what needs to be clarified to organize the required activities and processes so that Information Security Program Management outcomes are achieved.  Contains extensive criteria grounded in past and current successful projects and activities by experienced Information Security Program Management practitioners. Their mastery, combined with the easy elegance of the self-assessment, provides its superior value to you in knowing how to ensure the outcome of any efforts in Information Security Program Management are maximized with professional results.  Your purchase includes access details to the Information Security Program Management self-assessment dashboard download which gives you your dynamically prioritized projects-ready tool and shows you exactly what to do next. Your exclusive instant access details can be found in your book. You will receive the following contents with New and Updated specific criteria:  - The latest quick edition of the book in PDF  - The latest complete edition of the book in PDF, which criteria correspond to the criteria in...  - The Self-Assessment Excel Dashboard  - Example pre-filled Self-Assessment Excel Dashboard to get familiar with results generation  - In-depth and specific Information Security Program Management Checklists  - Project management checklists and templates to assist with implementation  INCLUDES LIFETIME SELF ASSESSMENT UPDATES  Every self assessment comes with Lifetime Updates and Lifetime Free Updated Books. Lifetime Updates is an industry-first feature which allows you to receive verified self assessment updates, ensuring you always have the most accurate information at your fingertips. "
9781797880945,0
9780135205563,"Personalize learning with MyLab By combining trusted author content with digital tools and a flexible platform, MyLab(TM) personalizes the learning experience and improves results for each student.  You are purchasing an access card only. Before purchasing, check with your instructor to confirm the correct ISBN. Several versions of the MyLab(TM) and Mastering(TM) platforms exist for each title, and registrations are not transferable. To register for and use MyLab or Mastering, you may also need a Course ID, which your instructor will provide. If purchasing or renting from companies other than Pearson, the access codes for the MyLab platform may not be included, may be incorrect, or may be previously redeemed. Check with the seller before completing your purchase."
9781090149848,"Business Incubators/accelerators/coworking spaces can be key drivers of economic development. The typical business incubator is in a suburban setting in an area with a population of less than 500,000. Universities or university-affiliated non-profits operate most incubators. The standard incubator has 15-20 companies when full and a ""mixed profile"" of University and non-university clients from many industry areas, including pharmaceutical, Information technology, medical technology, ""biotech,"" and engineering - even retail. The model for most incubators has shifted in the past decade - economic development professionals are now relying on incubation, a ""grow-your-own"" entrepreneurial model rather than an attraction model, as the tax-incentive and relocation package concepts of the past have faded in their effectiveness to convince companies to move to new locations. Incubators are also beginning to ""specialize"" in various concentrations, such as ""Clean-tech"" or ""alternative energy,"" to emphasize and attract specific industry sectors and to focus on the core competencies of associated research Universities. Also, many incubators/accelerators/coworking spaces are capitalizing on the resources provided by industry associations, such as access to specialized equipment and partnerships with leading scientists. Accelerators are defined differently, and many are concentrated in major metropolitan areas with ready access to capital and intensive programs designed to help businesses succeed in rapid fashion. Coworking spaces are gaining in favor by providing a solid environment for collaboration and business growth, with exciting programs and educational activities to assist in business formation and strategic direction. The commonality here, for this book, is the facility itself - the physical and operational strategy of business incubation is a process - a great business incubator involves programming, mentoring, education and many other efforts to insure small business growth. Business incubation also usually involves an actual physical site, a building where clients have specialized types of spaces. Most clients are looking for a collaborative, reasonably-priced and well-designed space for their business. They want to look professional, have adequate space for their employees, and have space for growth. Planning, designing and operating such a business incubation facility takes lots of background knowledge and lots of effort; this book is an attempt to cover a significant amount of the planning and strategy involved with facilities management. While many incubation professionals have an entrepreneurial background, few have a background in designing and operating a physical facility. The complexities of such systems as heating, ventilation and air conditioning; plumbing and electrical; lighting; fire alarms and sprinklers; security; elevators and stairs; and many other systems are often ""uncharted territory"" for incubation professionals. While this book addresses these key systems, it also incorporates design tips and ideas for ""green building"" compliance, ADA compliance and flexible design. While standardizing sizes of spaces may be easier for construction, inserting features such as ""hotel doors,"" flex panels and varying the sizes of spaces can assist companies in growth and development, helping the incubator adapt to their needs. A review of adapting existing buildings or building a new building from the group up is conducted in this book.Also, after the physical construction takes place, an incubation professional must consider the operations aspect of managing an incubation building - this may include raising funds, maximizing operating revenues, and running programs. One book on Facilities Management cannot possibly cover every topic related to business incubation and its variants but we hope you find this book full of ideas, strategies, advice and tips that will prove useful to your program"
9780135191798,"For introductory courses in IS (information systems) and MIS (management information systems).   The authoritative, case-based study of IS in business today   Management Information Systems: Managing the Digital Firm  provides the most comprehensive overview of information systems used by business firms today, while drawing connections between MIS and business performance. The Laudons are known for their outstanding real-world case studies, which describe how well-known companies use IT to solve problems and achieve business objectives. Students develop sought-after skills, such as leading IS-related management discussions and using IT to meet bottom-line results. Each chapter of the 16th edition features all-new Interactive Sessions, new Video Cases, and a new Career Opportunities section building practical job-seeking skills.  Also available with MyLab MIS By combining trusted author content with digital tools and a flexible platform, MyLab(TM) personalizes the learning experience and improves results for each student. And, with MIS Decision-Making Sims and Auto-Graded Excel and Access Projects, students learn how MIS concepts will help them succeed in their future careers.  Note:  You are purchasing a standalone product; MyLab MIS does not come packaged with this content. Students, if interested in purchasing this title with MyLab MIS, ask your instructor to confirm the correct package ISBN and Course ID. Instructors, contact your Pearson representative for more information. If you would like to purchase both the physical text and MyLab MIS, search for:  0135409098 / 9780135409091  Management Information Systems: Managing the Digital Firm  Plus MyLab MIS with Pearson eText -- Access Card Package, 16/e    Package consists of:   0135191793 / 9780135191798 Management Information Systems: Managing the Digital Firm, 16/e 0135205565 / 9780135205563 MyLab MIS with Pearson eText -- Access Card -- for Management Information Systems: Managing the Digital Firm, 16/e "
9781941075036,"Through decades of consulting practice, Dr. Hagen has tailored a decision making process to correspond with the way that our brains actually function. This comprehensive book shares his methodology and the basis for it. He presents powerful insights and distinctions that are not found elsewhere. This book is written for executives, managers, senior professionals, and analysts."
9781337101356,"Develop a strong understanding of IT project management as you learn to apply today's most effective project management tools and techniques with the unique approach found in Schwalbe's INFORMATION TECHNOLOGY PROJECT MANAGEMENT, 9E. Examine the latest developments and skills as you prepare for the Project Management Professional (PMP) or Certified Associate in Project Management (CAPM) exams. This edition reflects content from the latest PMBOK Guide, 6E and the Agile Practice Guide while providing a meaningful context. Examples from familiar companies featured in today's news discussion, exercises and cases reinforce learning. Time-saving template files assist in completing tasks. Agile information, a guide to using Microsoft Project 2016 and MindTap online resources will help you master today's most marketable IT project management skills."
9781783304301,0
9781337553674,"Get in the know and learn in the now with ESSENTIALS OF HEALTH INFORMATION MANAGEMENT: PRINCIPLES AND PRACTICES, FOURTH EDITION  Electronic health records are the norm in health care today, so you must master technology and legislative changes as they come. This book delivers all the latest updates, mapping key content directly to CAHIIM standards for data and information governance, electronic health records, data integrity and security, ICD-10-CM implementation, HIPAA rules, and more. Plus, the readings are designed to engage and inspire you as much as they inform. If you�re ready to take learning to the next level, use the included lab manual with electronic health record activities for EHR Go software (subscription required), or get the available MindTap learning system with interactive features and self-quizzing."
9781337553698,0
9781720911944,0
9780749482046,"Katherine O'Keefe is a Data Governance and Data Protection Consultant and Trainer at Castlebridge Associates, Dublin. She also delivers Data Ethics training for the Data Protection Certificate Data Round Table for the Law Society of Ireland.Daragh O'Brien is a Data Governance, Data Quality and Data Privacy Consultant and Trainer. He is Managing Director and Lead Consultant at Castlebridge Associates. He is also an adjunct faculty member at the Law Society of Ireland Diploma School."
9781337405713,"MANAGEMENT OF INFORMATION SECURITY, Sixth Edition prepares you to become an information security management practitioner able to secure systems and networks in a world where continuously emerging threats, ever-present attacks and the success of criminals illustrate the weaknesses in current information technologies. You'll develop both the information security skills and practical experience that organizations are looking for as they strive to ensure more secure computing environments. The text focuses on key executive and managerial aspects of information security. It also integrates coverage of CISSP and CISM throughout to effectively prepare you for certification. Reflecting the most recent developments in the field, it includes the latest information on NIST, ISO and security governance as well as emerging concerns like Ransomware, Cloud Computing and the Internet of Things."
9781118890790,0
9781440854477,"Strategic planning. Facilities management. Leadership, ethics, communication, and motivation. Human resources and staffing. Change, library development, and innovation. Marketing. Measurement and evaluation. Fiscal responsibility and control. These are just some of the wide range of responsibilities and necessary skills of contemporary library managers--not all of which are typically covered in detail in LIS educational programs.Now updated and expanded for its ninth edition, Libraries Unlimited's Library and Information Center Management is the core management text for library information science programs. This latest text adds new information on grant writing as well as more about budgets, marketing, financial management, assessment, and evidence-based management. The authors include various real-world examples from international settings to help readers understand and conceptualize the place of the library and information center in our global world. Each chapter ends with two helpful sections that present numerous examples and opportunities to apply newly gained information: Practice Your Skills and Discussion Questions."
9781548690519,"This special reprint edition of ""Jersey Cattle: Their Feeding and Management "" was written by the English Jersey Cattle Society, and first published in 1898. It is a truly antiquarian text at well over one-hundred years old. The Society's book delves into the feeding and management of Jersey cattle, and covers topics including General Management, Feeding, Calving, Calf Rearing, Cost of Keep and Dairying, among others. This book is an essential read for anybody interested in the Jersey breed in particular, or the history of agriculture in general. IMPORTANT NOTES: Please read BEFORE buying  THIS BOOK IS A REPRINT. IT IS NOT AN ORIGINAL COPY. This book is a reprint edition and is a perfect facsimile of the original book. It is not set in a modern typeface and has not been digitally rendered. As a result, some characters and images might suffer from slight imperfections, blurring, or minor shadows in the page background. This book appears exactly as it did when it was first printed."
