ISBN,書籍簡介
9781305955332,"Created for aspiring Health Information Management (HIM) and Health Information Technology (HIT) professionals in training, CASE STUDIES IN HEALTH INFORMATION MANAGEMENT, 3rd Edition helps readers bridge the gap between classroom theory and on-the-job application. More than a collection of fascinating cases, this versatile worktext challenges readers to work through problems with coordinating spreadsheets and forms while applying lessons from the classroom. Case studies feature the latest AHIMA domains and competencies, clearly mapping content in the readings to requirements for RHIA and RHIT certification exams in a handy correlation grid. New with the third edition, online learning resources avail readers to extra web content and reference materials, simulated professional forms, and spreadsheets for use in case-related exercises. The ideal complement to any HIM or HIT course, CASE STUDIES IN HEALTH INFORMATION MANAGEMENT, 3rd Edition is suitable for lab or practicum work, individual or group assignments, self-study, and as a professional desk reference."
9781976034442,0
9781483465999,"This resource will provide a framework to help answer the following questions: - What is the legal health record in a hybrid or electronic environment? - How is information protected, shared, and exchanged across jurisdictions? - How are data quality and data integrity maintained when data are collected from a number of different sources and devices? - Who is the custodian of the health record in a shared environment? - And so much more. Key Features: Offers considerations and guiding principles for the Canadian Health Information Management Lifecycle, such as: - collection and capture of data and organization of the data into information - maintenance and preservation in a secure and private environment - use and disclosure via authorized and authenticated paths - final disposition and destruction, and - evaluation and maintenance of the entire process. An eBook is also available."
9781119337188,"BESTSELLING GUIDE, UPDATED WITH A NEW INFORMATION FOR TODAY'S HEALTH CARE ENVIRONMENTHealth Care Information Systems is the newest version of the acclaimed text that offers the fundamental knowledge and tools needed to manage information and information resources effectively within a wide variety of health care organizations.It reviews the major environmental forces that shape the national health information landscape and offers guidance on the implementation, evaluation, and management of health care information systems. It also reviews relevant laws, regulations, and standards and explores the most pressing issues pertinent to senior level managers. It covers: Proven strategies for successfully acquiring and implementing health information systems.Efficient methods for assessing the value of a system.Changes in payment reform initiatives.New information on the role of information systems in managing in population health.A wealth of updated case studies of organizations experiencing management-related system challenges."
9781936654789,"Records and information management (RIM) professionals at all stages of their career can use Records and Information Management Core Competencies, 2nd Ed. to identify their proficiency in each of six defined domains: Business Functions, RIM/Information Governance Practices, Risk Management, Communications and Marketing, Information Technology, and Leadership. This publication, which supersedes 2007's first edition, has been updated to reflect the elevated skills RIM professionals need to 1) meet significantly more challenging technology issues; and 2) assume a more proactive and collaborative role to ensure a strong RIM foundation for their organization's information governance program."
9781440850134,"Many library managers learn financial management on the job, within the framework of a specific organization. The ""sink or swim"" method of skill acquisition can be effective, but it is inefficient, stressful, and typically leaves one lacking in foundational concepts and principles. This book provides a logical, organized way for library school students, librarians, and others such as library board members to gain the specific knowledge critical to the financial management of libraries and information centers.This book covers the full spectrum of topics and skills needed by today's managers--from the basics of budgeting, accounting, and financial statements to audits, forecasting, risk management, and revenue sources. There are even chapters on ethical considerations and advocacy. The skills readers will learn from this guide are of critical importance in this era of financial constraints and accountability at every level of the organization. Students in management and financial management courses and practicing library managers seeking to improve their financial management skills will find this book an essential tool for success."
9781584265146,0
9781970001198,"Recent years have seen a dramatic growth of natural language text data, including web pages, news articles, scientific literature, emails, enterprise documents, and social media such as blog articles, forum posts, product reviews, and tweets. This has led to an increasing demand for powerful software tools to help people analyze and manage vast amounts of text data effectively and efficiently. Unlike data generated by a computer system or sensors, text data are usually generated directly by humans, and are accompanied by semantically rich content. As such, text data are especially valuable for discovering knowledge about human opinions and preferences, in addition to many other kinds of knowledge that we encode in text. In contrast to structured data, which conform to well-defined schemas (thus are relatively easy for computers to handle), text has less explicit structure, requiring computer processing toward understanding of the content encoded in text. The current technology of natural language processing has not yet reached a point to enable a computer to precisely understand natural language text, but a wide range of statistical and heuristic approaches to analysis and management of text data have been developed over the past few decades. They are usually very robust and can be applied to analyze and manage text data in any natural language, and about any topic.  This book provides a systematic introduction to all these approaches, with an emphasis on covering the most useful knowledge and skills required to build a variety of practically useful text information systems. The focus is on text mining applications that can help users analyze patterns in text data to extract and reveal useful knowledge. Information retrieval systems, including search engines and recommender systems, are also covered as supporting technology for text mining applications. The book covers the major concepts, techniques, and ideas in text data mining and information retrieval from a practical viewpoint, and includes many hands-on exercises designed with a companion software toolkit (i.e., MeTA) to help readers learn how to apply techniques of text mining and information retrieval to real-world text data and how to experiment with and improve some of the algorithms for interesting application tasks. The book can be used as a textbook for a computer science undergraduate course or a reference book for practitioners working on relevant problems in analyzing and managing text data."
9780470034675," A comprehensively updated revision of a book regarded by many as one the leading and authoritative titles for practitioners, academics and students in the domain of information systems and technology (IS/IT) strategy.   Presents a structured framework with tools, techniques and ways of thinking which provide a practical approach to building a digital strategy, expressed primarily in the language of business and management. Brings together the implications of the significant advances in IT and the most useful current thinking, research, and experiences concerning the business impact and strategic opportunities created by IS/IT. Peppard and Ward discuss the key questions that managers have to grapple with of where, when and how to invest in IS/IT, which is why a IS/IT (or digital) strategy is required. "
9781590954379,"A Practical Study Guide For New Or Busy Managers In Libraries And Other Information Agencies  Learn Management Skills for Libraries and Information Agencies By Dr. Bob Pymn provides a concise, practical workbook to support busy managers. It is intended for those on the front lines, facing the challenge of supervising a busy work environment but aware they need to delve a little deeper into management issues to gain a broader understanding of why some approaches work and some do not. It is a basic introduction to established management principles and practices for library students and for library and information agency staff embarking on their first supervisory roles.  The author covers management functions; operational, strategic and event planning; human resource management including team building and managing change; financial and marketing management; security issues; and managing self. Ample use is made of scenarios, often based on real life incidents, to illustrate useful management skills or how to apply management theory to a particular situation. Included are plentiful, clear explanations, examples and practice exercises.  Learn Management Skills for Libraries and Information Agencies is one of the study guides in the Learn Library Skills series. Details of each publication are in the back of this book, or visit the publisher website for more information.  Dr. Bob Pymm is an adjunct senior lecturer in the School of Information Studies at Charles Sturt University, Australia. He retired from his full time position in 2015 following a career in teaching and working in the LIS field, during which time Bob managed Cataloguing and Collection Development departments in a large national institution. He taught for over 25 years at both college and university level and brings a broad range of practical and academic experience to the teaching of supervisory and management skills in our field."
9781118911013,"The 5th Edition of Jack Marchewka's Information Technology Project Management focuses on how to create measurable organizational value (MOV) through IT projects. The author uses the concept of MOV, combined with his own research, to create a solid foundation for making decisions throughout the project's lifecycle.The book's integration of project management and IT concepts provides students with the tools and techniques they need to develop in this field."
9781936654710,0
9783319207643,"Charlotte Weaver, RN, MSPH, PhD, FAAN is Sr VP, Chief Clinical Officer of Gentiva Health Services in Atlanta, GA Marion J. Ball, EdD is Senior Advisor, Research Industry Specialist in Healthcare Informatics with IBM Research in Baltimore MD George Kim MD FAAP is Adjunct Faculty, Division of Health Sciences Informatics at the Johns Hopkins University School of Medicine, Baltimore MD Joan M. Kiel, Ph.D, CHPS is Chairman, University HIPAA Compliance and Professor, Health Management Systems at Duquesne University in Pittsburgh, PA."
9783319307589,"Charlotte Weaver, RN, MSPH, PhD, FAAN is Sr VP, Chief Clinical Officer of Gentiva Health Services in Atlanta, GA Marion J. Ball, EdD is Senior Advisor, Research Industry Specialist in Healthcare Informatics with IBM Research in Baltimore MD George Kim MD FAAP is Adjunct Faculty, Division of Health Sciences Informatics at the Johns Hopkins University School of Medicine, Baltimore MD Joan M. Kiel, Ph.D, CHPS is Chairman, University HIPAA Compliance and Professor, Health Management Systems at Duquesne University in Pittsburgh, PA."
9781631571749,"Now more than ever, companies are faced with a critical and challenging truth. Today's customer is demanding more attention, superior service, and the expertise of a dedicated sales team. Suppliers must make dif cult choices to determine how to allocate limited resources, including which customers receive the highest level of service. Increasingly, supply side organizations are working to design and implement key account programs to meet or exceed these expectations. Key account management is a specific business strategy that involves complex sales processes, large-scale negotiations, and the alignment of multiple internal and external stakeholders. This multi-pronged process is anything but straightforward, and the business world is filled with examples of key account programs that have not achieved the expected results. This book addresses the strategic challenges facing top executives and sales leaders as they build strategies to better manage their key accounts. By leveraging up-to-date research, testimonials drawn from interviews with experienced practitioners, best practices of successful companies, along with straightforward practical guide- lines for executives and sales leaders, this book can serve as an instruction manual and toolbox for organizations working to achieve success through their key account strategies to meet the demand of their key customers."
9780071821650,"Publisher's Note: Products purchased from Third Party sellers are not guaranteed by the publisher for quality, authenticity, or access to any online entitlements included with the product.Best practices for protecting critical data and systemsInformation Assurance Handbook: Effective Computer Security and Risk Management Strategies discusses the tools and techniques required to prevent, detect, contain, correct, and recover from security breaches and other information assurance failures. This practical resource explains how to integrate information assurance into your enterprise planning in a non-technical manner. It leads you through building an IT strategy and offers anorganizational approach to identifying, implementing, and controlling information assurance initiatives for small businesses and global enterprises alike.Common threats and vulnerabilities are described and applicable controls based on risk profiles are provided. Practical information assurance application examples are presented for select industries, including healthcare, retail, and industrial control systems. Chapter-endingcritical thinking exercises reinforce the material covered. An extensive list of scholarly works and international government standards is also provided in this detailed guide.Comprehensive coverage includes: Basic information assurance principles and conceptsInformation assurance management systemCurrent practices, regulations, and plansImpact of organizational structureAsset managementRisk management and mitigationHuman resource assuranceAdvantages of certification, accreditation, and assuranceInformation assurance in system development and acquisitionPhysical and environmental security controlsInformation assurance awareness, training, and educationAccess controlInformation security monitoring tools and methodsInformation assurance measurements and metricsIncident handling and computer forensicsBusiness continuity managementBackup and restorationCloud computing and outsourcing strategiesInformation assurance big data concerns"
9781557536648,"Joyce Ray teaches digital preservation and digital curation in the Johns Hopkins University graduate museum studies program. She is currently a visiting professor in the University College London Department of Information Studies. From 1997 to 2011 she was Associate Deputy Director for Library Services at the Institute of Museum and Library Services in Washington, DC, where she directed competitive grant programs that awarded more than $40 million annually for innovative research, practice and education in library services and related topics. She previously held positions at the US National Archives and Records Administration and the University of Texas Health Science Center at San Antonio Library. She has both an MLS and a PhD in history from the University of Texas at Austin."
9781597499958,0
9781555709099,0
9780132886871," IBM's Definitive One-Stop Guide to IMS Versions 12, 11, and 10: for Every IMS DBA, Developer, and System Programmer   Over 90% of the top Fortune(R) 1000 companies rely on IBM's Information Management System (IMS) for their most critical IBM System z(R) data management needs: 50,000,000,000+ transactions run through IMS databases every day. What's more, IBM continues to upgrade IMS: Versions 12, 11, and 10 meet today's business challenges more flexibly and at a lower cost than ever before. In An Introduction to IMS, Second Edition, leading IBM experts present the definitive technical introduction to these versions of IMS. More than a complete tutorial, this book provides up-to-date examples, cases, problems, solutions, and a complete glossary of IMS terminology. Prerequisite reading for the current IBM IMS Mastery Certification Program, it reflects major recent enhancements such as dynamic information generation; new access, interoperability and development tools; improved SOA support; and much more. Whether you're a DBA, database developer, or system programmer, it brings together all the knowledge you'll need to succeed with IMS in today's mission critical environments.  Coverage includes    What IMS is, how it works, how it has evolved, and how it fits into modern enterprise IT architectures Providing secure access to IMS via IMS-managed application programs Understanding how IMS and z/OS(R) work together to use hardware and software more efficiently Setting up, running, and maintaining IMS Running IMS Database Manager: using the IMS Hierarchical Database Model, sharing data, and reorganizing databases Understanding, utilizing, and optimizing IMS Transaction Manager IMS application development: application programming for the IMS Database and IMS Transaction Managers, editing and formatting messages, and programming applications in Java(TM) IMS system administration: the IMS system definition process, customizing IMS, security, logging, IMS operations, database and system recovery, and more IMS in Parallel Sysplex(R) environments: ensuring high availability, providing adequate capacity, and balancing workloads "
9781597496155,0
9781446530993,"This volume contains a guide to running a successful and profitable farm, focusing on account keeping. The management of money is one of the most important factors of farming, and this volume aims to walk the reader through what must be done and avoided to ensure fiscal success. ""Farm Accounts and Farm Management"" will be of considerable utility to prospective and existing farmers alike, and it not to be missed by collectors of vintage farming literature. Contents include: ""Agriculture Follows Nature Study"", ""Not Enough Bookkeeping on the Farm"", ""The Inventory"", ""Characteristics of a Good Set of Books"", ""Teach Children to Make Inventories"", ""Farm Records"", ""Milk Records"", ""Teach Girls Household Accounting"", etc. Many vintage books such as this are increasingly scarce and expensive. It is with this in mind that we are republishing this volume now in an affordable, modern, high-quality edition complete with a specially-commissioned new introduction on farming."
9781446531471,"This vintage guide to farming sheep contains information on every step of the process, from breeding and rearing to wool production and beyond. With detailed descriptions and clear explanations, ""Sheep Production"" is highly recommended for anyone with a practical interest in keeping sheep for pleasure or for profit. Contents include: ""Sheep Farming"", ""Sheep Production"", ""Starting A Flock"", ""Selection And Management Of The Ram"", ""Management At Breeding Time"", ""Winter Care During Gestation Period"", ""Care At Lambing Time"", ""Care Of Ewe And Lambs After Lambing"", ""Management Of Sheep"", ""Sheep ""Feeding"", ""Suggested Rations"", ""Parasites And Ailments Of Sheep"", etc. Many vintage books such as this are increasingly scarce and expensive. It is with this in mind that we are republishing this volume now in an affordable, modern, high-quality edition complete with a specially-commissioned new introduction on sheep farming."
9781849280433,0
9780615357546,"Dr. Chisholm's book is an important work and should be required reading for all senior executives, regulators, and market authorities. What we need before we can develop systems, is a set of clear cut definitions of each data element. This is an excellent book on definitions for data modelers and data managers. Data modeling is the art of defining data elements and is all about definitions. Establishing a common understanding of financial instruments, including the nuances of their underlying contractual structure, is the very foundation of systemic oversight, business process automation, and analytical modeling."
9780073402932,"Corporate Information Strategy and Management: Text and Cases 8/e by Applegate, Austin, and Soule is written for students and managers who desire an overview of contemporary information systems technology management. This new edition examines how information technology (IT) enables organizations to conduct business in radically different and more effective ways. The author's objective is to provide readers with a better understanding of the influence of twenty-first century technologies on business decisions. The 8th edition discusses today's challenges from the point of view of the executives who are grappling with them. This text is comprised of an extensive collection of Harvard Business cases devoted to Information Technology."
9781932828047,"t last, a simple, well-written survey of process redesign that will help you transform your organization into a world-class competitor. Author Dan Madison explains the evolution of work management styles, from traditional to process-focused, and introduces the tools of process mapping, the roles and responsibilities of everyone in the organization, and a logical ten-step redesign methodology. Thirty-eight design principles allow readers to custom-fit the methodology to the particular challenges within their own organizations. Additional chapters by guest writers Jerry Talley, Ph.D., and Vic Walling, Ph.D., discuss cross-department process management and using computer simulation in redesign, respectively. Inside you'll find detailed, illustrated discussions about: * The importance of process* Process mapping* Key stakeholders' roles and responsibilities* The ten-step process redesign methodology* Process improvement and creating the process team* The four lenses of analysis* Customer report cards, benchmarking, and best practices* Process redesign case studies* Design principles for process redesign* Barriers to process redesign* Becoming a process-focused organization* Building cross-department process management* Using information technology in process managemen"
9781446504871,"This book contains a complete guide to breeding pigeons for profit, with information on common problems, selection, necessary equipment, ailments and diseases, marketing, and many other related aspects. An accessible and comprehensive guide, ""Practical Pigeon Production"" will be of utility to anyone occupied in keeping pigeons for economic gain, and would make for a useful addition to collections of allied literature. Many vintage books such as this are becoming increasingly rare and expensive. We are republishing this volume now in an affordable, modern, high-quality edition complete with a specially commissioned new introduction on pigeons."
9781260570335,"Fundamentals of Investments is aimed at the introductory investments class with students who have relatively little familiarity with investments. The text is written in a relaxed, informal style that engages the student and treats him or her as an active participant rather than a passive information absorber. Fundamentals appeals to intuition and basic principles whenever possible because the authors found that this approach effectively promotes understanding. The text also makes extensive use of examples, drawing on material from the world around us and using familiar companies wherever appropriate. Throughout, the text strikes a balance by introducing and covering the essentials while leaving some of the details to follow-up courses. Topics are organized in a way that would make them easy to apply-whether to a portfolio simulation or to real life-and support these topics with hands-on activities. This ninth edition provides a terrific framework and introduction for students looking to pursue a career in investments-particularly for those interested in eventually holding the CFA charter."
9781578201044,0
9789862800898,本版新增的內容　　第十二版與以往不同的特點為新增了許多開放式、封閉式與互動式的個案研討。文字、圖、表與個案皆為來自產業與管理資訊系統研究至2010年11月的最新訊息。新的特色‧每章有更多的問題討論。‧本書中處處可見管理清單，它是設計用來協助未來的管理者做出更佳的決策。新的主題‧探討範圍延伸至商業智慧與商業分析‧協同系統與工具‧雲端運算‧以雲端為基礎的軟體服務和工具‧Windows 7與行動作業系統‧新興的行動數位平台‧Office 2010與Google 的小應用程式（Apps）‧綠色運算‧4G 網路 ‧網路中立‧一致性管理‧擴增實境‧搜尋引擎優化（SEO）‧電子商務的免費增值訂價模式‧集體創作與群眾智慧‧電子商務獲利模式‧建立一個電子商務網站‧企業流程管理‧雲端與行動平台的安全性問題
9789862800157,0
9789571144030,0
9789867491817,0
9789861570488,0
9789867497161,0
