ISBN,書籍簡介
9781547416516," The introduction of online Bitcoin trading platforms has enabled Bitcoin to become mainstream in today's economy, making headline news with soaring valuations, and proving that the underlying Blockchain protocol can bring trust to a trustless world across a broad spectrum of industries and business processes. How Bitcoin and Blockchain Are Changing the World explains Bitcoin and other virtual currencies, the advantages and disadvantages of virtual currencies, using virtual currency for making transactions, why its value has dramatically fluctuated, and why other virtual currencies will take Bitcoin's place in the economic future. In addition, this book delves into the technical side of the Blockchain technology, including a discussion of the cryptographic technology protocol used for digital payments transmitted over the Internet.   Through illustrations and case studies, Marti Tirinnanzi discusses how and why different countries have adopted Bitcoin and other virtual currencies. This insightful book also examines money laundering and other legal and legislative issues attached to these virtual payments and discusses actions taken by government agencies to either supervise Bitcoin transactions, or use sovereign digital currencies to enhance efficiencies within federal and state treasuries. The book will help readers understand how Bitcoin and Blockchain are changing the approach to doing business in everything from financial services, healthcare, to the Internet of things (IoT). "
9783110690965,"Daniel Burgwinkel, St. Gallen.  "
9789811221521,"This textbook focuses on distributed ledger technology (DLT) and its potential impact on society at large. It aims to offer a detailed and self-contained introduction to the founding principles behind DLT accessible to a well-educated but not necessarily mathematically oriented audience. DLT allows solving many complicated problems arising in economics, banking, and finance, industry, trade, and other fields. However, to reap the ultimate benefits, one has to overcome some of its inherent limitations and use it judiciously. Not surprisingly, amid increasing applications of DLT, misconceptions are formed over its use. The book thoroughly dispels these misconceptions via an impartial assessment of the arguments rooted in scientific reasoning.Blockchain and Distributed Ledgers: Mathematics, Technology, and Economics offers a detailed and self-contained introduction to DLT, blockchains, and cryptocurrencies and seeks to equip the reader with an ability to participate in the crypto economy meaningfully."
9789811221514,"This textbook focuses on distributed ledger technology (DLT) and its potential impact on society at large. It aims to offer a detailed and self-contained introduction to the founding principles behind DLT accessible to a well-educated but not necessarily mathematically oriented audience. DLT allows solving many complicated problems arising in economics, banking, and finance, industry, trade, and other fields. However, to reap the ultimate benefits, one has to overcome some of its inherent limitations and use it judiciously. Not surprisingly, amid increasing applications of DLT, misconceptions are formed over its use. The book thoroughly dispels these misconceptions via an impartial assessment of the arguments rooted in scientific reasoning.Blockchain and Distributed Ledgers: Mathematics, Technology, and Economics offers a detailed and self-contained introduction to DLT, blockchains, and cryptocurrencies and seeks to equip the reader with an ability to participate in the crypto economy meaningfully."
9783030750244,"Ahmed Imteaj is currently a PhD Candidate and Graduate Assistant at the Knight Foundation School of Computing and Information Sciences, Florida International University, under the supervision of Professor M. Hadi Amini. He is also a research lab member of Sustainability, Optimization, and Learning for InterDependent networks laboratory (solid lab) at Florida International University. His research interests span federated learning, machine learning, internet of things (IoT), smart systems, and Blockchain. He holds a B.Sc. degree in Computer Science and Engineering from Chittagong University of Engineering and Technology (CUET), Bangladesh in 2015. From 2015 to 2018, he worked as a Lecturer at International Islamic University Chittagong (IIUC), Chittagong, Bangladesh. Ahmed's work on federated learning for IoT environments is the recipient of the best paper award from ""2019 IEEE Conference on Computational Science & Computational Intelligence"" and won the second place at 2021 Florida International University Graduate Student Appreciation Week. He has published more than 30 referred journals and conference papers.M. Hadi Amini is an Assistant Professor at School of Computing and Information Sciences at Florida International University. He is the director of Sustainability, Optimization, and Learning for InterDependent networks laboratory (www.solidlab.network). He received his Ph.D. in Electrical and Computer Engineering from Carnegie Mellon University in 2019, where he received his M.Sc. degree in 2015. He also holds a doctoral degree in Computer Science and Technology. Prior to that, he received M.Sc. degree from Tarbiat Modares University in 2013, and the B.Sc. degree from Sharif University of Technology in 2011. His research interests include distributed optimization and learning algorithms, distributed computing and intelligence, sensor networks, interdependent networks, and cyber-physical-social resilience. Application domains include smart cities, energy systems, transportation electrification, and healthcare. Prof. Amini is a member of ACM and IEEE, and life member of IEEE-Eta Kappa Nu (IEEE-HKN), the honor society of IEEE. He served as President of Carnegie Mellon University Energy Science and Innovation Club; as technical program committee of several IEEE and ACM conferences; and as the lead editor for a book series on ''Sustainable Interdependent Networks'' since 2017. He also serves as Associate Editor of SN Operations Research Forum and International Transactions on Electrical Energy Systems. He has published more than 100 refereed journal and conference papers, and book chapters. He edited/authored six books. He is the recipient of Excellence in Teaching Award from the School of Computing and information Sciences at Florida International University in 2020, the best paper award from 2019 IEEE Conference on Computational Science & Computational Intelligence"", best reviewer award from four IEEE Transactions, the best journal paper award in ""Journal of Modern Power Systems and Clean Energy"", and the dean's honorary award from the President of Sharif University of Technology. (Homepage: www.hadiamini.com Lab website: www.solidlab.network)Panos M. Pardalos serves as Distinguished Professor of Industrial and Systems Engineering at the University of Florida. Additionally, he is the Paul and Heidi Brown Preeminent Professor in Industrial & Systems Engineering. He is also an a_liated faculty member of the Computer and Information Science Department, the Hellenic Studies Center, and the Biomedical Engineering Program. He is also the Director of the Center for Applied Optimization. Dr. Pardalos is a world leading expert in global and combinatorial optimization. His recent research interests include network design problems, optimization in telecommunications, e-commerce, data mining, biomedical applications, and massive computing. He has co-authored and co-edited more than 30 books, as well as publishing more than 600 journal articles and conference proceedings. Prof. Pardalos is a Fellow of AAAS (American Association for the Advancement of Science), Fellow of American Institute for Medical and Biological Engineering (AIMBE), and EUROPT. He is a Distinguished International Professor by the Chinese Minister of Education; Honorary Professor of Anhui University of Sciences and Technology, China; Elizabeth Wood Dunlevie Honors Term Professor; Honorary Doctor, V.M. Glushkov Institute of Cybernetics of The National Academy of Sciences of Ukraine; Foreign Associate Member of Reial Academia de Doctors, Spain; and Advisory board member of the Centre for Optimisation and Its Applications, Cardi_ University, UK. He is also the recipient of UF 2009 International Educator Award; Medal (in recognition of broad contributions in science and engineering) of the University of Catani, Italy; EURO Gold Medal (EGM); Honorary Doctor of Science Degree, Wilfrid Laurier University, Canada; Senior Fulbright Specialist Award; University of Florida Research Foundation Professorship; and IBM Achievement Award."
9783110661149,"Blockchain and artificial intelligence are perhaps the two most significant disruptive technologies this century and both will significantly rewire the world of global financial markets and the world in which we live. While blockchain offers a number of significant advantages over traditional forms of finance including lower cost and massive increases in operational efficiencies of traded markets, property records and a whole host of transaction processes, artificial intelligence is moving fast from basic structured machine learning doing menial yet important big data tasks like credit card fraud detection to predictive analysis and real-time real-world risk management and investment decision making. There is still a lot of confusion in the market about cryptocurrencies, bitcoin and the underlying blockchain technology. Blockchain and Artificial Intelligence highlights the underlying technologies of blockchain and the differences between cryptocurrencies and blockchain financial applications. It explores the current AI offerings and gives a vision of the fast-moving developments in this area including the many solutions that are expected to revolutionize the way financial and commodity markets will operate in the future."
9781803572512,0
9781728404608,0
9789811236501,"Big data has been upgraded to our national strategy and has become a catalyst for national and local economic development. With the further promotion of big data and artificial intelligence (AI), the new business model needs to optimize and upgrade. The integration of the blockchain industry will fully implement the digital China strategy and promote the application of big data in China.This unique compendium gives a comprehensive understanding of the blockchain content through the path of technological innovation. It enables readers to fully understand the role of blockchain in promoting the digital economy.The volume will be a useful reference guide for relevant personnel in state ministries and commissions, state-owned enterprises, big data, AI, as well as teachers, researchers and students in higher education institutions."
9783030656904,"Dr. Tanupriya Choudhury received his bachelor's degree in CSE from West Bengal University of Technology, Kolkata, India, and master's Degree in CSE from Dr. M.G.R University, Chennai, India.He has received his PhD degree in the year 2016. He has Ten years experience in teaching as well as in Research. Currently he is working as an Associate Professor in dept. of CSE at UPES Dehradun. Recently he has received Global Outreach Education Award for Excellence in best Young researcher Award in GOECA 2018 His areas of interests include Human computing, Soft computing, Cloud computing, Data Mining etc.He has filed 14 patents till date and received 16 copyrights from MHRD for his own softwares.He has been associated with many conferences in India and abroad.He has authored more than 85 research papers till date.He has delivered invited talk and guest lecture in Jamia Millia Islamia University, Maharaja Agersen college of Delhi University, Duy Tan University Vietnam etc. He has been associated with many conferences throughout India as TPC member and session chair etc. He is a lifetime member of IETA, member of IEEE, and member of IET(UK) and other renowned technical societies. He is associated with Corporate and he is Technical Adviser of DeetyaSoft Pvt. Ltd. Noida, IVRGURU, and Mydigital360 etc.He is holding the post of Secretary in IETA (Indian Engineering Teacher's Association-India), He is also holding the Advisor Position in INDO-UK Confederation of Science, Technology and Research Ltd., London, UK and International Association of Professional and Fellow Engineers-Delaware-USA.  Abhirup Khanna is currently working as an Assistant Professor at the University of Petroleum and Energy Studies, India. He has authored numerous research publications in areas of Mobile Cloud Computing, Internet of Things, Blockchain Technology and Cloud Computing at Scopus and SCI-indexed international journals and conferences. He is the author for one of the first books written on Mobile Cloud Computing. Abhirup has been a part of various editorial committees for the likes of Elsevier, Springer, Wiley, and IEEE. Dr Teoh Teik Toe is a Senior Lecturer in the College of Business at Nanyang Business School. From the Nanyang Business School, Dr. Teoh has worked with A*STAR, SUTD and NTU for more than a decade and has published in more than 40 journals, conference papers and book chapters around the world including Europe, Japan, Korea and Australia. He is a director of listed company NTPM Berhad, and has been in the audit committee for more than 10 years, handling Accounting and Business-Related Functions as a Certified Public Accountant (CPA) and Certified Financial Analyst (CFA). He has a Doctor of Philosophy in Computer Engineering, Nanyang Technological University, Singapore, and a Doctor of Business Administration, University of Newcastle, Australia. Madhu Khurana is a Cyber Security Instructor and Cyber Security Researcher, with a strong technical understanding of networking, computing and cyber security. having achieved multiple degrees including a Pursuing Doctorate (PhD) in Cyber Security. She has an extensive flair of Research and writing, has published more than 15 Research Papers on Cyber Security and presented them at International Conferences. She has more than 15 years of experience in development and delivery of technical training and is certified by Microsoft in Python programming. Nhu Gia Nguyen received the PhD degree in Computer Science from Ha Noi University of Science- Viet Nam National University, Vietnam. Now, he is Dean of Graduate School- Duy Tan University, Viet Nam. He has over 15 years of experience in training management, implementing 14 projects to open undergraduate and graduate training professions. He has a total academic teaching experience of 19 years with more than 60 publications in reputed international conferences, journals and online book chapter contributions (Indexed By: SCI, SCIE, SSCI, Scopus, DBLP). His area of research includes: Network Communication, Security and Vulnerability, Network Performance Analysis and Simulation, Computational Intelligence. Recently, he has been the technique program committee, the technique reviews, the track chair for international conferences: FICTA 2014, ICICT 2015, INDIA 2015, IC3T 2015, INDIA 2016, FICTA 2016, IC3T 2016, IUKM 2016, INDIA 2017, FICTA 2017, FICTA 2018, INISCOM 2018, INISCOM 2019 under Springer-ASIC/LNAI Series. Presently he is Associate Editors of the International Journal of Synthetic Emotions (IJSE) and he authored 6 Computer Science books by Springer, IGI Global, CRC, Wiley Publication."
9781803349459,"Bitcoin is certainly one of the biggest regrets of those who knew of its existence from the very onset and didn't invest in it for fear of what could happen. The multiple folds of income amassed over the years from investors in Bitcoin have skyrocketed even more in recent years. 2020 and 2021 saw one of the most crypto-wise eras, and we now see more Crypto investors and crypto coin holders. This has further increased the scalability of crypto coins and the trust people have in them, therefore, allowing more people to invest their money and make it work for them.  If you have missed out on this initial ride and want to hop on the train, then this book is for you. Are you looking to generate passive income and start your journey into financial freedom? If yes, then this book has been carefully researched and written just for you! The writer has taken his time to lay out all you need to know about the crypto verse avoiding unnecessary technical jargon so you can perfectly understand.  In this book, you will learn about the hype & steady growth of the cryptocurrency market, what currencies you should consider investing in, and how to start effectively making money now. This book extensively discusses the what, the how, and the when to invest in cryptocurrency while carefully laying down the pragmatic application of its teachings. Either you have zero knowledge or little knowledge about trading or investing in cryptocurrency; this book will be a guide that helps you leverage the crypto market like many other experts and start your path to financial freedom.What are you waiting for? Scroll to the top of the page and click the ""BUY NOW"" button to grab your copy now!"
9781032093888,"Blockchain technology is poised to revolutionize more than just payment and crypto-currency. Many vertical industries will be reshaped by the new trusted data models enabled and inspired by the blockchain - healthcare is no exception. In fact, healthcare may hold the greatest opportunities for meaningful use of the technology. Early pioneers have explored some of the first use cases for medical payments, electronic health records, HIPAA/data privacy, drug counterfeiting, and credentialing of healthcare professionals. We have only begun to scratch the surface in how to automate the complexities of today's healthcare systems and design new systems which focus on trust, transparency and the alignment of incentives.Metcalf, Bass, Dhillon, and Hooper have curated a collection of examples based on the fundamentals of blockchain that build upon the early successes and examples that point to the future. After a brief introduction to bitcoin, blockchain and the protocols available, a getting-started guide is presented specific to health and healthcare. The authors discuss the complexities and possibilities of smart contracts and some of the early consortia that are exploring the possibilities. Examples and use cases are found throughout the book, with specific sections that cover the more sophisticated and far-reaching examples which have the potential to scale at the industry-level. In addition, a discussion of integrating blockchain technology into other advanced healthcare trends and IT systems - such as telemedicine, artificial intelligence, machine learning, the Internet of Things, value-based payments, patient engagement solutions, big data solutions, medical tourism, and precision medicine/genetic therapies among many others are presented. The final section provides a glimpse into the future using blockchain technology and examples of research projects that are still in labs across the globe. The appendices may prove particularly useful for additional details on how to get started, including resources and organizations specifically focusing on blockchain and distributed ledger solutions."
9781032087269,"Kuan-Ching Li is a professor in the Department of Computer Science and Information Engineering at Providence University, TaiwanXiaofeng Chen is a professor in the School of Cyber Engineering at Xidian University, ChinaHai Jiang is a professor in the Department of Computer Science at Arkansas State University, USAElisa Bertino is Samuel Conte Professor of Computer Science at Purdue University"
9783030717872,"Mubashir Husain Rehmani received his Ph.D. from the University Pierre and Marie Curie, France, in 2011, and is currently working as an Assistant Lecturer at Munster Technological University (MTU), Ireland. He was previously affiliated with the University of Paris-Est, France, COMSTATS University, Pakistan, and Waterford Institute of Technology, Ireland. He is currently an Area Editor of IEEE COMMUNICATIONS SURVEYS AND TUTORIALS and the Associate Editor of IEEE Transactions on Green Communication and Networking, IEEE Access Journal, Elsevier Future Generation Computer Systems journal, Elsevier Computers and Electrical Engineering (CAEE) Journal, Elsevier Journal of Network and Computer Applications (JNCA), Springer Wireless Networks Journal, and the Journal of Communications and Networks (JCN). He is also serving as Column Editor (Book Reviews) for IEEE COMMUNICATIONS MAGAZINE.  A senior member of both the IEEE and IEEE Communications Society, Dr. Rehmani is an Author/Editor of several books published by prestigious publishers such as John Wiley, Springer, CRC Press - Taylor and Francis Group, USA, and IGI Global USA. He has published over 110 journal papers, 14 book chapters, and more than 10 international conference papers. He received the ""Best Researcher of the Year 2015 of COMSATS Wah"" award in 2015. He received the certificate of appreciation, ""Exemplary Editor of the IEEE Communications Surveys and Tutorials for the year 2015"" from the IEEE Communications Society. He received Best Paper Award from IEEE ComSoc Technical Committee on Communications Systems Integration and Modeling (CSIM), in IEEE ICC 2017. He consecutively received research productivity award in 2016-17 and also ranked # 1 in all Engineering disciplines from Pakistan Council for Science and Technology (PCST), Government of Pakistan. He received the Best Paper Award in 2017 from Higher Education Commission (HEC), Government of Pakistan. He is the recipient of Best Paper Award in 2018 from Elsevier Journal of Network and Computer Applications. He has been selected for inclusion on the annual Highly Cited Researchers(TM) 2020 list from Clarivate. His performance in this context features in the top 1% in the field of Computer Science."
9781801569491,"⭐⭐⭐⭐⭐50% Discount for Bookstores⭐⭐⭐⭐⭐This book shows you how to compete with banks. Bitcoin and Ethereum have features that empower entrepreneurs to disrupt finance. The functions of banks are now in the cross-hairs of open-source groups and software entrepreneurs. We look at what you can build for the future beyond traditional banking. Banks used to be protected from disruption by the nature of fiat money. The lack of competitors has made them slow to innovate. With Bitcoin and Ethereum, software entrepreneurs can spot opportunities to offer state-of-the-art financial services and soar above the status quo. Software entrepreneurs are familiar with the methods to build a startup. They can raise funds, build a prototype, reach product-market fit, and grow. Bitcoin opens the field of money and finance for genuine competition. Banks used to be protected from disruption by the nature of fiat money. The lack of competitors has made them slow to innovate. With Bitcoin and Ethereum, startups can take finance into the 21st century. The global financial system has glaring problems that stem from the centralized power of national governments and banks. New organizations that rely on advanced forms of money and assets will help our economy transcend this central power. Software entrepreneurs learn to spot opportunities in finance and offer state-of-the-art financial services. By relying on Bitcoin and Ethereum, they soar above the status quo. This book shows them the 'why' and 'how.'"
9783030443399,"Dr. Horst Treiblmaier is Full Professor and Head of the Department of International Management at Modul University, Vienna, Austria. Previously, he was a Visiting Professor at Purdue University, UCLA and UBC. He participated in various EU programs and is a Research Associate at the UCL Centre for Blockchain Technologies. His work has appeared in journals such as Information Systems Journal, Structural Equation Modeling, The Data Base for Advances in Information Systems, Business & Information Systems Engineering, Internet Research, Information & Management, Communications of the AIS, Journal of Electronic Commerce Research and Schmalenbach Business Review.Dr. Clohessy is a lecturer in business information systems and transformative technologies at GMIT School of Business since September 2018. Prior to this post, Trevor was a Lecturer at the National University of Ireland Galway business school and a post-doctoral researcher with Lero. His research interests include blockchain, business analytics, digital transformation, digital addiction, digital politics and cloud computing. Trevor completed his PhD from the National University of Ireland Galway. His doctoral thesis investigated the digital transformation impact of cloud computing on IT service providers. Trevor also holds a MSc in Information Systems Management and a MSc in Occupational Health and Safety from the National University of Ireland Galway. Trevor has lectured business information systems, business analytics, databases, and cloud computing topics in traditional classroom settings and blended / online learning settings. Trevor and his research associates conducted one of the first blockchain Irish organisational readiness reports in 2018 entitled ""Organisational factors that influence the Blockchain adoption in Ireland."""
