ISBN,書籍簡介
9780136619949,"A hands-on book that explains concepts by doing, Introduction to Game Design, Prototyping, and Development, Third Edition,  takes readers through the process of making both paper and digital game prototypes. Rather than focusing on a single tutorial, as most Unity books have done, this book explores several small prototypes, reinforcing critical concepts through repetition from project to project. Author Jeremy Gibson Bond's approach creates a stable of base projects that serve as starters for readers looking to create their own games), while skipping the aspects of project creation (e.g. modeling, animation, etc.) that are less central to this book. Intermediate readers may browse this book for a tutorial that clarifies the specific prototyping or programming concept that they wish to learn.  This book begins with an introduction to general game design concepts and basic programing concepts. C# is the chosen language used in this book, and it is easy to learn and enforces good coding practices. Game prototyping and programming tutorials use Object-Oriented Programming (OOP), the standard for coding over the past 30+ years, in addition to the new Data-Oriented Technology Stack (DOTS) and Entity Component System (ECS), providing a well-rounded approach. Game development concepts covered help readers find further resources to expand their game design knowledge. "
9780137440849,"Dax Gazaway was raised in a gamer family. His parents met in a Dungeons & Dragons group, and he was surrounded with games being played and made. From a very early age, Dax was fascinated by the numbers in games. He would pour over monster manuals and board game books, dissecting the rules to figure out how the systems worked.  Dax started in the video game industry in the late 1990s. During his tenure in the industry, Dax pioneered game system design at multiple independent and AAA studios, helping to refine and define the subdiscipline. In recent years, he has become a course director at Full Sail University, specializing in teaching new students the concepts and tools of the system designer. Dax has created new curriculum and multiple classes for system design students, and he teaches introduction to system design courses.  The following is a selection of Dax's game design credits:  Star Wars: Obi-Wan, System and level designer Star Wars: Jedi Starfighter, System and level designer and QA liaison Star Wars: Bounty Hunter: System and level designer Gladius: System designer Syphon Filter franchise: Lead designer and system designer Spider Man 3: Lead system designer Marvel Ultimate Alliance 2: Lead system designer Guitar Hero franchise: System designer  In addition, Dax has been the studio lead system designer for Row Sham Bow Games and a system design consultant for multiple projects. "
9780262043915,"An introduction to the basic concepts of game design, focusing on techniques used in commercial game production.This textbook by a well-known game designer introduces the basics of game design, covering tools and techniques used by practitioners in commercial game production. It presents a model for analyzing game design in terms of three interconnected levels--mechanics and systems, gameplay, and player experience--and explains how novice game designers can use these three levels as a framework to guide their design process. The text is notable for emphasizing models and vocabulary used in industry practice and focusing on the design of games as dynamic systems of gameplay.The book first introduces the core model and framework for analyzing and designing games. It then discusses the three levels in detail, explaining player experience and identifying design goals; introducing low-level structural analysis of gameplay in terms of basic mechanics; describing how mechanics build up into systems; and presenting concepts for understanding gameplay, defined as the dynamic behavior of players when they interact with mechanics and systems. Finally, the book offers students advice on creating game prototypes using an iterative, user-centered process. Each chapter offers a set of exercises for individuals and design challenges for groups."
9781534170582,"Esports competitions have become a world-wide phenomenon with millions of viewers and fans. Learn about the different components of creating a game, from coding and art development, to marketing and advertisements. Aligned with curriculum standards, these books also highlight key 21st Century content including information, media, and technology skills. Engaging content and hands-on activities encourage creative and design thinking. Book includes table of contents, glossary, index, author biography, and sidebars."
9781534168909,"Esports competitions have become a world-wide phenomenon with millions of viewers and fans. Learn about the different components of creating a game, from coding and art development, to marketing and advertisements. Aligned with curriculum standards, these books also highlight key 21st Century content including information, media, and technology skills. Engaging content and hands-on activities encourage creative and design thinking. Book includes table of contents, glossary, index, author biography, and sidebars."
9781138632059,"The Art of Game Design guides you through the design process step-by-step, helping you to develop new and innovative games that will be played again and again. It explains the fundamental principles of game design and demonstrates how tactics used in classic board, card and athletic games also work in top-quality video games. Good game design happens when you view your game from as many perspectives as possible, and award-winning author Jesse Schell presents over 100 sets of questions to ask yourself as you build, play and change your game until you finalise your design. This latest third edition includes examples from new VR and AR platforms as well as from modern games such as Uncharted 4 and The Last of Us, Free to Play games, hybrid games, transformational games, and more.Whatever your role in video game development an understanding of the principles of game design will make you better at what you do. For over 10 years this book has provided inspiration and guidance to budding and experienced game designers - helping to make better games faster. "
9781543571516,Skyrim with its in-depth world building and talented design didn't just happen overnight. It took years of planning and hard work. But every game designer started where you are now. Find out how you can get started to make successful game design.
9781094914244,"Take your games to the next level with advice from more than 100 of the best board game designers in the world. Game design is hard. We all need sound advice to guide our work and help us become better at the craft. In this book, you'll find incredible wisdom and insight from the top designers in the industry today. You will learn: The advice Rob Daviau would give his younger self.How Matt Leacock gets into the zone and flow of design.Lessons Jamey Stegmaier learned from his biggest failure.Donald X. Vaccarino's advice on pitching a game to a publisher.The behavior that has helped Ryan Laukat's designs dramatically improve. What Bruno Cathala would tell you after a discouraging playtest.And much more!"
9781584237303,0
9781138631540,"Can we learn through play? Can we really play while learning?Of course! But how?!We all learn and educate others in our own unique ways. Successful educational games adapt to the particular learning needs of their players and facilitate the learning objectives of their designers. Educational Game Design Fundamentals embarks on a journey to explore the necessary aspects to create games that are both fun and help players learn. This book examines the art of educational game design through various perspectives and presents real examples that will help readers make more informed decisions when creating their own games. In this way, readers can have a better idea of how to prepare for and organize the design of their educational games, as well as evaluate their ideas through several prisms, such as feasibility or learning and intrinsic values.Everybody can become education game designers, no matter what their technical, artistic or pedagogic backgrounds. This book refers to educators and designers of all sorts: from kindergarten to lifelong learning, from corporate training to museum curators and from tabletop or video game designers to theme park creators!"
9781718751064,"Are you a video game design student? Did you know there was more to it than merely design? There is an entire business surrounding the video game industry, and chances are you do not even know how it works.This is because most video game design schools do not teach business; they go straight to the fun stuff, which may be good...until you find out that you can't locate a job without knowledge of how the video game industry works.This book explains everything you need to know, from design and development, to business, and more. Let this book envelop your life's work  And don't forget: you have absolute power"
9780134659862,"Master the Unity Game Engine to Design and Develop Games for Web, Mobile, Windows, macOS, and More   If you want to design and develop games, there's no substitute for strong hands-on experience with modern techniques and tools--and that is exactly what this book provides. The first edition was frequently the top-selling game design book on Amazon, with more than 70% of the reviews being 5 stars. In a testament to the iterative process of design, this new edition includes hundreds of improvements throughout the text, all designed to make the book easier to understand and even more useful. This book was written with Unity 2017; the book.prototools.net website will cover changes for later versions of the software. Award-winning game designer and professor Jeremy Gibson Bond has spent more than a decade teaching game design and building great games. In that time, his most successful students have been those who combine knowledge of three critical disciplines: game design theory, rapid iterative prototyping, and practical programming. In this book, Bond distills the most important aspects of all three disciplines into one place. Part I: Game Design and Paper Prototyping - The Layered Tetrad framework: a synthesis of 50 years of game design theory - Proven practices for brainstorming and refining game designs through the iterative process of design - Methods and tools to manage game projects and small teams - Processes to make playtesting and feedback easier Part II: Digital Prototyping with Unity and C# - Chapters that guide you through learning C# the right way - Instruction that takes you from no prior programming knowledge through object-oriented programming - Deep exploration of Unity, today's most popular game engine on both macOS and Windows - Methods for understanding and debugging code issues you encounter Part III: Game Prototype Examples and Tutorials - In-depth tutorials for seven different game prototypes, including a simple action game, a space shooter, a solitaire card game, a word game, and a top-down adventure - Instructions to compile these games for PC, web, or any of the dozens of other release platforms supported by Unity - Improved structure and layout that makes the steps of each tutorial easier to follow - A completely new Dungeon Delver prototype not present in the first edition "
9781599538921,0
9781785881466," Combine the powerful UE4 with Blender to create visually appealing and comprehensive game environmentsAbout the Book  The only resource that shows how you can incorporate Blender into your Unreal Engine 4 Game environment Create amazing 3D game environments by leveraging the power of Blender and Unreal Engine 4 Practical step-by-step approach with plenty of illustrative examples to get you started immediately  In details Unreal Engine 4 now has support for Blender, which was not available in earlier versions. This has opened up new possibilities and that is where this book comes in. This is the first book in the market combining these two powerful game and graphic engines. Readers will build an amazing high-level game environment with UE4 and will show them how to use the power of Blender 3D to create stunning animations and 3D effects for their game. This book will start with creating levels, 3D assets for the game, game progression, light and environment control, animation, and so on. Then it will teach readers to add amazing visual effects to their game by applying rendering, lighting, rigging, and compositing techniques in Blender. Finally, readers will learn how to smoothly transfer blender files to UE4 and animate the game assets. Each chapter will add complexities to the game environment. What you will learn  Create a fully functioning game level of your own design using Blender and Unreal Engine 4 Customize your level with detailed 3D assets created with Blender Import assets into Unreal Engine 4 to create an amazing finished product Build a detailed dynamic environment with goals and an ending Explore Blender's incredible animation tools to animate elements of your game Create great environments using sound effects, particle effects, and class blueprints "
9780321933164," Learn Game Design, Prototyping, and Programming with Today's Leading Tools: Unity(TM) and C#   Award-winning game designer and professor Jeremy Gibson has spent the last decade teaching game design and working as an independent game developer. Over the years, his most successful students have always been those who effectively combined game design theory, concrete rapid-prototyping practices, and programming skills.  Introduction to Game Design, Prototyping, and Development is the first time that all three of these disciplines have been brought together into a single book. It is a distillation of everything that Gibson has learned teaching hundreds of game designers and developers in his years at the #1 university games program in North America. It fully integrates the disciplines of game design and computer programming and helps you master the crucial practice of iterative prototyping using Unity. As the top game engine for cross-platform game development, Unity allows you to write a game once and deliver it to everything from Windows, OS X, and Linux applications to webpages and all of the most popular mobile platforms.  If you want to develop games, you need strong experience with modern best practices and professional tools. There's no substitute. There's no shortcut. But you can get what you need in this book.  COVERAGE INCLUDES   In-depth tutorials for eight different game prototypes   Developing new game design concepts   Moving quickly from design concepts to working digital prototypes   Improving your designs through rapid iteration   Playtesting your games and interpreting the feedback that you receive   Tuning games to get the right ""game balance"" and ""game feel""   Developing with Unity, today's best engine for independent game development   Learning C# the right way   Using Agile and Scrum to efficiently organize your game design and development process   Debugging your game code   Getting into the highly competitive, fast-changing game industry  "
9780321929679,"Now in its third edition, the classic book on game design has been completely revised to include the latest developments in the game industry. Readers will learn all the fundamentals of concept development, gameplay design, core mechanics, user interfaces, storytelling, and balancing. They'll be introduced to designing for mobile devices and touch screens, as well as for the Kinect and motion-capture gameplay. They'll learn how indie developers are pushing the envelope and how new business models such as free-to-play are influencing design. In an easy-to-follow approach, Adams offers a first-hand look into the process of designing a game, from initial concept to final tuning. This in-depth resource also comes with engaging end-of-chapter exercises, design worksheets, and case studies."
9781449363215,"Now in full color, the 10th anniversary edition of this classic book takes you deep into the influences that underlie modern video games, and examines the elements they share with traditional games such as checkers. At the heart of his exploration, veteran game designer Raph Koster takes a close look at the concept of fun and why it's the most vital element in any game.Why do some games become boring quickly, while others remain fun for years? How do games serve as fundamental and powerful learning tools? Whether you're a game developer, dedicated gamer, or curious observer, this illustrated, fully updated edition helps you understand what drives this major cultural force, and inspires you to take it further.You'll discover that: Games play into our innate ability to seek patterns and solve puzzlesMost successful games are built upon the same elementsSlightly more females than males now play gamesMany games still teach primitive survival skillsFictional dressing for modern games is more developed than the conceptual elementsTruly creative designers seldom use other games for inspirationGames are beginning to evolve beyond their prehistoric origins"
9781936781065,"Wolfgang Baur, Monte Cook, Ed Greenwood, Mike Stackpole, and other industry veterans have the answers you asked for...and the advice you need  You'll learn how to create great new adventures, monsters and magic for your RPG campaign, and maybe even design your own game. The Complete Kobold Guide to Game Design offers 240 pages of in-depth essays on what makes RPGs tick. Get time-tested advice from the top designers in the industry. This compilation includes all three volumes of the Kobold Guide to Game Design series-now with all-new material by Wolfgang Baur, Mike Stackpole, and others  From core rules and magic systems to fantasy adventures, monster design, playtesting, and much more, these 40 essays cover every aspect of RPG design in clear, accessible language, to show you what it takes.  The City Book Review called it ""highly recommended for gaming nerds everywhere""   Pick up the Complete KOBOLD Guide to Game Design today, and starting designing your RPG tonight  Winner, 2012 Gold ENnie Award, Best RPG-Related Accessory"
9781430247166,"Foundation Game Design with HTML5 and JavaScript teaches you everything you need to know about how to make video games. If you've never done any programming before and don't know where to start, this book will show you how to make games from start to finish. You'll learn all the latest programming technologies (HTML5, CSS, and JavaScript) to create your games. All written in a fun and friendly style with open-ended projects that encourage you to build your own original games.Foundation Game Design with HTML5 and JavaScript starts by showing you how you can use basic programing to create logic games, adventure games, and create interactive game graphics. Design a game character, learn to control it with the keyboard, mouse, or touch screen interface, and then learn how to use collision detection to build an interactive game world. You'll learn to make maze games, platform jumping games, and fast paced action games that cover all the popular genres of 2D gaming. Create intelligent enemies, use realistic physics, sound effects and music, and learn how to animate game characters. Whether you're creating games for the web or mobile devices, everything you need to get started on a career as a game designer is right here. Focused and friendly introduction to making games with HTML5.  Essential programming and graphic design techniques for building games, with each chapter gently building on the skills of preceding chapters.  Detailed case studies demonstrating techniques that can be used for making games in a wide variety of genres. "
9781936781041,0
9780786469529,"Many aspiring game designers have crippling misconceptions about the process involved in creating a game from scratch, believing a big idea is all that is needed to get started. But game design requires action as well as thought, and proper training and practice to do so skillfully. In this indispensible guide, a published commercial game designer and longtime teacher offers practical instruction in the art of video and tabletop game design. The topics explored include the varying types of games, vital preliminaries of making a game, the nuts and bolts of devising a game, creating a prototype, testing, designing levels, technical aspects, and assessing nature of the audience. With practice challenges, a list of resources for further exploration, and a glossary of industry terms, this manual is essential for the nascent game designer and offers food for thought for even the most experienced professional."
9781484270387,"Victor Brusca is an experienced software developer specializing in building cross-platform applications and APIs. He regards himself as a self-starter with a keen eye for detail, an obsessive protection of systems/data, and a desire to write well-documented, well-encapsulated code. With over 14 years' software development experience, he has been involved in game and game engine projects on J2ME, T-Mobile SideKick, WebOS, Windows Phone, Xbox 360, Android, iOS, and web platforms."
9781801146579,"Do you want to learn a new and valuable skill that will help you become more tech-savvy?If yes, you might find coding to be particularly appealing as it has a bit of everything for everyone, involving creativity, logic, art, math, architecture, and problem-solving through the use of computer software.This book teaches you to code step by step through existing programming languages that you can try with your family and friends, which include multiple activities,  ranging from games and drills to useful exercises.Most kids would like to learn to code, but not every kid at school or in summer-camp has access to computer programming lessons. That's where this book comes in  Using ""Scratch,"" a computer programming language,  children can learn all the basics of coding and become more technically skilled. As a block-based visual language, new coders can enter into the realm of programming with ease - and it's fun too Developed at MIT, Scratch has grown in popularity because it is currently the most common programming language that is accessible to children. As such, this book introduces the most recent edition of Scratch, Scratch 3.0.0, and includes various projects. Thus, everything that kids learn from this book will help them acquire new skills and study more technical programming languages in the future. Best of all, the resources are downloadable, accessible online, and easy-to-use through the instructions included in this book.This book covers the following: The Basics of CodingWorking with Programming LanguagesException HandlingEvent-Driven ProgrammingAlgorithms for CloningSimple Loops and Code Blocks (Functions)Variables and their UseI/O and Data HandlingConditionalsLists, Arrays, and Logical FunctionsIntroduction to App Lab and ScratchAll this information will help you teach your kids coding, as is presented in this single book.If this sounds like something you want for your kids, "
9781716338991,0
9781501360619,"Edward Castronova is Professor of Media at Indiana University, USA. He is the author of Synthetic Worlds: The Business and Culture of Online Games (2006),  Exodus to the Virtual World (2008) and Wildcat Currency: The Virtual Transformation of the Economy (2014). He specializes in Games, Technology, and Society, and has served in the past as Director of the BS degree program in Game Design, and Chair of the Department of Media Arts and Production"
9781138738973,"Principles of Game Audio and Sound Design is a comprehensive introduction to the art of sound for games and interactive media using Unity. This accessible guide encompasses both the conceptual challenges of the artform as well as the technical and creative aspects, such as sound design, spatial audio, scripting, implementation and mixing.Beginning with basic techniques, including linear and interactive sound design, before moving on to advanced techniques, such as procedural audio, Principles of Game Audio and Sound Design is supplemented by a host of digital resources, including a library of ready-to-use, adaptable scripts. This thorough introduction provides the reader with the skills and tools to combat the potential challenges of game audio independently.Principles of Game Audio and Sound Design is the perfect primer for beginner- to intermediate-level readers with a basic understanding of audio production and Unity who want to learn how to gain a foothold in the exciting world of game and interactive audio. "
9783030376420,"Barbaros Bostan is an Associate Professor in the Digital Game Design department at the Bahcesehir University/Turkey. He has a Ph.D. in Information Systems (2007) from Marmara University, an M.B.A. (2003) from Yeditepe University, and a B.S. in Electronics and Communication Engineering (2001) from Istanbul Technical University. He worked as a post-doc researcher at IDM Institute, Games Lab of the National University of Singapore between 2008 and 2010. His research areas include computer games, presence, interactivity, gamer psychology, player motivations and player profiling. Bostan has teaching experience in the areas of game history and analysis, storytelling in games, player psychology, research methods and interactive narrative. He reviews journal articles and book chapters for various journals and publishers, local and international. He was the editor of Gamer Psychology and Behavior book published by Springer. He was also one of the section editors of Encyclopedia of Computer Graphics and Games published by Springer. "
