ISBN,書籍簡介
9781700956613,0
9781108417334,0
9781138480629,"Master game design and digital art principles simultaneously with this all-in-one guide to creating games in the cutting-edge game engine Unity. Reworked for C# and Unity 2018 & 2019, and bursting with images and tutorials, Penny de Byl's Holistic Game Development with Unity will help the reader gain the multidisciplinary skills needed to succeed in the independent game industry. Holistic Game Development with Unity includes new coverage on Augmented Reality, Networking, and Virtual Reality such as the Oculus Rift. Supplementary material, including instructional videos, discussion forums and art assets are provided in the companion website located at www.holistic3d.com. Learn to combine the beauty of art and the functionality of programming in de Byl's third edition for Unity game development.Key features:    Art and programming in Unity, the only one-stop shop for individual developers and small teams looking to tackle both tasks.   Proven step-by-step tutorials show you how to design and structure an entire game in Unity with art assets.   Revised to cover the Unity game engine versions 2018 and 2019.   New coverage of Nav Meshes, Augmented Reality, Mobile Builds and Mecanim.   An introduction to essential two- and three-dimensional mathematical and physics concepts.   A portfolio of royalty free reusable game mechanics. Revamped and expanded accompanying website, www.holistic3d.com, features project source code, instructional videos, art assets, author blog, and discussion forums. Additional challenge questions and lesson plans are available online for an enhanced learning experience."
9780999788547,"How are market-leading products born?Successful innovations may end up reaching a mainstream audience, but they never start off that way. That's the paradox of innovation most entrepreneurs fail to embrace-the typical people in your market are not the ones you need to woo when bringing your idea to life.Instead, find the ""superfans"" hidden in your audience: Those willing to take risk and put up with a messy or incomplete prototype in order to start solving the problem your product will eliminate. Show your idea to these people. What do they love about it? Where does it seem to go in the wrong direction? Allowing these early fans to ""play"" with your idea gives you fast, accurate answers to your most pressing questions long before your product is built.Game Thinking supercharges your progressThat's where Game Thinking comes in. In this groundbreaking book, Amy Jo Kim lays out a step-by-step system for crafting products that people love...and keep loving. The secret? Develop ""impossible to put down"" products by using techniques that the fast-moving games industry employs when making games that glue millions of players to their screens.During her time working on genre-defining games like The Sims, Rock Band, and Ultima Online, Amy Jo learned that customers stick with products that help them get better at something they care about, like playing an instrument or leading a team. Amy Jo has used her insights from gaming to help hundreds of companies like Netflix, Disney, The New York Times, Ubisoft and Happify innovate faster and smarter, and drive long-term engagement.Build successful products like a (game) masterBuilding on the principles of lean/agile design and design thinking, Game Thinking covers five powerful strategies you can use to create your next hit product: Accelerate innovation by testing your highest risk assumptions firstUse insights from superfans to build a product that fits how people really behaveKeep customers engaged with a coherent and compelling customer journeyImprove your product concept by rapidly testing and tuning the core experiencePlot your development path with the Game Thinking roadmapGet your hands on Game Thinking, and start innovating smarter today."
9781421423968,Kevin Bell is the pro-vice chancellor of digital futures at Western Sydney University in Australia.
9781484227039,"Adam Sinicki has a lot of experience developing for Android having created the successful Multiscreen Multitasking and collaborated with YouTube and Coldfusion on the Voxis Launcher. Multiscreen Multitasking was pre-installed software on over 60,000 handsets from Celkon and Intex. Adam currently writes for the news site Android Authority where he has previously tackled this subject."
9781541057579,"HOW TO WIN THE FLAT FEE GAME is the third volume in a series of instructional books created just for you, the practicing design professional. This volume is a specific guide to building a flat fee proposal that works for you and your clients. Although I've been using (successfully ) the 15 Step Project Management Strategy for hourly fee contracts for more than 15 years, it's taken a decade to create the same success with a flat fee method of billing. Those of you who are currently using the 15 Steps will be pleased to discover you'll enjoy the same precision and order with this new method. You're not starting over. You're just adding flat fee proposals to your tool kit. HERE'S WHAT'S INSIDE - The 15 STEP Project Management Strategy fully adapted for use with flat fee contracts. Building on the foundation of the Business of Design model, you'll discover a new way of charging for your services using the existing, proven structure that works. - Confidence. You are no longer alone. We'll identify and resolve the problems and challenges that so many of us face when it comes to determining a flat fee for our services. - New estimation methods to ensure your flat fee contract won't leave you flat broke. Whether you're charging by the hour or using a fixed fee method of billing-you deserve to be fairly compensated for your expertise. - Designer Math. Learn effective formulas for calculating a fixed fee. - How to modify your existing Business of Design hourly contract so it works for fixed or flat fee projects."
9781118877166,"Want to design your own video games? Let expert Scott Rogers show you how   If you want to design and build cutting-edge video games but aren't sure where to start, then the SECOND EDITION of the acclaimed Level Up  is for you  Written by leading video game expert Scott Rogers, who has designed the hits Pac Man World, Maximo and SpongeBob Squarepants, this updated edition provides clear and well-thought out examples that forgo theoretical gobbledygook with charmingly illustrated concepts and solutions based on years of professional experience.  Level Up  2nd Edition has been NEWLY EXPANDED to teach you how to develop marketable ideas, learn what perils and pitfalls await during a game's pre-production, production and post-production stages, and provide even more creative ideas to serve as fuel for your own projects including:   Developing your game design from the spark of inspiration all the way to production Learning how to design the most exciting levels, the most precise controls, and the fiercest foes that will keep your players challenged Creating games for mobile and console systems - including detailed rules for touch and motion controls Monetizing your game from the design up Writing effective and professional design documents with the help of brand new examples  Level Up  2nd Edition is includes all-new content, an introduction by David ""God of War"" Jaffe and even a brand-new chili recipe -making it an even more indispensable guide for video game designers both ""in the field"" and the classroom. Grab your copy of Level Up  2nd Edition and let's make a game "
9781580650663,"- Authors are top game designers - Aspiring game writers and designers must have this complete bible There are other books about creating video games out there. Sure, they cover the basics. But The Ultimate Guide to Video Game Writing and Design goes way beyond the basics. The authors, top game designers, focus on creating games that are an involving, emotional experience for the gamer. Topics include integrating story into the game, writing the game script, putting together the game bible, creating the design document, and working on original intellectual property versus working with licenses. Finally, there's complete information on how to present a visionary new idea to developers and publishers. Got game? Get The Ultimate Guide to Video Game Writing and Design."
9781916902411,"For twelve years, Alexis Kennedy has been writing some of the most original and intelligent narrative games of the last decade - Fallen London, Sunless Sea, Cultist Simulator, and more, as well as guest-writing gigs for BioWare, Paradox and Telltale Games. And for most of that time, he's been writing *about* games as well. Here for the first time in one place are the best of his essays and columns - from hard-won lessons about game development to reviews of unreviewable games, from narrative design principles to writing masterclasses, from historical discursions on labyrinths to the notorious 'Against Worldbuilding'. With an introduction by Matt Hosty."
9798732024524,"★Make Your Little Kid Happy With This Super Fun Siren Head Coloring Book★This coloring book is definitely a perfect item for fans of the Monster Siren Head & Horror Games. Come to this book, you will have a chance to challenge yourself to color and mix colors so that you will have hours having fun and cultivate your creativity and develop your imagination. Moreover, this amazing book provides several unique and detailed hand-drawn illustrations of Siren Head (Monster) character. This book will give you a sense of relaxation and enjoyment to deal with stress.This book is a perfect great gift to give to your kids,♥Your child will love this book, because♥ -All illustrations are printed on one side to prevent bleeding -Large format 8.5 'x 8.5' -Really professional quality designs from cover to last pages! -Can use many types of pens such as markers, pencils or crayons, .. -Easily removable or framed -For All ages (toddler & Adult). -Great Gifts For Those Who Love Siren head. -Different levels for beginners and those who want to improve drawing skills -This book is a perfect gift to give to your kids. -Hope you will find in our book relaxing moments!!!♥ Great Gifts For Those Who Horror & Siren head Game ♥Sirenhead/sirenhead/SirenHead/Monster/Horror games/Horror"
9781801146586,"Do you want your child to learn coding at an early stage?Is your kid attracted to coding, and you are thinking about how you can engage him with the subject?If yes, then keep reading Get the best book to introduce your child to the world of coding-a thrilling and fun-filled book to offer them the best start. Ideal for kids ages four to seven, this Coding for Kids Games is loaded with graphics that will get your kid a head start at coding and become future specialists in the STEM fields.The games and practical information included in this book will help build a strong foundation for offline coding. That's correct; no computer is needed.With this book, your kid's curious mind will be loaded with the basics of coding from scratch and get familiar with sequencing. They can take the initial step towards developing analytical skills, problem-solving, and creative thinking with this awesome coding game.After solving this book, your child will be prepared to take on languages such as Swift and Scratch. This book can be a practical way for your kid to quickly understand the coding concepts and give an exciting introduction to programming.Here's a preview of what you'll find inside: What is codingWhy learn to code? What is programming?What are the programs? Programming languagesLearning to program Coding in python Coding in scratch And much more "
9781801146593,"Do you want your child to learn coding at an early stage?Is your kid attracted to coding, and you are thinking about how you can engage him with the subject?If yes, then keep reading Get the best book to introduce your child to the world of coding-a thrilling and fun-filled book to offer them the best start. Ideal for kids ages four to seven, this Coding for Kids Games is loaded with graphics that will get your kid a head start at coding and become future specialists in the STEM fields.The games and practical information included in this book will help build a strong foundation for offline coding. That's correct; no computer is needed.With this book, your kid's curious mind will be loaded with the basics of coding from scratch and get familiar with sequencing. They can take the initial step towards developing analytical skills, problem-solving, and creative thinking with this awesome coding game.After solving this book, your child will be prepared to take on languages such as Swift and Scratch. This book can be a practical way for your kid to quickly understand the coding concepts and give an exciting introduction to programming.Here's a preview of what you'll find inside: What is codingWhy learn to code? What is programming?What are the programs? Programming languagesLearning to program Coding in python Coding in scratch And much more "
9798580404264,0
9798577979935,"★ I Spy With My Little Eye: Construction Vehicles ★Let your kids have fun with vehicles and colors  In this book your kids will be asked to find different construction vehicles With each page your preschooler is asked to find a different construction vehicle. Each activity page is preceded by the vehicle which should be found  This activity book includes: ★ Trucks, Cars, Bulldozers, Cranes, Tractors, Diggers, Dumpers, Lorries and other things that go  ★ Each task is connected with different thing that go  ★ Printed all in color on the high quality paper★ Glossy cover All of above makes it a perfect gift for all kids loving things that go  Click buy and let's find all of them"
9789813239937,0
9780262043533,"How game designers can use the psychological phenomenon of loss aversion to shape player experience.Getting something makes you feel good, and losing something makes you feel bad. But losing something makes you feel worse than getting the same thing makes you feel good. So finding $10 is a thrill; losing $10 is a tragedy. On an ""intensity of feeling"" scale, loss is more intense than gain. This is the core psychological concept of loss aversion, and in this book game creator Geoffrey Engelstein explains, with examples from both tabletop and video games, how it can be a tool in game design. Loss aversion is a profound aspect of human psychology, and directly relevant to game design; it is a tool the game designer can use to elicit particular emotions in players. Engelstein connects the psychology of loss aversion to a range of phenomena related to games, exploring, for example, the endowment effect--why, when an object is ours, it gains value over an equivalent object that is not ours--as seen in the Weighted Companion Cube in the game Portal; the framing of gains and losses to manipulate player emotions; Deal or No Deal's use of the utility theory; and regret and competence as motivations, seen in the context of legacy games. Finally, Engelstein examines the approach to Loss Aversion in three games by Uwe Rosenberg, charting the designer's increasing mastery."
9781977404015,0
9781679019760,0
9781678380113,0
9781677482641,0
9781688376816,0
9781687200761,"Challenge yourself and see how much K-Pop slangs and phrases you can recognize and find in this word search and match puzzle book The words are in romanization Korean language, perfect for the English speaking fans to learn them We have included a how-to-play page, the full solutions and a glossary page with the meanings of the words and phrases32 puzzles6"" x 9"" / Half sizeGlossy softcoverSubtle for kids (age 10+) teens and adults "
9781138365490,"Building Blocks of Tabletop Game Design: An Encyclopedia of Mechanisms compiles hundreds of different mechanisms, organized by category. Each has a description of how it works, discussion of its pros and cons, how it can be implemented, and examples of specific games that use it. Building Blocks can be read cover to cover, used as a reference when looking for inspiration for a new design, help solving a specific problem, or assist in getting unstuck in the midst of a project. This book, the first to collect mechanisms like this in the tabletop game design field, aims to be a practical guide that will be a great starting point for beginning designers, a handy guidebook for the experienced, and an ideal classroom textbook. 　 Key Features   The first compendium of its kind in the tabletop game field.    Covers the nuts and bolts of design to resolve specific challenges.    Serves as a practical guide, a great starting point for beginning designers, and a reference for seasoned professionals.    Contains discussion of a series of standalone mechanisms, in a standard format and style, with cross-links to related mechanics and specific examples.    Includes hundreds of mechanism entries with accompanying diagrams and sample games to study.   Ideal for professional or classroom use.   "
9781079781915,"A fun motor sports themed activity book to learn from and play word puzzle game about motorcycle, auto and motocross racing terms 88 word search puzzlesA page that provides hintsAnswers included at the end of the book8.5"" x 11"" / Large sizeGlossy softcoverSuitable for kids(age 8+) teens and adults"
9781138595309,"This edited collection of chapters concerns the evolving discipline of procedural storytelling in video games. Games are an interactive medium, and this interplay between author, player and machine provides new and exciting ways to create and tell stories. In each essay, practitioners of this artform demonstrate how traditional storytelling tools such as characterization, world-building, theme, momentum and atmosphere can be adapted to full effect, using specific examples from their games. The reader will learn to construct narrative systems, write procedural dialog, and generate compelling characters with unique personalities and backstories. Key Features Introduces the differences between static/traditional game design and procedural game design Demonstrates how to solve or avoid common problems with procedural game design in a variety of concrete ways World's finest guide for how to begin thinking about procedural design"
9789811200762,It is impossible to understand modern economics without knowledge of the basic tools of gametheory and mechanism design. This book provides a graduate-level introduction to the economic modeling of strategic behavior. The goal is to teach Economics doctoral students the tools of game theory and mechanism design that all economists should know.
9789887852865,在現代遊戲藝術設計中，富有創意的遊戲場景設計師憑藉自己的奇思異想和澎湃激情創作出一個又一個令人歎為觀止的遊戲場景。本書精選了全球範圍內知名的、新銳的遊戲場景設計師及遊戲工作室的優秀作品。一方面，通過遊戲作品充分展示遊戲場景“從無到有”“從草圖到成品圖”的奇妙創作歷程；另一方面，對遊戲場景設計師的創作經驗和心路歷程進行了簡述。本書不僅是遊戲場景設計師的參考書籍，還是遊戲愛好者的趣味讀物。
9783899862768,"● A card game for design lovers with 13 playing categories, including tools, shoes, bottles, clothes, chairs, dolls, bags, audio, appliances, packaging, videoHow many cubic meters does the little Michelin man actually take up? What insurance value does the potato peeler Rex have and how fragile is Sophie Taeuber-Arp's Dr. Komplex? The designer pack of cards The Happy Collector shows 52 objects from the design and decorative arts collection at the Museum of Design Zurich.Playfully - as a classical card game or top trumps - it presents not only the favorite objects and collection highlights of the museum, but also conveys important aspects of the collection procedure: from purchase, storage and handling to insurance and documentation.The Museum of Design Zurich is the leading museum for design and visual communication in Switzerland. The collection of international importance comprises around 500,000 objects from the areas of decorative arts, textiles, graphics, typography, as well as poster, furniture and product design. Sabine Flaschberger and Renate Menzi are its curators."
9781498775502,"Making a successful video game is hard. Even games that are well-received at launch may fail to engage players in the long term due to issues with the user experience (UX) that they are delivering. That's why makers of successful video games like Fortnite and Assassin's Creed invest both time and money perfecting their UX strategy. These top video game creators know that a bad user experience can ruin the prospects for any game, regardless of its budget, scope, or ambition. The game UX accounts for the whole experience players have with a video game, from first hearing about it to navigating menus and progressing in the game. UX as a discipline offers guidelines to assist developers in creating the optimal experience they want to deliver, including shipping higher quality games (whether indie, triple-A or ""serious"" games) and meeting business goals -- all while staying true to design vision and artistic intent. At its core, UX is about understanding the gamer's brain: understanding human capabilities and limitations to anticipate how a game will be perceived, the emotions it will elicit, how players will interact with it, and how engaging the experience will be. This book is designed to equip readers of all levels, from student to professional, with cognitive science knowledge and user experience guidelines and methodologies. These insights will help readers identify the ingredients for successful and engaging video games, empowering them to develop their own unique game recipe more efficiently, while providing a better experience for their audience.  ""The Gamer's Brain: How Neuroscience and UX Can Impact Video Game Design"" Is written by Celia Hodent -- a UX expert with a PhD in psychology who has been working in the entertainment industry for over 10 years, including at prominent companies such as Epic Games (Fortnite), Ubisoft, and LucasArts.  Major themes explored in this book:    Provides an overview of how the brain learns and processes information by distilling research findings from cognitive science and psychology research in a very accessible way. Topics covered include: ""neuromyths"", perception, memory, attention, motivation, emotion, and learning. Includes numerous examples from released games of how scientific knowledge translates into game design, and how to use a UX framework in game development. Describes how UX can guide developers to improve the usability and the level of engagement a game provides to its target audience by using cognitive psychology knowledge, implementing human-computer interaction principles, and applying the scientific method (user research). Provides a practical definition of UX specifically applied to games, with a unique framework. Defines the most relevant pillars for good usability (ease of use) and good ""engage-ability"" (the ability of the game to be fun and engaging), translated into a practical checklist. Covers design thinking, game user research, game analytics, and UX strategy at both a project and studio level. This book is a practical tool that any professional game developer or student can use right away and includes the most complete overview of UX in games existing today.   "
9781946444271,0
9780986155505,"Are you ready to transform your classroom into an experiential work that flourishes on collaboration and creativity? Then set sail with classroom game designer and educator Michael Matera as he reveals the possibilities and power of game-based learning. In Explore Like a PIRATE, Matera serves as your experienced guide to help you apply the most motivational techniques of gameplay to your classroom using strategies that work with and enhance (rather than replace) your current curriculum. Part one debunks common myths and fears about gamification and explains why and how game-based learning effectively engages students in any subject or grade level. Part two focuses on how you can empower students to take control of their learning. You'll also learn all about the different kinds of players in your classroom - and how to inspire them to set and achieve big goals. Part three is an all-in-one treasure chest, tool box, and field guide. Packed with ideas and examples that can be applied or adapted to any classroom - from badges and points, to mini-games and yearlong adventures - this is a resource you'll return to again and again."
