ISBN,書籍簡介
9789869475532,"Artlantis5是硬體需求極低，及使用CPU I5的電腦也能快速渲染的軟體，簡要的介面與即時預覽的視窗，是自學者容易上手的關鍵。 Artlantis本身內建後期處理，不再需要耗時後製，只要理解渲染參數就能讓渲染速度倍增；本書從摹擬取景開始，架設相機、觀察光影調整日光燈光、材質擬真技巧到物件改圖的方式，搭配大量的實例練習比較，跟著作者安排的案例循序漸進，一定能打下良好的渲染觀念與基礎。 那為什麼Artlantis產品在作者執筆的當下已是第七版，而這本書則以Artlantis 5為著作藍本。從Artlantis 6開始，他們的研發人員因為種種原因，將軟體渲染內核做了極大的變化，也是因為運算方式的改進、渲染品質提昇了，相對它渲染速度比5版要慢上數倍，且需用規格較高的硬體。因此，作者認為Artlantis 5是較符合作者定義的…界面簡易、容易操作、學習曲線佳，是最適合渲染入門者的。"
9789869475549,本書延續這是一本Artlantis5的書（上冊），進入進階技巧的設定：物理相機的感光快門、更多元的場景設定（例如多雲、黃昏與清晨等光感）、自建可重複運用的材質球、玻璃與水的關鍵擬真設定、狹小空間取景方式、將模型融入實景照片的操作、最完整的改圖全設定大公開！還有獨家的平行視圖、全景、VR環繞動畫，以及Artlantis的動畫運鏡設定，作者無私分享給讀者多年使用的學習經驗，跟著書附案例學習，絕對能讓渲染技巧有更進一步的提升。
9789863125488,"真實場景渲染實作 ＋ 各大控制面板超詳盡解說！

針對 SketchUp 3D 建模後續的渲染作業, Artlantis 憑藉著超快速的出圖渲染速度, 並能與 SketchUp 完美搭配, 已是業界建模＋渲染工作的最佳選擇。

本書是作者經過深入研究而完成的 Artlantis 7 （6.5 亦適用）超詳盡操作手冊。書中以豐富的場景範例 - 包括【客廳、主臥室空間、中式餐廳包廂、汽車展示廳、屋頂泳池、高級別墅建築外觀..等】, 從場景鏡頭的設置開始, 到陽光、燈光、材質的設置完成, 都有獨到見解與操作說明, 是一套完整的訓練內容。藉由本書讀者必能快速熟悉 Artlantis 7, 讓平淡無奇的建模畫面, 最後產出商業水準的透視圖！　

●陽光、燈光、物體及材質等各大控制面板超詳盡解說, 紮穩 Artlantis 基本操作技巧。

●挑戰室內、外各種光影變化的真實場景, 從 SketchUp 建構模型、賦予材質 → 以 Artlantis 做燈光、渲染 → 最終渲染出圖, Step by Step 完整解說！

●書附光碟提供豐富 Artlantis 可用物件、去背 2D 人物素材, IES 光域網燈光素材...等, 供讀者製作時立即套用。"
