ISBN,書籍簡介
9781914054136,"With Kubernetes, it is possible and easy for you to automate the deployment, management, and scaling of any containerized applications. You can use this container to group containers which make up a particular application into a number of logical units to make it easy for discovery and management. This container operates by use of the same technique which makes Google run many containers numbering in the billions on a weekly basis, and it can scale and you will not be required to increase the ops team. Kubernetes is a very flexible container, whether you are running it locally or on a global enterprise, and it will allow you to be able to deliver your container in an easier and more consistent manner despite how complex it might be. It is open source, and you are able to move your workloads to where you need. A large number of major companies appreciate the potential to save on costs when it comes to containers and Kubernetes. In particular, containers are more lightweight than VMs and can share a single OS, which causes a significant decrease in the costs of infrastructure. Their maintenance costs are also low. Additionally, they have faster CI/CD pipelines and allow your development and engineering teams better coordination with each other. Adding Kubernetes to the equation more benefits are gained. By autoscaling you can save more. The other benefits include efficient application scheduling, efficient cluster-level resource management, and rolling updates. - How Kubernetes operates- Deployment- Kubernetes pods- Kubernetes services- Kubernetes design patterns- Kubernetes cliene libraries and extensions- Logging- The intricacies of this management plane in Kubernetes- Cluster federation- Kubernetes ingress...And much moreOverall, you can expect to save your team's time and also make a two-digit saving all thanks to both containerized applications and container orchestration. Applications are deployed through containers focusing on operating-system-level virtualization as opposed to hardware virtualization. This enables us to put an end to the limitations of the host by selecting executable file-systems, libraries, and etc. With Kubernetes, connecting applications with appropriate services through configuring firewalls of the cloud service providers can be made at once. In complex configurations, it creates an external load-balancer and discovering cross-cluster service through the use of federated services."
9781838820756,"From building your own cluster to running cloud-native applications with Kubernetes, this workshop covers it all using engaging examples and activitiesKey Features  Explore the Kubernetes environment and understand how containers are managed Learn how to build, maintain, and deploy cloud-native applications using Kubernetes Get to grips with using Kubernetes primitives to manage the life cycle of a full application stack  Book Description Thanks to its extensive support for managing hundreds of containers that run cloud-native applications, Kubernetes is the most popular open source container orchestration platform that makes cluster management easy. This workshop adopts a practical approach to get you acquainted with the Kubernetes environment and its applications. Starting with an introduction to the fundamentals of Kubernetes, you'll install and set up your Kubernetes environment. You'll understand how to write YAML files and deploy your first simple web application container using Pod. You'll then assign human-friendly names to Pods, explore various Kubernetes entities and functions, and discover when to use them. As you work through the chapters, this Kubernetes book will show you how you can make full-scale use of Kubernetes by applying a variety of techniques for designing components and deploying clusters. You'll also get to grips with security policies for limiting access to certain functions inside the cluster. Toward the end of the book, you'll get a rundown of Kubernetes advanced features for building your own controller and upgrading to a Kubernetes cluster without downtime. By the end of this workshop, you'll be able to manage containers and run cloud-based applications efficiently using Kubernetes. What you will learn  Get to grips with the fundamentals of Kubernetes and its terminology Share or store data in different containers running in the same pod Create a container image from an image definition manifest Construct a Kubernetes-aware continuous integration (CI) pipeline for deployments Attract traffic to your app using Kubernetes ingress Build and deploy your own admission controller  Who this book is for Whether you are new to the world of web programming or are an experienced developer or software engineer looking to use Kubernetes for managing and scaling containerized applications, you'll find this workshop useful. A basic understanding of Docker and containerization is necessary to make the most of this book."
9781839216503,"Secure your container environment against cyberattacks and deliver robust deployments with this practical guideKey Features  Explore a variety of Kubernetes components that help you to prevent cyberattacks Perform effective resource management and monitoring with Prometheus and built-in Kubernetes tools Learn techniques to prevent attackers from compromising applications and accessing resources for crypto-coin mining  Book Description Kubernetes is an open source orchestration platform for managing containerized applications. Despite widespread adoption of the technology, DevOps engineers might be unaware of the pitfalls of containerized environments. With this comprehensive book, you'll learn how to use the different security integrations available on the Kubernetes platform to safeguard your deployments in a variety of scenarios. Learn Kubernetes Security starts by taking you through the Kubernetes architecture and the networking model. You'll then learn about the Kubernetes threat model and get to grips with securing clusters. Throughout the book, you'll cover various security aspects such as authentication, authorization, image scanning, and resource monitoring. As you advance, you'll learn about securing cluster components (the kube-apiserver, CoreDNS, and kubelet) and pods (hardening image, security context, and PodSecurityPolicy). With the help of hands-on examples, you'll also learn how to use open source tools such as Anchore, Prometheus, OPA, and Falco to protect your deployments. By the end of this Kubernetes book, you'll have gained a solid understanding of container security and be able to protect your clusters from cyberattacks and mitigate cybersecurity threats. What you will learn  Understand the basics of Kubernetes architecture and networking Gain insights into different security integrations provided by the Kubernetes platform Delve into Kubernetes' threat modeling and security domains Explore different security configurations from a variety of practical examples Get to grips with using and deploying open source tools to protect your deployments Discover techniques to mitigate or prevent known Kubernetes hacks  Who this book is for This book is for security consultants, cloud administrators, system administrators, and DevOps engineers interested in securing their container deployments. If you're looking to secure your Kubernetes clusters and cloud-based deployments, you'll find this book useful. A basic understanding of cloud computing and containerization is necessary to make the most of this book."
9781839211256,"Go beyond simply learning Kubernetes fundamentals and its deployment, and explore more advanced concepts, including serverless computing and service meshes with the latest updatesKey Features  Master Kubernetes architecture and design to build and deploy secure distributed applications Learn advanced concepts like autoscaling, cluster federation, serverless computing, and service mesh integration for observability Explore Kubernetes 1.18 features and its rich ecosystem of tools like Kubectl, Knative, and Helm  Book Description The third edition of Mastering Kubernetes is updated with the latest tools and code enabling you to learn Kubernetes 1.18's latest features. This book primarily concentrates on diving deeply into complex concepts and Kubernetes best practices to help you master the skills of designing and deploying large clusters on various cloud platforms. The book trains you to run complex stateful microservices on Kubernetes including advanced features such as horizontal pod autoscaling, rolling updates, resource quotas, and persistent storage backend. With the two new chapters, you will gain expertise in serverless computing and utilizing service meshes. As you proceed through the chapters, you will explore different options for network configuration and learn to set up, operate, and troubleshoot Kubernetes networking plugins through real-world use cases. Furthermore, you will understand the mechanisms of custom resource development and its utilization in automation and maintenance workflows. By the end of this Kubernetes book, you will graduate from an intermediate to advanced Kubernetes professional. What you will learn  Master the fundamentals of Kubernetes architecture and design Build and run stateful applications and complex microservices on Kubernetes Use tools like Kubectl, secrets, and Helm to manage resources and storage Master Kubernetes Networking with load balancing options like Ingress Achieve high-availability Kubernetes clusters Improve Kubernetes observability with tools like Prometheus, Grafana, and Jaeger Extend Kubernetes working with Kubernetes API, plugins, and webhooks  Who this book is for If you are a system administrator or a cloud developer with working knowledge of Kubernetes and are keen to master its advanced features, along with learning everything from building microservices to utilizing service meshes, Mastering Kubernetes is for you. Basic familiarity with networking concepts will be helpful."
9798653155482,0
9781800209671,"Kick-start your DevOps career by learning how to effectively deploy Kubernetes on Azure in an easy, comprehensive, and fun way with hands-on coding tasksKey Features  Understand the fundamentals of Docker and Kubernetes Learn to implement microservices architecture using the Kubernetes platform Discover how you can scale your application workloads in Azure Kubernetes Service (AKS)  Book Description From managing versioning efficiently to improving security and portability, technologies such as Kubernetes and Docker have greatly helped cloud deployments and application development. Starting with an introduction to Docker, Kubernetes, and Azure Kubernetes Service (AKS), this book will guide you through deploying an AKS cluster in different ways. You'll then explore the Azure portal by deploying a sample guestbook application on AKS and installing complex Kubernetes apps using Helm. With the help of real-world examples, you'll also get to grips with scaling your application and cluster. As you advance, you'll understand how to overcome common challenges in AKS and secure your application with HTTPS and Azure AD (Active Directory). Finally, you'll explore serverless functions such as HTTP triggered Azure functions and queue triggered functions. By the end of this Kubernetes book, you'll be well-versed with the fundamentals of Azure Kubernetes Service and be able to deploy containerized workloads on Microsoft Azure with minimal management overhead. What you will learn  Plan, configure, and run containerized applications in production Use Docker to build apps in containers and deploy them on Kubernetes Improve the configuration and deployment of apps on the Azure Cloud Store your container images securely with Azure Container Registry Install complex Kubernetes applications using Helm Integrate Kubernetes with multiple Azure PaaS services, such as databases, Event Hubs and Functions.  Who this book is for This book is for aspiring DevOps professionals, system administrators, developers, and site reliability engineers looking to understand test and deployment processes and improve their efficiency. If you're new to working with containers and orchestration, you'll find this book useful."
9781647710910,"Do you want to improve the productivity of your business?Are you looking for a modern technology that can facilitate that?Have you considered Kubernetes as a solution?Many companies have recently turned to Kubernetes to help them improve their position and make their applications more stable. Since its launch in 2015 it has proved its worth and if you are looking for something that is future proof and will improve your productivity then Kubernetes could well be the answer.Inside this book, Kubernetes: The Ultimate Beginners Guide to Effectively Learn Kubernetes Step-by-Step, you will find a short but succinct introduction to this valuable open-sourced container-orchestration system, with chapters that cover: An in-depth overviewHow the architecture of Kubernetes looksThe advantages of the systemWhy it could be good for your businessThe characteristics of the API serverHow to monitor KubernetesAnd much more...If your business is in need of a system that is easy to use, has an impressive heritage and huge industry and community support, then Kubernetes could well be for you.And with this book, which has been written specifically for beginners to this excellent system, you have a solid platform of knowledge to get you started "
9781647710842,"Do you want to improve the productivity of your business?Are you looking for a modern technology that can facilitate that?Have you considered Kubernetes as a solution?Many companies have recently turned to Kubernetes to help them improve their position and make their applications more stable. Since its launch in 2015 it has proved its worth and if you are looking for something that is future proof and will improve your productivity then Kubernetes could well be the answer.Inside this book, Kubernetes: The Ultimate Beginner's Guide to Learn Kubernetes Step by Step, you will find a short but succinct introduction to this valuable open-sourced container-orchestration system, with chapters that cover:   An in-depth overview How the architecture of Kubernetes looks The advantages of the system Why it could be good for your business The characteristics of the API server How to monitor Kubernetes And much more...  If your business is in need of a system that is easy to use, has an impressive heritage and huge industry and community support, then Kubernetes could well be for you. And with this book, which has been written specifically for beginners to this excellent system, you have a solid platform of knowledge to get you started "
9781838821562,0
9798624375574,"Would you like to manage your work easily and effectively and live a stress-free life? Do you have the zeal to make a big impact in the world of technology but you don't have the adequate knowledge to do so? Or maybe, you have heard about Kubernetes and its usefulness and you want to learn about it? If your answer is ""yes"" to at least one of these questions, then this audiobook is for you. Kubernetes is a language that's gradually dominating the programming world as it's becoming the future of app development and no other bbook teaches it better than this one. It contains useful tricks and tips that would help you perform difficult tasks with just a simple command and these teachings are done with clear representations making it very easy to understand. Kubernetes (commonly stylized as k8s, a numeronym or Kube) is an open-source container orchestration system for automating application deployment, scaling, and management. It's regarded as the future of app development because it allows you to deploy cloud-native applications anywhere and manage them exactly as you like. It's a must-learn especially if you are planning on maintaining a long term career in this field and thankfully, Robert Clarke has formulated an book that teaches it excellently and it can be yours for just a token. Here are some of the few reasons why you shouldn't miss it;GETTING STARTED WITH KUBERNETES: Prepare yourself for challenging technical assessments with this mind-blowing book. It teaches you everything you need to know about Kubernetes without wasting your time with outdated information. It doesn't only show you step by step procedures on how to make Kubernetes work for you but it also provides you with lessons formulated by professionals.EASY TO UNDERSTAND: Mastering Kubernetes has always been a problem for so many people. It's indeed complicated but with this fascinating book, you would be able to learn it with ease. It shows detail representations of commands and the teachings can be easily comprehended by both advanced learners and beginners. It's impossible not to understand the teachings of this bookLEARN NEW TRICKS AND TIPS: Sometimes what it really takes to work efficiently are some little tweak here and there. You can perform strenuous tasks with just a single line of command and this book is jam-packed with such useful and helpful tips that would increase the efficiency of your work. It would help you in ways you can't imagine, making sure you get the best results at a quicker time.IDEAL GIFT: lf you're not too into the programming world and you know someone who is and you would like to surprise that person with a wonderful gift, give him this epic book and be dazzled by his reaction. This book is capable of enlightening a person in a very special way, teaching tips and tricks in Kubernetes that cannot be found anywhere else so anybody would be glad to behold it. Whether you're a beginner or an advanced learner you would gain a lot from this epic book so much so that you would be forced to come back here and drop your testimony. Step into a new world of automating application deployment and scaling as well as management by leveraging the full power of Kubernetes with this breath-taking book."
9781492048046,"Operators are a way of packaging, deploying, and managing Kubernetes applications. A Kubernetes application doesn't just run on Kubernetes; it's composed and managed in Kubernetes terms. Operators add application-specific operational knowledge to a Kubernetes cluster, making it easier to automate complex, stateful applications and to augment the platform. Operators can coordinate application upgrades seamlessly, react to failures automatically, and streamline repetitive maintenance like backups.Think of Operators as site reliability engineers in software. They work by extending the Kubernetes control plane and API, helping systems integrators, cluster administrators, and application developers reliably deploy and manage key services and components. Using real-world examples, authors Jason Dobies and Joshua Wood demonstrate how to use Operators today and how to create Operators for your applications with the Operator Framework and SDK.Learn how to establish a Kubernetes cluster and deploy an OperatorExamine a range of Operators from usage to implementationExplore the three pillars of the Operator Framework: the Operator SDK, the Operator Lifecycle Manager, and Operator MeteringBuild Operators from the ground up using the Operator SDKBuild, package, and run an Operator in development, testing, and production phasesLearn how to distribute your Operator for installation on Kubernetes clusters"
9781838828042,"Kubernetes is a popular open source orchestration platform for managing containers in a cluster environment. With this Kubernetes cookbook, you'll learn how to implement Kubernetes using a recipe-based approach. The book will prepare you to create highly available Kubernetes clusters on multiple clouds such as Amazon Web Services (AWS), Google Cloud Platform (GCP), Azure, Alibaba, and on-premises data centers. Starting with recipes for installing and configuring Kubernetes instances, you'll discover how to work with Kubernetes clients, services, and key metadata. You'll then learn how to build continuous integration/continuous delivery (CI/CD) pipelines for your applications, and understand various methods to manage containers. As you advance, you'll delve into Kubernetes' integration with Docker and Jenkins, and even perform a batch process and configure data volumes. You'll get to grips with methods for scaling, security, monitoring, logging, and troubleshooting. Additionally, this book will take you through the latest updates in Kubernetes, including volume snapshots, creating high availability clusters with kops, running workload operators, new inclusions around kubectl and more. By the end of this book, you'll have developed the skills required to implement Kubernetes in production and manage containers proficiently. What you will learn Deploy cloud-native applications on Kubernetes Automate testing in the DevOps workflow Discover and troubleshoot common storage issues Dynamically scale containerized services to manage fluctuating traffic needs Understand how to monitor your containerized DevOps environment Build DevSecOps into CI/CD pipelines Who this book is for ﻿This Kubernetes book is for developers, IT professionals, and DevOps engineers and teams who want to use Kubernetes to manage, scale, and orchestrate applications in their organization. Basic understanding of Kubernetes and containerization is necessary."
9798612775850,"Step Into A New World Of Automating Application Deployment, Scaling As Well As Management By Leveraging The Full Power Of Kubernetes Originally developed by Google, Kubernetes has grown to become a game-changer in the deployment, scaling and management of various cloud-based application containers across different clusters of hosts.Given that it is open source, you may not hear a lot about it and its powerful capabilities, probably because various vendors can provide their branded Kubernetes distributions. You will only get to know that everything is powered by Kubernetes if you have special interest in the workings of different application containers By virtue that you are reading this, it means you've come across the term Kubernetes before and are perhaps looking to understand what it is all about and how you can start using it to develop and run your software/application.Even if you've found yourself here out of curiosity to learn what this term called Kubernetes is about, this book will take you by the hand to usher you into the world of using Kubernetes in automating deployment, scaling and management of various applications like a pro It goes wide and deep on the subject with lots of dummy easy to follow examples and illustrations to ensure that by the end of the book, you can start using Kubernetes without needing any extra help More precisely, you will learn: The basics of Kubernetes, including what it is, features of Kubernetes, concepts and design principles of Kubernetes, Kubernetes monitoring, what containerization is all about, how to run units in Kubernetes and much moreHow Kubernetes works, including what exactly it does, how it does it and how it can make your work easier and stress free as a userThe lingo used in Kubernetes to ensure you understand everything like the expertsEverything there is about Pods, Extensions, Client Libraries, Orchestration Containerization, Deployment and much more, with respect to KubernetesHow to automate your build process, autonomic computing as well as debugging and integration testingThe ins and outs of Kubernetes cluster architects, including how to build and deploy Kubernetes clustersHow to declare as well as add configuration with KubernetesHow to effectively add feedback to your code to enable Kubernetes to manage your services effectivelyHow to perfectly define how your application fits together with the help of external and internal servicesHow to leverage the power of scheduling in KubernetesThe ins and outs of the control plane in KubernetesHow you can monitor as well as measure your services with the help of integration testing coupled with in-production deploymentsHow to manage and deploy applications on KubernetesHow to secure KubernetesAnd much more It doesn't matter whether this is your first encounter with the term Kubernetes or you've already come across the term but are looking for something more detailed; you will find this book valuable and actionable in understanding how unleash the full power of Kubernetes to your benefit Don't wait...Click Buy Now With 1-Click or Buy Now to get started"
