ISBN,書籍簡介
9781803349466,"If you are not happy with the fixed amount of income you are getting from your 9to 5 job, then you might want to try cryptocurrency trading.  With this venture, you will have a chance to earnan unlimited amount of money. Of course, this woulddepend on your skills, strategies, and attitude. You will even have it better if good luck is on your side.  Anyway, if you have decided that you want to be a cryptocurrency trader, then congratulations! You are on the right path. This book will guide you through everything you need. Here, you will learn about the following:   -The fundamentals of cryptocurrency and cryptocurrency trading -The history of cryptocurrency -How to trade on the cryptocurrency market -The pros and cons of cryptocurrency trading -The different types of cryptocurrencies -Bitcoin and altcoins -Bitcoin mining -The present and future of cryptocurrencies -Blockchain technology -Proper storage, tracking, and selling of cryptocurrencies -Initial Coin Offering -Asset allocation -Cryptocurrency trading strategies as well as common mistakes -The risk to reward ratio -The best software programs or bots as well as exchanges for cryptocurrency trading  This book was written for both beginners and experienced traders who wish to learn something new. It is straightforward and easy to comprehend. It also contains examples that can help you understand concepts better.  So, what are you still waiting for? Get this book today and start changing the course of your life forever!"
9781737403203,"This book explains everything you need to know about Bitcoin and Blockchain technology.Educating readers about the history of Bitcoin dating back to the 1980s and the evolution of digital cash in the 21st century. Exploring how this new peer to peer electronic system works, while explaining the importance of the Blockchain."
9798527852080,"This book is a step by step guide for everyone who wants to start as an Ethereum developer. It was designed for those who have never programmed anything in blockchain and want to get started. I will cover everything from installing basic requirements to writing, testing and deploying smart contracts. I will also cover topics like IPFS, Filecoin, ENS, Chainlink, Truffle, Ganache, OpenZeppelin, Pinata, Fleek, Infura, Metamask, Opensea, Polygon, among others. You will receive free updates as new content becomes available."
9781801344739,"Discover Everything You Need To Know About This Emerging Asset That Is Revolutionizing The World Of Art & How You Can Profit From It...Ah, the world of Crypto, where as soon as you think you kind of understand Crypto a new term comes about just for you to feel as clueless as you did before.Don't worry, we felt exactly the same when NFTs came about.So, what is an NFT?NFT = Non-Fungible Token, which essentially a unique token, such as a unique digital baseball card, or piece of artwork.But, can't you just download the same video, picture or music file as the person who paid millions for X NFT?Yes, but just like you can buy Counterfeit Mona Lisa's, you don't have any ownership or copyright on the original, which is the reason it is worth $10 and not $100,000,000s.The actual NFT is also stored on a blockchain, on a Cryptocurrency like Ethereum or Theta and is unique to that owner, even if there is say 50 versions of X trading card.Oh, and I haven't even mentioned how NFTs could revolutionize gaming with unique in game items, a market only beginning to blossom.So, just like collecting Art, owning the rights to famous songs & owning unique collectibles NFTs can be INCREDIBLY VALUABLE & inside you'll discover everything you need to not only understand this lucrative market, but also how you can profit from it as either an artist, or a collector.Here's a tiny preview of what's inside...A Step By Step Guide To The Process Of Buying & Storing Your First NFTsHow To Spot NFT 'Trends' Early & How To Know When You've Missed The BoatExactly What NFTs Will Actually Hold Their Value Long-Term And What Ones Are Not Worth Your TimeAn Easy To Follow Step By Step Guide To Understanding The Ins & Outs Of The Growing NFT World Including Marketplaces, Copyrights & Maximizing ProfitsAnd SO Much More!So, If You Want An All-In-One Guide That Explains NFTs So Simply That Even An Alien Visiting Earth Could Understand It, Then Scroll Up And Click ""Buy This Audiobook"" Today."
9781802957044,"Are your customers looking for inexpensive business to generate a lot of money without getting trapped in taxes?Do you want to make sure that by buying one book they will come back and buy again and again?Then, you need this book in your library and your customers will never stop using it and giving it away!? - WHY THIS BOOK CAN HELP YOUR CUSTOMERSThis brand-new book is a book written for entrepreneurs by entrepreneurs. Forget the flashing banners, false promises of overnight success, and the phony internet gurus - this is business insight straight from the source. Laying it all on the line, each line of this smart guide has come together for one singular purpose: to bring your customer the undiluted truth of what it takes to make the 6-figure online business dream a reality. Your Client Will Find:  How to remove subconscious negative beliefs about money How to create a 6-figure online business following a bullet-proof method that can count more than 2.347 case studies in the US How to create a budget, minimize risks and start with less than 97$ Tips and tricks to discover the most profitable trends of 2021 The best online tools available gratis online and how to use them stress-free How to remove problems with old documents that complicate the financial statements How to switch from paper accounting to online accounting with the tool Quickbooks How to manage the business portfolio in the best way and minimize risks BONUS: How to adopt the most profitable and tax-free* strategies in 2021Are you ready to leave a permanent imprint on the lives of your customers and their family?Click the ""BUY NOW"" Button, Buy THOUSANDS of Copies and Let Your Customers Rob Your Library!!"
9781801347679,"Introducing The Branch Of Cryptocurrency That Is Disrupting The Global Financial Intermediaries & Helping Remove Corruption & Pointless Middle Men...Everyone by now has heard countless people state the problems with 'Central banks' and centralization in general.And, that is exactly why millions of people are so excited for DeFi which literally means 'Decentralized Finance.'To put it simply DeFi draws inspiration from how Bitcoin & The Blockchain work as a medium of exchange (money) and expands this use case into more complex financial uses such as loans, insurance & crowdfunding.Not to even mention Derivatives. (A multi-trillion $ industry)So let's say you want a loan. You could use one of DeFi's lending platforms for a 'Crypto backed loan' that then uses a 'Smart Contract' (a set of terms & conditions written into the code that need to be met) instead of a intermediary like a Bank.We all love cutting out the middle man right?So, inside the Defi Blueprint you will discover everything you need to truly understand how revolutionary this branch of Crypto could be for ENDLESS industries & of course how it will effect your daily life.Then, once you understand it, we will discuss how you can invest in the projects that are revolutionizing finance & how to find the 'DeFi Gems' that could literally 10, or even 100x.Here's a tiny preview of what's inside...The Top 5 DeFi Projects That Should Be Part Of EVERY Crypto Investors PortfolioHow DeFi Could Revolutionize The Gambling & Prediction Market IndustryA Step By Step Guide To Researching DeFi Projects To Help You Separate The True 'Industry Disrupters' From The Terrible & Scam Based Projects (Please Don't Invest Before Understanding This)5 Industries Smart Contracts & Web 3.0 Are In The Process Of Transforming FOREVERAnd SO Much More!So If You Want 5 Hours Of Easy To Digest DeFi Education + The Step By Step Guide To Investing In The Future Of Finance, Then Scroll Up And Click ""Buy This Audiobook"" Today."
9781990373657,"The first difference is that ethereum allows cryptocurrency transaction records called 'blocks' to be created faster than it is currently done using bitcoin. Although bitcoin is now widely accepted by online merchants and is even being adopted by physical stores, the fans of ethereum believe the efficiency of this cryptocurrency makes for better transactions. In this book, you will learn: - What cryptocurrencies are- What ethereum is- How to mine for ethereum- What blockhain is and how it works- The pros and cons of cryptocurrency- The technology behind it all- How to determine mining profitability- The different types of cryptocurrencies- The most profitable types of cryptocurrenciesTоdау, ѕmаrt contracts саn run on the рubliс ethеrеum blockchain, a diѕtributеd lеdgеr tесhnоlоgу thаt is uѕеd tо kеер trасk of аll rеlаtеd trаnѕасtiоnѕ аnd аgrееmеntѕ.The ѕmаrt соntrасtѕ that run оn itѕ blосkсhаin соuld hаvе widеѕрrеаd applications, as dеvеlореrѕ соuld uѕе thеm tо сrеаtе markets, еxесutе transactions based on agreements сrеаtеd lоng аgо аnd kеер track оf рlеdgеѕ mаdе bу diffеrеnt counterparties."
9781990373688,"Having said that, it's impossible to jump on the crypto wagon if you don't really understand what cryptocurrency really is and how it works. In this book, you will learn everything you need to know to quickly and effortlessly get a massive return on your ethereum investment by putting the basics to work. You'll learn: - What is ethereum and how it works- A step by step guide to buy ether today- Pros and cons of the ethereum platform- How to find a secure wallet to safely store your coins- The ethereum virtual machine revolution- Interesting future developments of ethereum- The most important tips to buy ethereum safely- A step by step guide to mining ether for profit- How to program your own smart contract- Myths most people believe about smart contracts- The ethereum ecosystem and how to take advantage of it- And much, much moreImagine a world where your box of important documents is nonexistent. Instead of keeping track of physical paper documents, you're able to contractually engage with others over the internet in an environment that is safe and can be transparently monitored at all times. Additionally, you're able to exchange currency on a digital network. In essence, your physical life is able to become more digitally recognized and reputable. "
9781802266016,"55 % discount for bookstores ! Now At $21.99 instead of $ 34.08 $Your customers will never stop reading this guide !!""1 BOOK OF 2""Bitcoin (BTC) is a new kind of advanced money with cryptographic keys that is decentralized to an organization of PCs utilized by users and diggers throughout the planet and isn't constrained by a solitary association or government. It is the primary digital cryptographic money that has acquired the public's consideration and is acknowledged by a developing number of vendors. Like different monetary standards, users can utilize the advanced money to purchase labor and products online just as in some actual stores that acknowledge it as a type of installment. Currency merchants can likewise exchange Bitcoins in Bitcoin trades. Bitcoin is known as cryptographic money or advanced currency. It's a fundamentally online currency. Like any currency, you can trade it for different monetary standards (like say, purchase bitcoins with US dollars or the other way around) and it varies according to different monetary standards also. Buy it Now and let your customers get addicted to this amazing book"
9781777692308,"Introduction to Bitcoin is the people's guide to Bitcoin. This book is written for those who want to understand how Bitcoin works without relying on equations and complex coding languages. With the help of cypherpunks, David Ricardo brings the history of early digital currencies to life from early encryption software to digital currency experiments. In straightforward language, he explains Bitcoin's peer-to-peer network, digital signatures, the blockchain, proof-of-work, mining, network attacks, and Bitcoin's underlying software. All readers will quickly gain a clear understanding of Bitcoin and the future implications of the Bitcoin network, including energy expenditure and the Lightning Networ. Included is an overview on how to safely store bitcoin, as well as a review of the people who have been suspected by the media of being Satoshi Nakamoto, the creator of Bitcoin. With simple diagrams, full-color images, and clear explanations, this is the introductory guide for anyone who wishes to understand Bitcoin.Included is Satoshi Nakamoto's whitepaper Bitcoin: A Peer-to-Peer Electronic Cash System."
9781802954500,"""55% OFF for Bookstores! Discounted Retail Price NOW!!""Are your customers looking for inexpensive business to generate a lot of money trading crypto without getting trapped in taxes?Do you want to make sure that by buying one book they will come back and buy again and again?Then, you need this book in your library and your customers will never stop using it and giving it away!? -WHY THIS BOOK CAN HELP YOUR CUSTOMERSThis brand-new book is a book written for entrepreneurs by entrepreneurs.Forget the flashing banners, false promises of overnight success, and the phony internet gurus -this is business insight straight from the source. Laying it all on the line, each line of this smart guide has come together for one singular purpose: to bring your customer the undiluted truth of what it takes to make the 6-figure online business dream a reality.Your Client Will Find: How to remove subconscious negative beliefs about money How to create a 6-figure online businessfollowing a bullet-proof method that can count more than 2.347 case studies in the USHow to create a budget, minimize risks and start with less than 97$Tips and tricks to discover the most profitable trends of 2021 The best online tools availablegratis online and how to use them stress-freeHow to remove problems with old documents that complicate the financial statementsHow to switch from paper accounting to online accounting with the tool Quickbooks How to manage the business portfolio in the best way and minimize risks BONUS: How to adopt the most profitable and tax-free* strategies in 2021Are you ready to leave a permanent imprint on the lives of your customers and their family?Click the""BUYNOW"" Button, Buy THOUSANDS of Copiesand Let Your Customers Rob Your Library!"
9781802954562,"""55% OFF for Bookstores! Discounted Retail Price NOW!!""Are your customers looking for inexpensive business to generate a lot of money trading crypto without getting trapped in taxes?Do you want to make sure that by buying one book they will come back and buy again and again?Then, you need this book in your library and your customers will never stop using it and giving it away!? -WHY THIS BOOK CAN HELP YOUR CUSTOMERSThis brand-new book is a book written for entrepreneurs by entrepreneurs.Forget the flashing banners, false promises of overnight success, and the phony internet gurus -this is business insight straight from the source. Laying it all on the line, each line of this smart guide has come together for one singular purpose: to bring your customer the undiluted truth of what it takes to make the 6-figure online business dream a reality.Your Client Will Find: How to remove subconscious negative beliefs about money How to create a 6-figure online businessfollowing a bullet-proof method that can count more than 2.347 case studies in the USHow to create a budget, minimize risks and start with less than 97$Tips and tricks to discover the most profitable trends of 2021 The best online tools availablegratis online and how to use them stress-freeHow to remove problems with old documents that complicate the financial statementsHow to switch from paper accounting to online accounting with the tool Quickbooks How to manage the business portfolio in the best way and minimize risks BONUS: How to adopt the most profitable and tax-free* strategies in 2021Are you ready to leave a permanent imprint on the lives of your customers and their family?Click the""BUYNOW"" Button, Buy THOUSANDS of Copiesand Let Your Customers Rob Your Library!"
9781802954470,"""55% OFF for Bookstores! Discounted Retail Price NOW!!""Are your customers looking for inexpensive business to generate a lot of money trading crypto without getting trapped in taxes?Do you want to make sure that by buying one book they will come back and buy again and again?Then, you need this book in your library and your customers will never stop using it and giving it away!? -WHY THIS BOOK CAN HELP YOUR CUSTOMERSThis brand-new book is a book written for entrepreneurs by entrepreneurs.Forget the flashing banners, false promises of overnight success, and the phony internet gurus -this is business insight straight from the source. Laying it all on the line, each line of this smart guide has come together for one singular purpose: to bring your customer the undiluted truth of what it takes to make the 6-figure online business dream a reality.Your Client Will Find: How to remove subconscious negative beliefs about money How to create a 6-figure online businessfollowing a bullet-proof method that can count more than 2.347 case studies in the USHow to create a budget, minimize risks and start with less than 97$Tips and tricks to discover the most profitable trends of 2021 The best online tools availablegratis online and how to use them stress-freeHow to remove problems with old documents that complicate the financial statementsHow to switch from paper accounting to online accounting with the tool Quickbooks How to manage the business portfolio in the best way and minimize risks BONUS: How to adopt the most profitable and tax-free* strategies in 2021Are you ready to leave a permanent imprint on the lives of your customers and their family?Click the""BUYNOW"" Button, Buy THOUSANDS of Copiesand Let Your Customers Rob Your Library!"
9781802954517,"""55% OFF for Bookstores! Discounted Retail Price NOW!!""Are your customers looking for inexpensive business to generate a lot of money trading crypto without getting trapped in taxes?Do you want to make sure that by buying one book they will come back and buy again and again?Then, you need this book in your library and your customers will never stop using it and giving it away!? -WHY THIS BOOK CAN HELP YOUR CUSTOMERSThis brand-new book is a book written for entrepreneurs by entrepreneurs.Forget the flashing banners, false promises of overnight success, and the phony internet gurus -this is business insight straight from the source. Laying it all on the line, each line of this smart guide has come together for one singular purpose: to bring your customer the undiluted truth of what it takes to make the 6-figure online business dream a reality.Your Client Will Find: How to remove subconscious negative beliefs about money How to create a 6-figure online businessfollowing a bullet-proof method that can count more than 2.347 case studies in the USHow to create a budget, minimize risks and start with less than 97$Tips and tricks to discover the most profitable trends of 2021 The best online tools availablegratis online and how to use them stress-freeHow to remove problems with old documents that complicate the financial statementsHow to switch from paper accounting to online accounting with the tool Quickbooks How to manage the business portfolio in the best way and minimize risks BONUS: How to adopt the most profitable and tax-free* strategies in 2021Are you ready to leave a permanent imprint on the lives of your customers and their family?Click the""BUYNOW"" Button, Buy THOUSANDS of Copiesand Let Your Customers Rob Your Library!"
9781802954463,"""55% OFF for Bookstores! Discounted Retail Price NOW!!""Are your customers looking for inexpensive business to generate a lot of money trading crypto without getting trapped in taxes?Do you want to make sure that by buying one book they will come back and buy again and again?Then, you need this book in your library and your customers will never stop using it and giving it away!? -WHY THIS BOOK CAN HELP YOUR CUSTOMERSThis brand-new book is a book written for entrepreneurs by entrepreneurs.Forget the flashing banners, false promises of overnight success, and the phony internet gurus -this is business insight straight from the source. Laying it all on the line, each line of this smart guide has come together for one singular purpose: to bring your customer the undiluted truth of what it takes to make the 6-figure online business dream a reality.Your Client Will Find: How to remove subconscious negative beliefs about money How to create a 6-figure online businessfollowing a bullet-proof method that can count more than 2.347 case studies in the USHow to create a budget, minimize risks and start with less than 97$Tips and tricks to discover the most profitable trends of 2021 The best online tools availablegratis online and how to use them stress-freeHow to remove problems with old documents that complicate the financial statementsHow to switch from paper accounting to online accounting with the tool Quickbooks How to manage the business portfolio in the best way and minimize risks BONUS: How to adopt the most profitable and tax-free* strategies in 2021Are you ready to leave a permanent imprint on the lives of your customers and their family?Click the""BUYNOW"" Button, Buy THOUSANDS of Copiesand Let Your Customers Rob Your Library!"
9781802954579,"""55% OFF for Bookstores! Discounted Retail Price NOW!!""Are your customers looking for inexpensive business to generate a lot of money trading crypto without getting trapped in taxes?Do you want to make sure that by buying one book they will come back and buy again and again?Then, you need this book in your library and your customers will never stop using it and giving it away!? -WHY THIS BOOK CAN HELP YOUR CUSTOMERSThis brand-new book is a book written for entrepreneurs by entrepreneurs.Forget the flashing banners, false promises of overnight success, and the phony internet gurus -this is business insight straight from the source. Laying it all on the line, each line of this smart guide has come together for one singular purpose: to bring your customer the undiluted truth of what it takes to make the 6-figure online business dream a reality.Your Client Will Find: How to remove subconscious negative beliefs about money How to create a 6-figure online businessfollowing a bullet-proof method that can count more than 2.347 case studies in the USHow to create a budget, minimize risks and start with less than 97$Tips and tricks to discover the most profitable trends of 2021 The best online tools availablegratis online and how to use them stress-freeHow to remove problems with old documents that complicate the financial statementsHow to switch from paper accounting to online accounting with the tool Quickbooks How to manage the business portfolio in the best way and minimize risks BONUS: How to adopt the most profitable and tax-free* strategies in 2021Are you ready to leave a permanent imprint on the lives of your customers and their family?Click the""BUYNOW"" Button, Buy THOUSANDS of Copiesand Let Your Customers Rob Your Library!"
