書名,書籍網址,作者,出版社,ISBN,圖片網址
"Computer Networks, Big Data and Iot: Proceedings of Iccbi 2020",https://www.eslite.com/product/1001294884246896,,Ingram International Inc,9789811609640,0
Computer Networks: The Ultimate Guide To Computer Network Basics & Networking Concepts For Beginners: Networking Made Easy,https://www.eslite.com/product/1001294883902445,Carl Oldroyd,Ingram International Inc,9798722692443,0
Computer Networks and the Internet: A Hands-On Approach,https://www.eslite.com/product/1001294883693337,Gerry Howser,Ingram International Inc,9783030344986,0
Computer Networks and Communications,https://www.eslite.com/product/1001294884156792,,Ingram International Inc,9781682857663,0
Computer Networks,https://www.eslite.com/product/1001294884053436,Clive Gifford,Ingram International Inc,9780778715603,0
Computer Networks,https://www.eslite.com/product/1001294883583534,Andrew Tanenbaum ; David Wetherall,Ingram International Inc,9780132126953,0
"Computer Networking the Complete Guide: A Complete Guide to Manage Computer Networks and to Learn Wireless Technology, Cisco CCNA, IP Subnetting and N",https://www.eslite.com/product/1001294883637613,Erick Stack,Ingram International Inc,9781801117838,0
Building Computer Vision Applications Using Artificial Neural Networks: With Step-By-Step Examples in Opencv and Tensorflow with Python,https://www.eslite.com/product/1001294883593103,Shamshad Ansari,Ingram International Inc,9781484258866,0
"Computer Networking The Complete Guide: A Complete Guide to Manage Computer Networks and to Learn Wireless Technology, Cisco CCNA, IP Subnetting and N",https://www.eslite.com/product/1001294884249906,Erick Stack,Ingram International Inc,9781706677475,0
Computer Science for International Baccalaureate Syllabus: Topic 3: Networks,https://www.eslite.com/product/1001294884206790,Sarah Shakibi Phd,Ingram International Inc,9781694956804,0
Deep Learning for Computer Vision: Expert techniques to train advanced neural networks using TensorFlow and Keras,https://www.eslite.com/product/1001294884298548,Rajalingappaa Shanmugamani,Ingram International Inc,9781788295628,0
"Computer Networking Problems and Solutions: An Innovative Approach to Building Resilient, Modern Networks",https://www.eslite.com/product/1001294883740862,Russ White ; Ethan Banks,Ingram International Inc,9781587145049,0
"Computer Forensics: Investigating File and Operating Systems, Wireless Networks, and Storage (Chfi), 2nd Edition",https://www.eslite.com/product/1001294883208901,Ec-Council,Ingram International Inc,9781305883482,0
"Learning Deep Learning: Theory and Practice of Neural Networks, Computer Vision, Natural Language Processing, and Transformers Using Tensorflo",https://www.eslite.com/product/1001294884392256,Magnus Ekman,Ingram International Inc,9780137470358,0
Theory and Engineering of Dependable Computer Systems and Networks: Proceedings of the Sixteenth International Conference on Dependability of Computer,https://www.eslite.com/product/1001294883956610,,Ingram International Inc,9783030767723,0
Hacking With Kali Linux: A Beginner's Guide with Detailed Practical Examples of Wireless Networks Hacking & Penetration Testing To Fully Unders,https://www.eslite.com/product/1001294883935927,Learn Computer Hacking in Deep,Ingram International Inc,9781801384339,0
Hacking With Kali Linux: 2 Books in 1: A Beginner's Guide with Detailed Practical Examples of Wireless Networks Hacking & Penetration Testing T,https://www.eslite.com/product/1001294883937788,Learn Computer Hacking in Deep,Ingram International Inc,9781801384551,0
Hacking With Kali Linux: A Beginner's Guide with Detailed Practical Examples of Wireless Networks Hacking & Penetration Testing To Fully Unders,https://www.eslite.com/product/1001294883934030,Learn Computer Hacking in Deep,Ingram International Inc,9781801384315,0
Hacking With Kali Linux: 2 Books in 1: A Beginner's Guide with Detailed Practical Examples of Wireless Networks Hacking & Penetration Testing T,https://www.eslite.com/product/1001294883937450,Learn Computer Hacking in Deep,Ingram International Inc,9781801384575,0
Hacking With Kali Linux: A Beginner's Guide with Detailed Practical Examples of Wireless Networks Hacking & Penetration Testing To Fully Unders,https://www.eslite.com/product/1001294883896519,Learn Computer Hacking in Deep,Ingram International Inc,9781801384292,0
Hacking With Kali Linux: A Beginner's Guide with Detailed Practical Examples of Wireless Networks Hacking & Penetration Testing To Fully Unders,https://www.eslite.com/product/1001294883896511,Learn Computer Hacking in Deep,Ingram International Inc,9781801384278,0
"Networking For Beginners: Learn Basic Computer Networking Concepts, What A Computer Network Is And What Are The Different Types Of Networks.",https://www.eslite.com/product/1001294883825993,Kevin Kali,Ingram International Inc,9781914058448,0
"Networking For Beginners: Learn Basic Computer Networking Concepts, What A Computer Network Is And What Are The Different Types Of Networks.",https://www.eslite.com/product/1001294883826006,Kevin Kali,Ingram International Inc,9781914058455,0
"Ethical Hacking: A Beginner's Guide to Computer and Wireless Networks Defense Strategies, Penetration Testing and Information Security",https://www.eslite.com/product/1001294883050769,Zach Codings,Ingram International Inc,9781801444439,0
"Hacking With Kali Linux: A Complete Guide for Beginners to Hacking, Security, Computer Networking, Wireless Networks, Cybersecurity, Including",https://www.eslite.com/product/1001294883836049,Alan Scripting,Ingram International Inc,9781914105258,0
"Hacking With Kali Linux: A Complete Guide for Beginners to Hacking, Security, Computer Networking, Wireless Networks, Cybersecurity, Including",https://www.eslite.com/product/1001294883836037,Alan Scripting,Ingram International Inc,9781914105241,0
Hacking With Kali Linux: The Complete Beginner's Guide with Detailed Practical Examples of Wireless Networks Hacking & Penetration Testing to F,https://www.eslite.com/product/1001294883632894,Learn Computer Hacking In Deep,Ingram International Inc,9781801201223,0
Hacking with Kali Linux: The Complete Beginner's Guide With Detailed Practical Examples Of Wireless Networks Hacking & Penetration Testing To F,https://www.eslite.com/product/1001294883594833,Learn Computer Hacking In Deep,Ingram International Inc,9781801201216,0
"Hacking With Kali Linux: A Complete Guide for Beginners to Hacking, Security, Computer Networking, Wireless Networks, Cybersecurity, Including",https://www.eslite.com/product/1001294884042746,Alan Scripting,Ingram International Inc,9781914105098,0
"Hacking With Kali Linux: A Complete Guide for Beginners to Hacking, Security, Computer Networking, Wireless Networks, Cybersecurity, Including",https://www.eslite.com/product/1001294884066174,Alan Scripting,Ingram International Inc,9781914105012,0
Hacking With Kali Linux: The Complete Beginner's Guide with Detailed Practical Examples of Wireless Networks Hacking & Penetration Testing to F,https://www.eslite.com/product/1001294884089579,Learn Computer Hacking In Deep,Ingram International Inc,9781801131773,0
Hacking with Kali Linux: The Complete Beginner's Guide with Detailed Practical Examples of Wireless Networks Hacking & Penetration Testing to F,https://www.eslite.com/product/1001294884081239,Learn Computer Hacking In Deep,Ingram International Inc,9781801123525,0
"Ethical Hacking: A Beginner's Guide to Computer and Wireless Networks Defense Strategies, Penetration Testing and Information Security",https://www.eslite.com/product/1001294884031833,Zach Codings,Ingram International Inc,9781801091572,0
"Ethical Hacking: A Beginner's Guide to Computer and Wireless Networks Defense Strategies, Penetration Testing and Information Security",https://www.eslite.com/product/1001294884032816,Zach Codings,Ingram International Inc,9781801091565,0
"Networking For Beginners: Learn Basic Computer Networking Concepts, What A Computer Network Is And What Are The Different Types Of Networks.",https://www.eslite.com/product/1001294884070740,Kevin Kali,Ingram International Inc,9781914058127,0
"Cybersecurity: A Simple Beginner's Guide to Cybersecurity, Computer Networks and Protecting Oneself from Hacking in the Form of Phish",https://www.eslite.com/product/1001294883470800,,Ingram International Inc,9781952559761,0
"Networking For Beginners: Learn Basic Computer Networking Concepts, What A Computer Network Is And What Are The Different Types Of Networks.",https://www.eslite.com/product/1001294884070271,Kevin Kali,Ingram International Inc,9781914058134,0
Applied Deep Learning and Computer Vision for Self-Driving Cars: Build autonomous vehicles using deep neural networks and behavior-cloning techniques,https://www.eslite.com/product/1001294884087088,Sumit Ranjan ; S. Senthamilarasu,Ingram International Inc,9781838646301,0
Unsupervised Learning in Space and Time: A Modern Approach for Computer Vision Using Graph-Based Techniques and Deep Neural Networks,https://www.eslite.com/product/1001294883492547,,Ingram International Inc,9783030421274,0
"The Python Bible 7 in 1: Volumes One To Seven (Beginner, Intermediate, Data Science, Machine Learning, Finance, Neural Networks, Computer Visio",https://www.eslite.com/product/1001294883019927,Florian Dedov,Ingram International Inc,9798629849124,0
Ethical Hacking: The Ultimate Guide to Using Penetration Testing to Audit and Improve the Cybersecurity of Computer Networks for Beginn,https://www.eslite.com/product/1001294884207293,Lester Evans,Ingram International Inc,9781647481810,0
"Cyber Operations: Building, Defending, and Attacking Modern Computer Networks",https://www.eslite.com/product/1001294884123312,Mike O'Leary,Ingram International Inc,9781484242933,0
A Guide to Convolutional Neural Networks for Computer Vision,https://www.eslite.com/product/1001294883398289,,Ingram International Inc,9781681730219,0
"Hacking: The Complete Beginner's Guide To Computer Hacking: How To Hack Networks and Computer Systems, Information Gathering, P",https://www.eslite.com/product/1001294884171539,Jack Jones,Ingram International Inc,9781545355053,0
Epanet and Development. How to calculate water networks by computer,https://www.eslite.com/product/1001294883003972,Santiago Arnalich,Ingram International Inc,9788461314775,0
Queueing Networks and Markov Chains,https://www.eslite.com/product/1002136461524081,"Bolch, Gunter/ Greiner, Stefan/ Meer, Hermann de/ Trivedi, Kishor Shridharbhai/ Greiner, Stefan/ Mee",John Wiley & Sons Singapore Pte.,9780471193661,0
電腦與網際網路 (國際版/第6版),https://www.eslite.com/product/1001122982792606,Douglas E. Comer/ 原著,全華圖書股份有限公司,9789865031589,https://s.eslite.dev/upload/product/l/2681804833001/20190905044744307074.jpg
電腦網路: 開放源碼導向,https://www.eslite.com/product/1001114562275124,Ying-Dar Lin/ Ren-Hung Hwang/ Fred Baker,美商麥格羅希爾國際股份有限公司台灣分公司,9789861578729,https://s.eslite.dev/Upload/Product/201310/l/635169043793942500.jpg
電腦網路,https://www.eslite.com/product/1001117652125766,Andrew S. Tanenbaum/David J. Wetherall,台灣東華書局股份有限公司,9789862800973,https://s.eslite.dev/Upload/Product/201203/l/634674835042025000.jpg
網路概論 (第4版),https://www.eslite.com/product/1001124691591146,顏榮泉/ 馬得翔/ 唐任威/ 鄭懿讚,學貫行銷股份有限公司,9789867198549,0
零信任網路: 在不受信任的網路中建構安全系統,https://www.eslite.com/product/1001133102681942452003,Evan Gilman/ Doug Barth,美商歐萊禮股份有限公司台灣分公司,9789865026332,https://s.eslite.dev/upload/product/l/2681942452003/20201120044057710750.jpg
電腦網際網路 (第7版/國際版/附部分內容光碟),https://www.eslite.com/product/1001122982729730,James F. Kurose/ Keith W. Ross,全華圖書股份有限公司,9789864639502,https://s.eslite.dev/Upload/Product/201811/l/636790771816433750.jpg
區域網路,https://www.eslite.com/product/1001122982102605,Behrouz A. Forouzan,全華圖書股份有限公司,9789574939206,https://s.eslite.dev/Upload/Product/201112/l/634590162837912500.jpg
計算機組織與設計: 硬體 軟體的介面 (亞洲版),https://www.eslite.com/product/1001273422421395,David A. Patterson/ John L. Hennessy,台灣東華書局股份有限公司,9789574838110,https://s.eslite.dev/Upload/Product/201505/l/635682259436057500.jpg
Web開發者一定要懂的駭客攻防術,https://www.eslite.com/product/1001113692681994168006,Malcolm McDonald,碁峰資訊股份有限公司,9789865027407,https://s.eslite.dev/upload/product/l/2681994168006/20210323040322112020.jpg
PowerShell流程自動化攻略,https://www.eslite.com/product/1001113692681951601003,Adam Bertram,碁峰資訊股份有限公司,9789865026677,https://s.eslite.dev/upload/product/l/2681951601003/20201205041504612677.jpg
深度學習: 內行人的做法,https://www.eslite.com/product/1001133102738876,Josh Patterson/ Adam Gibson,美商歐萊禮股份有限公司台灣分公司,9789865020262,https://s.eslite.dev/Upload/Product/201901/l/636827922696928750.jpg
鄉民都來了: 網路群眾的組織力量,https://www.eslite.com/product/1001120162407421,克雷．薛基,貓頭鷹出版社,9789862622391,https://s.eslite.dev/Upload/Product/201506/l/635709047785575000.jpg
微控制器的網路連線與應用 (附範例光碟),https://www.eslite.com/product/1001122982100982,Fred Eady,全華圖書股份有限公司,9789572151716,https://s.eslite.dev/Upload/Product/201112/l/634587570366853750.jpg
