書名,書籍網址,作者,出版社,ISBN,圖片網址
The Photograph: 攝影構圖與色彩設計,https://www.eslite.com/product/1001122231958752,哈洛德．曼特,電腦人文化事業股份有限公司,9789861992181,https://s.eslite.dev/Upload/Product/201101/l/634300729122988750.jpg
My Taiwan Photograph Memoir,https://www.eslite.com/product/1001294884323022,Daniel Nardini,Ingram International Inc,9781664180239,0
My South Korea Photograph Memoir,https://www.eslite.com/product/1001294883938333,Daniel Nardini,Ingram International Inc,9781664172517,0
The Figure in the Photograph,https://www.eslite.com/product/1001294883749476,Kevin Sullivan,Ingram International Inc,9780749026615,0
Photograph Restoration and Enhancement: Using Adobe Photoshop CC 2021 Version,https://www.eslite.com/product/1001294883830072,Vickie Ellen Wolper,Ingram International Inc,9781683925989,0
How to Photograph Boxing,https://www.eslite.com/product/1001294884399415,Richard E. Baker,Ingram International Inc,9798564495097,0
"How to Photograph Food: Compose, Shoot, and Edit Appetizing Images",https://www.eslite.com/product/1001294883130066,Beata Lubas,Ingram International Inc,9780762499625,0
The Photograph,https://www.eslite.com/product/1001294883158057,Kat Karpenko,Ingram International Inc,9780995893429,https://s.eslite.dev/upload/ean/9780995893429.jpg
Heaven is a Photograph,https://www.eslite.com/product/1001294884138734,Christine Sloan Stoddard,Ingram International Inc,9781944866372,https://s.eslite.dev/upload/ean/9781944866372.jpg
"The Heart of the Photograph: 100 Questions for Making Stronger, More Expressive Photographs",https://www.eslite.com/product/1001294884175349,David Duchemin,Ingram International Inc,9781681985459,https://s.eslite.dev/upload/ean/9781681985459.jpg
"The Girl in the Photograph: The True Story of a Native American Child, Lost and Found in America",https://www.eslite.com/product/1001294883173995,Byron L. Dorgan,Ingram International Inc,9781250173645,https://s.eslite.dev/upload/ean/9781250173645.jpg
How to Photograph Absolutely Everything,https://www.eslite.com/product/1001294883568148,Tom Ang,Ingram International Inc,9781465480255,https://s.eslite.dev/upload/ean/9781465480255.jpg
The Winter Garden Photograph,https://www.eslite.com/product/1001294883459022,,Ingram International Inc,9781946433220,https://s.eslite.dev/upload/ean/9781946433220.jpg
The Photograph: A Gripping Love Story with a Heartbreaking Twist,https://www.eslite.com/product/1001294884027350,Debbie Rix,Ingram International Inc,9781786814777,https://s.eslite.dev/upload/ean/9781786814777.jpg
Photograph Restoration and Enhancement: Using Adobe Photoshop CC 2017 Version,https://www.eslite.com/product/1001294883377530,,Ingram International Inc,9781683921509,https://s.eslite.dev/upload/ean/9781683921509.jpg
Photograph Like a Thief: Using Imitation and Inspiration to Create Great Images,https://www.eslite.com/product/1001294883683875,Glyn Dewis,Ingram International Inc,9781681981826,https://s.eslite.dev/upload/ean/9781681981826.jpg
How to Photograph Cars,https://www.eslite.com/product/1001294883603309,James Mann,Ingram International Inc,9780995624603,https://s.eslite.dev/upload/ean/9780995624603.jpg
東京闇鴉: Girls Photograph (全),https://www.eslite.com/product/1001129222491762,あざの耕平/  原作;   待田堂子/ 構成;  すみ兵 / 角色原案; 横山コウヂ,東立出版社有限公司,9789864622351,https://s.eslite.dev/upload/product/l/2681285039008/ec1097110.jpg
Photograph 51,https://www.eslite.com/product/1001294883546698,Anna Ziegler,Ingram International Inc,9781783199358,0
Photograph,https://www.eslite.com/product/1001294883439644,Ringo Starr,Ingram International Inc,9781905662333,https://s.eslite.dev/upload/ean/9781905662333.jpg
The Photograph,https://www.eslite.com/product/1001294883530233,Beverly Lewis,Ingram International Inc,9780764212475,https://s.eslite.dev/upload/ean/9780764212475.jpg
Photograph,https://www.eslite.com/product/1001294883554818,Beverly Lewis,Ingram International Inc,9780764217296,https://s.eslite.dev/upload/ean/9780764217296.jpg
Understanding a Photograph,https://www.eslite.com/product/1001294883318580,,Ingram International Inc,9781597112567,https://s.eslite.dev/upload/ean/9781597112567.jpg
The Photograph: Composition and Color Design,https://www.eslite.com/product/1001294884061495,Harald Mante,Ingram International Inc,9781937538064,0
The Girl in the Photograph,https://www.eslite.com/product/1001294883302052,,Ingram International Inc,9781564787842,0
Fashion as Photograph: Viewing and Reviewing Images of Fashion,https://www.eslite.com/product/1001294884336852,,Ingram International Inc,9781845115173,0
"The Unforgettable Photograph: 228 Ideas, Tips, and Secrets for Taking the Best Pictures of Your Life",https://www.eslite.com/product/1002140492281142,George Lange/ Scott Mowbray,WORKMAN PUBLISHING CO.,9780761169239,https://s.eslite.dev/upload/product/l/2680824855000/20190408185423901616.jpg
[ 2 Books in 1 ] - Nature Landscape Stock Images and Artistic Cities in the World - Full Color HD: 250 Professional Photos - Amazing Nature Photograph,https://www.eslite.com/product/1001294884342296,Photography - Art of Nature,Ingram International Inc,9781803112138,0
[ 2 Books in 1 ] - Nature Landscape Stock Images and Artistic Cities in the World - Full Color HD: 250 Professional Photos - Amazing Nature Photograph,https://www.eslite.com/product/1001294884336309,Photography - Art of Nature,Ingram International Inc,9781803112145,0
Humorous Erotica: Olivia. She had a photograph collection of each cockerel she'd known,https://www.eslite.com/product/1001294884381663,Pamela Vance,Ingram International Inc,9781802354805,0
The Black Leopard: My Quest to Photograph One of Africa?s Most Elusive Big Cats,https://www.eslite.com/product/1001138852682018424009,Will Burrard-Lucas,CHRONICLE BOOKS,9781797202914,https://s.eslite.dev/upload/product/l/2682018424009/20210515011843287278.jpg
"The Ravine: A Family, a Photograph, a Holocaust Massacre Revealed",https://www.eslite.com/product/1001294883090153,Wendy Lower,Ingram International Inc,9780544828698,0
Who Invented Oscar Wilde?: The Photograph at the Center of Modern American Copyright,https://www.eslite.com/product/1001294883825992,David Newhoff,Ingram International Inc,9781640121584,https://s.eslite.dev/upload/ean/9781640121584.jpg
"West Virginia: Its Farms and Forests, Mines and Oil-Wells: with a Glimpse of its Scenery, a Photograph of its Population, and an Exhi",https://www.eslite.com/product/1001294884338503,J. R. Dodge,Ingram International Inc,9781941755532,0
Voyager: Photograph's from Humanity's Greatest Journey,https://www.eslite.com/product/1001294883508532,Jens Bezemer ; Joel Meter,Ingram International Inc,9783961712915,https://s.eslite.dev/upload/ean/9783961712915.jpg
"The Bird Photographer's Guide To Bosque del Apache: When, Where, and How to Photograph the Birds of Bosque del Apache",https://www.eslite.com/product/1001294883676549,Tim Boyer,Ingram International Inc,9798670912075,0
The Photograph as Contemporary Art (4 Ed.),https://www.eslite.com/product/1002147642859741,Charlotte Cotton,THAMES & HUDSON LTD.,9780500204481,https://s.eslite.dev/Upload/Product/202008/l/637341138472732500.jpg
How to Photograph Food,https://www.eslite.com/product/1002162282870145,Beata Lubas,ILEX PRESS LTD,9781781576915,https://s.eslite.dev/upload/product/l/2681915025005/20200827011530208138.jpg
Portrait of a Phantom: The Story of Robert Johnson's Lost Photograph,https://www.eslite.com/product/1001294884118301,Zeke Schein,Ingram International Inc,9781455625499,https://s.eslite.dev/upload/ean/9781455625499.jpg
First in Flight: How a Photograph Captured the Takeoff of the Wright Brothers' Flyer,https://www.eslite.com/product/1001294883127584,Michael Burgan,Ingram International Inc,9780756566135,https://s.eslite.dev/upload/ean/9780756566135.jpg
First Look at a Black Hole: How a Photograph Solved a Space Mystery,https://www.eslite.com/product/1001294883127590,Danielle Smith-Llera,Ingram International Inc,9780756566142,https://s.eslite.dev/upload/ean/9780756566142.jpg
First Look at a Black Hole: How a Photograph Solved a Space Mystery,https://www.eslite.com/product/1001294883127601,Danielle Smith-Llera,Ingram International Inc,9780756566586,https://s.eslite.dev/upload/ean/9780756566586.jpg
First in Flight: How a Photograph Captured the Takeoff of the Wright Brothers' Flyer,https://www.eslite.com/product/1001294884051509,Michael Burgan,Ingram International Inc,9780756566579,https://s.eslite.dev/upload/ean/9780756566579.jpg
Grief: The Biography of a Holocaust Photograph,https://www.eslite.com/product/1001294883035291,David Shneer,Ingram International Inc,9780190923815,https://s.eslite.dev/upload/ean/9780190923815.jpg
Desert Dust: One Man's Passion to Uncover the True Story Behind an Iconic American Photograph,https://www.eslite.com/product/1001294883918321,Paul W. Papa ; R. J. Gill Gillilan,Ingram International Inc,9781734405729,0
Keeper of the Hearth: Picturing Roland Barthes' Unseen Photograph,https://www.eslite.com/product/1001294883034058,Odette England,Ingram International Inc,9789053309377,0
How to Read a Photograph,https://www.eslite.com/product/1002147642777606,Ian Jeffrey/ Max Kozloff,THAMES & HUDSON LTD.,9780500295380,https://s.eslite.dev/upload/product/l/2681783193004/20191216210407009086.jpg
"Ruby's Hope: A Story of How the Famous ""Migrant Mother"" Photograph Became the Face of the Great Depression",https://www.eslite.com/product/1001294883305067,Monica Kulling,Ingram International Inc,9781624148187,0
"Hector: A Boy, a Protest, and the Photograph That Changed Apartheid",https://www.eslite.com/product/1001294883305037,Adrienne Wright,Ingram International Inc,9781624146916,https://s.eslite.dev/upload/ean/9781624146916.jpg
How to Photograph Absolutely Everything: Successful Pictures from Your Digital Camera,https://www.eslite.com/product/1002158932747536,Tom Ang,DORLING KINDERSLEY LTD.,9780241363584,https://s.eslite.dev/upload/product/l/2681725085008/ec1695057.jpg
Jazz Day: The Making of a Famous Photograph,https://www.eslite.com/product/1001294883293317,Roxane Orgill,Ingram International Inc,9781536205633,https://s.eslite.dev/upload/ean/9781536205633.jpg
Rome. Eternal City in the Photograph Collection of the Royal Institute of British Architects,https://www.eslite.com/product/1002157282766662,Marco Iuliano/ Gabriella Musto/ Ed.,SKIRA EDITORE,9788857239194,https://s.eslite.dev/upload/product/l/2681762342003/ec1766805.jpg
"The Illustrated Guide to Rocks & Minerals: How to Find, Identify and Collect the World's Most Fascinating Specimens, with Over 800 Detailed Photograph",https://www.eslite.com/product/1001294883119389,John Farndon,Ingram International Inc,9780754834427,https://s.eslite.dev/upload/ean/9780754834427.jpg
"The Complete Guide to Drones, Extended and Fully Updated 2nd Edition: Choose, Build, Photograph, Race",https://www.eslite.com/product/1001294883515622,Adam Juniper,Ingram International Inc,9781577151685,https://s.eslite.dev/upload/ean/9781577151685.jpg
"Railpass Railmap Europe - Alpine Special 2018: Discover Europe with Icon, Info and Photograph Illustrated Railway Atlas. Specifically Designed for Glo",https://www.eslite.com/product/1001294884107320,Caty Ross,Ingram International Inc,9781911165156,https://s.eslite.dev/upload/ean/9781911165156.jpg
The Face of Crazy Horse: The Case for a Tintype Photograph of the Great Lakota Patriot,https://www.eslite.com/product/1001294883416979,,Ingram International Inc,9781947459083,0
"Portrait of a Phantom: Story of Robert Johnson's Lost Photograph, the",https://www.eslite.com/product/1001294884125552,Zeke Schein ; Poppy Brite,Ingram International Inc,9781455622450,https://s.eslite.dev/upload/ean/9781455622450.jpg
Black Power Salute: How a Photograph Captured a Political Protest,https://www.eslite.com/product/1001294884000583,Danielle Smith-Llera,Ingram International Inc,9780756555269,0
Emanations: The Art of the Cameraless Photograph,https://www.eslite.com/product/1002138242503506,Geofrrey Batchen,PRESTEL PUBLISHING LIMITED,9783791355047,https://s.eslite.dev/Upload/Product/201604/l/635969304137986250.jpg
Photograph,https://www.eslite.com/product/1002138942477536,Ed Sheeran,HAL LEONARD PUBLISHING CORPORA,9781495049866,0
The Complete Visual Encyclopedia of Naval Aircraft of World Wars I and II: Features a Directory of Over 70 Aircraft with 330 Identification Photograph,https://www.eslite.com/product/1001294884047340,Francis Crosby,Ingram International Inc,9780754830566,0
The Photograph As Contemporary Art (3 Ed.),https://www.eslite.com/product/1002147642316537,Charlotte Cotton,THAMES & HUDSON LTD.,9780500204184,https://s.eslite.dev/Upload/Product/201404/l/635327260041535000.jpg
Understanding a Photograph,https://www.eslite.com/product/1002149592286177,John Berger,PENGUIN BOOKS LTD.,9780141392028,https://s.eslite.dev/upload/product/l/2680829688009/ec768791.jpg
It's a Snap!: George Eastman's First Photograph,https://www.eslite.com/product/1001294883612718,Monica Kulling,Ingram International Inc,9781770495135,https://s.eslite.dev/upload/ean/9781770495135.jpg
Bryan Peterson's Understanding Composition Field Guide: How to See and Photograph Images with Impact,https://www.eslite.com/product/1002150082146323,Bryan F. Peterson,Penguin Random House LLC,9780770433079,https://s.eslite.dev/Upload/Product/201205/l/634738046986473750.jpg
"Nature Spirits, Spirit Guides, and Ghosts: How to Talk with and Photograph Beings of Other Realms",https://www.eslite.com/product/1001294883565298,Atala Dorothy Toy,Ingram International Inc,9780835609029,0
Beyond Snapshots: How to Take That Fancy DSLR Camera Off Auto and Photograph Your Life like a Pro,https://www.eslite.com/product/1002150222095868,Rachel Devine/ Peta Mazey,POTTER,9780817435806,https://s.eslite.dev/Upload/Product/201111/l/634569756120972500.jpg
Little Rock Girl 1957: How a Photograph Changed the Fight for Integration,https://www.eslite.com/product/1001294883019049,Shelley Tougas,Ingram International Inc,9780756545123,https://s.eslite.dev/upload/ean/9780756545123.jpg
Breaker Boys: How a Photograph Helped End Child Labor,https://www.eslite.com/product/1001294883018678,Michael Burgan,Ingram International Inc,9780756545109,https://s.eslite.dev/upload/ean/9780756545109.jpg
Birmingham 1963: How a Photograph Rallied Civil Rights Support,https://www.eslite.com/product/1001294884051189,Shelley Tougas,Ingram International Inc,9780756543983,https://s.eslite.dev/upload/ean/9780756543983.jpg
Birmingham 1963: How a Photograph Rallied Civil Rights Support,https://www.eslite.com/product/1001294883018672,Shelley Tougas,Ingram International Inc,9780756544461,https://s.eslite.dev/upload/ean/9780756544461.jpg
"How to Read a Photograph: Understanding, Interpreting and Enjoying the Great Photographers",https://www.eslite.com/product/1002147642073874,Ian Jeffrey/ Max Kozloff,THAMES & HUDSON LTD.,9780500287842,0
Photograph America: Walker Evans/ Henri Cartier-Bresson,https://www.eslite.com/product/1002167921964598,"Cartier-Bresson, Henri/ Evans, Walker; Sire, Agnes/ Ed.; Chevrier, Jean-Francois/ Text",STEIDL,9783865216809,0
Oxford Companion to the Photograph,https://www.eslite.com/product/1002147651851064,"Lenman, Robin",OXFORD UNIVERSITY PRESS,9780199551989,0
A Drawing of a Memory of a Photograph of You,https://www.eslite.com/product/1004135661710990,Space Mtn,卓音企業有限公司,0654807002820,0
How to Photograph Absolutely Everything,https://www.eslite.com/product/1002158931816414,"Ang, Tom",DORLING KINDERSLEY LTD.,9781405319850,https://s.eslite.dev/Upload/Product/201001/l/633988275467023750.jpg
Inside the Photograph,https://www.eslite.com/product/1002139071647200,"Bunnell, Peter C.",APERTURE FUNDATION,9781597110211,https://s.eslite.dev/Upload/Product/200807/l/633516506748437500.jpg
The Oxford Companion to the Photograph,https://www.eslite.com/product/1002147651450623,"Leman, Robin/ Ed.",OXFORD UNIVERSITY PRESS,9780198662716,https://s.eslite.dev/upload/product/l/2680010135008/ec93437.jpg
"Beyond the Reach of Time and Change, Volume 53: Native American Reflections on the Frank A. Rinehart Photograph Collection",https://www.eslite.com/product/1001294883135456,,Ingram International Inc,9780816523603,https://s.eslite.dev/upload/ean/9780816523603.jpg
PHOTOGRAPH,https://www.eslite.com/product/1002138801251924,"LIVELY, PENELOPE",PENGUIN GROUP (USA) INC.,9780142004425,https://s.eslite.dev/upload/product/l/2611355364006/20190409003923774260.jpg
Williamsport: The Grit Photograph Collection,https://www.eslite.com/product/1001294883677497,Robin Van Auken ; Louis E. Hunsinger,Ingram International Inc,9781531620295,0
"The Girl in the Picture: The Story of Kim Phuc, the Photograph, and the Vietnam War",https://www.eslite.com/product/1002138802044712,"Chong, Denise",PENGUIN GROUP (USA) INC.,9780140280210,https://s.eslite.dev/upload/product/l/2680592118000/20190408181317122767.jpg
數位人體造像VIRTUALNUDE PHOTOGRAPH,https://www.eslite.com/product/1001119661367089,章光和,桑格文化有限公司,9789579650434,0
The Photograph,https://www.eslite.com/product/1002147651500293,"Clarke, Graham",OXFORD UNIVERSITY PRESS,9780192842008,https://s.eslite.dev/upload/ean/9780192842008.jpg
Why People Photograph,https://www.eslite.com/product/1002139071521302,"ADAMS, ROBERT",APERTURE FUNDATION,9780893816032,https://s.eslite.dev/upload/ean/9780893816032.jpg
Night Photograph,https://www.eslite.com/product/1002157701504003,"Greenlaw, Lavinia",FABER & FABER LTD,9780571168941,0
LOST PHOTOGRAPH,https://www.eslite.com/product/1004153101116864,"BURGER, ROB","Tzadik, Hips Road Production",0702397717027,0
PHOTOGRAPH,https://www.eslite.com/product/1002141551370212,"PRICE, MARY",STANFORD UNIVERSITY PRESS,9780804729642,0
MARK'S Photograph Album/ Girly/ Blue,https://www.eslite.com/product/1005147132526682,,MARK'S INC,,https://s.eslite.dev/upload/product/l/2681350271005/ec1644007.jpg
MARK'S Photograph Album/ Girly/ White,https://www.eslite.com/product/1005147132526684,,MARK'S INC,,https://s.eslite.dev/upload/product/l/2681350273009/ec1644015.jpg
MARK'S Photograph Album/ Basic/ White,https://www.eslite.com/product/1005147132526681,,MARK'S INC,,https://s.eslite.dev/upload/product/l/2681350270008/ec1644001.jpg
MARK'S Photograph Album/ Girly/ Pink,https://www.eslite.com/product/1005147132526683,,MARK'S INC,,https://s.eslite.dev/upload/product/l/2681350272002/ec1644011.jpg
HOW TO PHOTOGRAPH YOUR LIFE,https://www.eslite.com/product/1002149561281861,"KELSH, NICK","Stewart, Tabori & Chang",9781584792796,0
FASHION IN MOTION,https://www.eslite.com/product/1002167521356350,"HAASE, ESTHER PHOTOGRAPH",EDITIONS STEMMLE,9783908163190,0
The Case Against Spirit Photographs,https://www.eslite.com/product/1001294884393619,C. Vincent Patrick ; W. Whately Smith,Ingram International Inc,9789354757945,0
Barkley L. Hendricks: Photography,https://www.eslite.com/product/1001294883873662,Anna Arabindan-Kesson,Ingram International Inc,9788857241500,0
Pocket Guide to Crime Scene Photography,https://www.eslite.com/product/1001294883915962,Mark E. Vecellio ; Erick P. Bryant,Ingram International Inc,9780367787554,0
Think Like a Street Photographer: How to Think Like a Street Photographer,https://www.eslite.com/product/1001294883848089,Matt Stuart,Ingram International Inc,9781786277282,0
"The Posing Playbook for Photographing Kids: Strategies and Techniques for Creating Engaging, Expressive Images",https://www.eslite.com/product/1001294883566160,Tamara Lackey,Ingram International Inc,9781681985534,https://s.eslite.dev/upload/ean/9781681985534.jpg
"攝影靈感都是偷來的! 影像大師的逆向學習之路, 從模彷和觀察啟發偉大作品",https://www.eslite.com/product/1001288742705155,格林．德威斯,創意市集,9789579199186,https://s.eslite.dev/Upload/Product/201808/l/636705234844971250.jpg
行進! 鐵支路: 日治臺灣鐵道寫真,https://www.eslite.com/product/1001284832673693,鄧志忠,蒼璧出版有限公司,9789869615631,https://s.eslite.dev/Upload/Product/202006/l/637278943222362500.jpg
The Apple Photos Book for Photographers: Building Your Digital Darkroom with Photos and Its Powerful Editing Extensions,https://www.eslite.com/product/1001294883516796,Derrick Story,Ingram International Inc,9781681983509,https://s.eslite.dev/upload/ean/9781681983509.jpg
壽山之美攝影詩文輯,https://www.eslite.com/product/1001196432648072,余光中,內政部營建署,9789860541427,https://s.eslite.dev/Upload/Product/201712/l/636498741873198750.jpg
攝影的異義,https://www.eslite.com/product/1001156502479017,約翰．伯格,麥田出版社,9789863442899,https://s.eslite.dev/Upload/Product/201512/l/635867157659764996.jpg
The Best of the Digital Photography Book Series: The Step-By-Step Secrets for How to Make Your Photos Look Like the Pros'!,https://www.eslite.com/product/1001294883037410,Scott Kelby,Ingram International Inc,9780134385129,https://s.eslite.dev/upload/ean/9780134385129.jpg
這就是當代攝影 (增修版),https://www.eslite.com/product/1001236652398148,夏洛蒂．柯頓,大家,9789866179914,https://s.eslite.dev/upload/product/l/2680980286007/ec940591.jpg
Strange Stories: The Photography of Gerald Davis,https://www.eslite.com/product/1001294884227678,Todd Oldham,Ingram International Inc,9781623260408,https://s.eslite.dev/upload/ean/9781623260408.jpg
DSLR構圖寶典: 數位攝影的黃金法則,https://www.eslite.com/product/1001113882302825,布萊恩．彼得森,旗標科技股份有限公司,9789863121800,https://s.eslite.dev/Upload/Product/201401/l/635264082241717500.jpg
恐怖靈異照片 一,https://www.eslite.com/product/1004242582144642,永江二郎,飛行國際視聽股份有限公司,,https://s.eslite.dev/upload/product/l/2680688435004/154297.jpg
恐怖靈異照片 二,https://www.eslite.com/product/1004242582144643,永江二郎,飛行國際視聽股份有限公司,,https://s.eslite.dev/upload/product/l/2680688436001/154296.jpg
National Audubon Society Guide to Landscape Photography,https://www.eslite.com/product/1001294883814854,Tim Fitzharris,Ingram International Inc,9781554079933,0
New A-Z of Creative Photography: Over 50 Techniques Explained in Full,https://www.eslite.com/product/1001294884384211,Lee Frost,Ingram International Inc,9780715338247,0
The Tlingit Encounter with Photography,https://www.eslite.com/product/1001294883425762,Sharon Bohn Gmelch,Ingram International Inc,9781934536100,https://s.eslite.dev/upload/ean/9781934536100.jpg
National Geographic: The Photographs,https://www.eslite.com/product/1001294883238216,Leah Bendavid-Val,Ingram International Inc,9781426202919,https://s.eslite.dev/upload/ean/9781426202919.jpg
數位相機拍攝聖經,https://www.eslite.com/product/1001113881724144,,旗標科技股份有限公司,9789574421336,https://s.eslite.dev/Upload/Product/202010/l/637388032920722500.jpg
Mastering Landscape Photography: The Luminous Landscape Essays,https://www.eslite.com/product/1001294883457063,,Ingram International Inc,9781933952062,https://s.eslite.dev/upload/ean/9781933952062.jpg
倩影情深　　　　　　　　　　,https://www.eslite.com/product/1004123081165675,木住野佳子,環球國際唱片股份有限公司,0011105988421,https://s.eslite.dev/upload/product/2631027568006/l/0011105988421.jpg
KIKI SMITH,https://www.eslite.com/product/1002176891320785,"POSNER, HELAINE",International Center for Photograph,9780933642287,0
Atlas: Tadao Ando,https://www.eslite.com/product/1001138242682050531000,Philippe Séclier,PRESTEL PUBLISHING LIMITED,9783791387970,https://s.eslite.dev/upload/product/l/2682050531000/20210727013530214014.jpg
The Thursday Murder Club,https://www.eslite.com/product/1002290222873735,Richard Osman,Pamela Dorman Books,9781984880963,https://s.eslite.dev/upload/product/l/2681920495008/20200910013938515002.jpg
On Photographs,https://www.eslite.com/product/1002147642862170,David Campany,THAMES & HUDSON LTD.,9780500545065,https://s.eslite.dev/upload/product/l/2681903871003/20200728162140237011.jpg
Joel Meyerowitz: How I Make Photographs,https://www.eslite.com/product/1002147772851923,Joel Meyerowitz,LAURENCE KING PUBLISHING,9781786275806,https://s.eslite.dev/upload/product/l/2681889951003/20200612161920775001.jpg
Tate: Sketch Club Urban Drawing,https://www.eslite.com/product/1002162282870142,Phil Dean,ILEX PRESS LTD,9781781577752,https://s.eslite.dev/upload/product/l/2681915019004/20200827011529405136.jpg
Sweet Sorrow,https://www.eslite.com/product/1002149602868099,David Nicholls,HODDER & STOUGHTON LIMITED,9781444715422,https://s.eslite.dev/upload/product/l/2681912645008/20200820012829853609.jpg
Vivien Liu: Being There,https://www.eslite.com/product/1002321072826902,Vivien Liu,Trope Publishing Co.,9781732693609,https://s.eslite.dev/upload/product/2681856583008/l/9781732693609.jpg
The Man Who Saw Everything,https://www.eslite.com/product/1002149592838618,Deborah Levy,PENGUIN BOOKS LTD.,9780241977606,https://s.eslite.dev/upload/product/l/2681870573009/20200410163630976115.jpg
緊縛男子 2,https://www.eslite.com/product/1001119132830367,芙羽忍/ kirin,青文出版社股份有限公司,9789865122799,https://s.eslite.dev/upload/product/l/2681860070006/20200304032530284701.jpg
Black Gold: Best Of Editors,https://www.eslite.com/product/1004261222816072,Editors (主編樂團),PIAS Recordings,5400863017200,https://s.eslite.dev/upload/product/l/2681843276005/20191221010359685019.jpg
Black Gold: Best Of Editors (2CD/Deluxe Edition),https://www.eslite.com/product/1004261222816073,Editors (主編樂團),PIAS Recordings,5400863017231,https://s.eslite.dev/upload/product/l/2681843277002/20191221010400197021.jpg
TO:KY:OO,https://www.eslite.com/product/1002147642777607,Liam Wong,THAMES & HUDSON LTD.,9780500023198,https://s.eslite.dev/upload/product/l/2681783197002/20190709013126198062.jpg
