ISBN,書籍簡介
9781839213199,"Develop a deep understanding of the theoretical foundations of blockchain technology and learn how to write smart contracts and build decentralized applicationsKey Features  Updated with four new chapters on consensus algorithms, Ethereum 2.0, tokenization, and enterprise blockchains Dive deep into foundational pillars of blockchain technology such as decentralization, cryptography, and consensus protocols Get to grips with Solidity, Web3, cryptocurrencies, smart contract development and solve scalability, security, and privacy issues Discover the architecture of different distributed ledger platforms including Ethereum, Bitcoin, Hyperledger Fabric, Hyperledger Sawtooth, Corda, and Quorum  Book Description Blockchain technology is the backbone of cryptocurrencies, and it has applications in finance, government, media, and many other industries. With a legacy of providing technologists with executable insights, the third edition of Mastering Blockchain is thoroughly revised and updated with the latest blockchain research, including four new chapters on consensus algorithms, Serenity (Ethereum 2.0), tokenization, and enterprise blockchains. Apart from covering the basics, including blockchain's technical underpinnings, cryptography, and consensus protocols, this book provides you with expert knowledge on decentralization, decentralized application development on Ethereum, Bitcoin, alternative coins, smart contracts, alternative blockchains, and Hyperledger. Furthermore, you will explore how to implement blockchain solutions beyond cryptocurrencies, such as the Internet of Things with blockchain, blockchain scalability, enterprise blockchains, and tokenization using blockchain, and the future scope of this fascinating and disruptive technology. By the end of this book, you will have gained a thorough understanding of the various facets of blockchain technology and be comfortable applying them to diverse real-world scenarios. What you will learn  Grasp the mechanisms behind Bitcoin, Ethereum, and alternative cryptocurrencies Understand cryptography and its usage in blockchain technology Understand the theoretical foundations of smart contracts Develop decentralized applications using Solidity, Remix, Truffle, Ganache, and Drizzle Identify and examine applications of blockchain beyond cryptocurrencies Understand the architecture and development of Ethereum 2.0 Explore research topics and the future scope of blockchain technology  Who this book is for If you are a technologist, business executive, a student or an enthusiast who wishes to explore the fascinating world of blockchain technology, smart contracts, decentralized applications and distributed systems then this book is for you. Basic familiarity with a beginner-level command of a programming language would be a plus."
9781484261361,"Business professionals looking to understand the impact, future, and limitations of blockchain need look no further. This revolutionary technology has impacted business and the economy in unprecedented ways within the past decade, and it is only continuing to grow. As a leader in your organization, it is vital that you decode blockchain and optimize all the ways in which it can improve your business.Author of Decoding Blockchain for Business, Stijn Van Hijfte, expertly emphasizes the imperative of professionals in any sector of industry to understand the core concepts and implications of blockchain technology. Cryptocurrencies, cryptotrading, and constantly-changing tax structures for financial systems using blockchain technologies are covered in detail. The lasting effects of blockchain across specific industries such as media, real estate, finance, and regulatory bodies are addressed with an insightful eye from Van Hijfte.If not properly implemented with care and a foundation of knowledge, blockchain brings risks and uncertainties to a company. Know your technology to be ready for the present and the future, and stay ahead of the curve. Blockchain is here to stay, and Decoding Blockchain for Business is your professional roadmap. What You Will Learn  Discover the risks associated with blockchain if not properly implemented Gain insights on how blockchain technology affects other booming topics such as AI, IoT, and RPA Look at the regulations surrounding Blockchain in different countries  Who This Book Is For Business professionals looking to understand the impact, future, and limitations of Blockchain and how individuals and companies should prepare for this technology."
9780367343101,"Yassine Maleh is a PhD of the University Hassan 1st in Morocco in the field of Internet of Things Security and privacy, since 2013. He is Senior Member of IEEE, Member of the International Association of Engineers IAENG and The Machine Intelligence Research Labs. Dr Maleh has made contributions in the fields of information security and privacy, Internet of Things Security, Wireless and Constrained Networks Security. His research interests include Information Security and Privacy, Internet of Things, Networks Security, Information system and IT Governance. He has published over than 50 papers (Book chapters, international journals and conferences/workshops), and 3 edited books and 1 authored book. He is the editor in chief of the International Journal of Smart Security Technologies (IJSST). He serves as an Associate Editor for IEEE Access (2019 Impact Factor 4.098), the International Journal of Digital Crime and Forensics (IJDCF) and the International Journal of Information Security and Privacy (IJISP). He was also a Guest Editor of a special issue on Recent Advances on Cyber Security and Privacy for Cloud-of-Things of the International Journal of Digital Crime and Forensics (IJDCF), Volume 10, Issue 3, July-September 2019. He has served and continues to serve on executive and technical program committees and as a reviewer of numerous international conference and journals such as Elsevier Ad Hoc Networks, IEEE Network Magazine, IEEE Sensor Journal, ICT Express, and Springer Cluster Computing. He was the Publicity chair of BCCA 2019 and the General Chair of the MLBDACP 19 symposium.Mamoun Alazab is the Associate Professor in the College of Engineering, IT and Environment at Charles Darwin University, Australia. He received his Ph.D. degree is in Computer Science from the Federation University of Australia, School of Science, Information Technology and Engineering. He is a cyber security researcher and practitioner with industry and academic experience. Dr Alazab's research is multidisciplinary that focuses on cyber security and digital forensics of computer systems including current and emerging issues in the cyber environment like cyber-physical systems and the internet of things, by taking into consideration the unique challenges present in these environments, with a focus on cybercrime detection and prevention. He looks into the intersection use of machine learning as an essential tool for cybersecurity, for example, for detecting attacks, analyzing malicious code or uncovering vulnerabilities in software. He has more than 100 research papers. He is the recipient of short fellowship from Japan Society for the Promotion of Science (JSPS) based on his nomination from the Australian Academy of Science. He delivered many invited and keynote speeches, 27 events in 2019 alone. He convened and chaired more than 50 conferences and workshops. He is the founding chair of the IEEE Northern Territory Subsection: (Feb 2019 - current). He is a Senior Member of the IEEE, Cybersecurity Academic Ambassador for Oman's Information Technology Authority (ITA), Member of the IEEE Computer Society's Technical Committee on Security and Privacy (TCSP) and has worked closely with government and industry on many projects, including IBM, Trend Micro, the Australian Federal Police (AFP), the Australian Communications and Media Authority (ACMA), Westpac, UNODC, and the Attorney General's Department. Mohammad Shojafar received his PhD in Information Communication and Telecommunications (advisor Prof. Enzo Baccarelli) from Sapienza University of Rome, Italy as the second rank university in QS Ranking in Italy and top 100 in the world with an Excellent degree in May 2016. He is Intel Innovator, Senior IEEE member, and Senior Lecturer in the 5GIC/ICS at the University of Surrey, Guildford, UK. Before joint to 5GIC, he was served as a Senior Member in the Computer Department at the University of Ryerson, Toronto, Canada. He was Senior Researcher (Researcher Grant B) and a Marie Curie Fellow in the SPRITZ Security and Privacy Research group at the University of Padua, Italy. Also, he was a Senior Researcher in the Consorzio Nazionale Interuniversitario per le Telecomunicazioni (CNIT) partner at the University of Rome Tor Vergata contributed to 5g PPP European H2020 ``SUPERFLUIDITY'' project for 14 months. Dr. Mohammad was principle investigator on PRISENODE project, a 275,000 euro Horizon 2020 Marie Curie project in the areas of network security and Fog computing and resource scheduling collaborating between the University of Padua and University of Melbourne. He also was a principal investigator on an Italian SDN security and privacy (60,000 euro) supported by the University of Padua in 2018. He was contributed to some Italian projects in telecommunications like GAUChO - A Green Adaptive Fog Computing and Networking Architecture (400,000 euro), S2C: Secure, Software-defined Cloud (30,000 euro), and SAMMClouds- Secure and Adaptive Management of Multi-Clouds (30,000 euro) collaborating among Italian universities. His main research interest is in the area of Network and Network Security and Privacy. In this area, he published more than 100+ papers in topmost international peer-reviewed journals and conferences, e.g., IEEE TCC, IEEE TNSM, IEEE TGCN, IEEE TSUSC, IEEE Network, IEEE SMC, IEEE PIMRC, and IEEE ICC/GLOBECOM. He served as a PC member of several prestigious conferences, including IEEE INFOCOM Workshops in 2019, IEEE GLOBECOM, IEEE ICC, IEEE ICCE, IEEE UCC, IEEE SC2, IEEE ScalCom, and IEEE SMC. He was a General Chair in FMEC 2019, INCoS 2019, INCoS 2018, and a Technical Program Chair in IEEE FMEC 2020. He served as an Associate Editor in IEEE Transactions on Consumer Electronics, IET Communication, Springer Cluster Computing, KSII - Transactions on Internet and Information Systems, Tylor & Francis International Journal of Computers and Applications (IJCA), and Ad Hoc & Sensor Wireless Networks Journals.Imed Romdhani is a full-time Associate Professor in networking at Edinburgh Napier University since June 2005. He was awarded his Ph.D. from the University of Technology of Compiegne (UTC), France in May 2005. He also holds engineering and a Master degree in networking obtained respectively in 1998 and 2001 from the National School of Computing (ENSI, Tunisia) and Louis Pasteur University (ULP, France). He worked extensively with Motorola Research Labs in Paris and authored 4 patents.   Member of Huawei ICT Academy Advisory Board (https: //www.huaweiacad.com)   Member of Africa Universities Fund Advisory Board (https: //aufusa.org)   Module Leader of a set of Advanced Networking modules   Module Leader of the MSc Dissertation Project module   An active member of the Internet Engineering Task Force (IETF)   Founder and CEO of Digital Tunisia   Founder of the Student PPMS Project (www.studentppms.com)   Higher Education Expert at E-Taalim (www.e-taalim.com)   Specialities: IoT, IPv6, Wireless and Mobile Networking, Multicast Communication, Vehicular and Mesh   Networks, Wireless Sensor Networks, Fellowship of the UK Higher Education Academy, PRINCE2 certified. "
9780367473587,"Blockchain technology is defined as a decentralized system of distributed registers that are used to record data transactions on multiple computers. The reason this technology has gained popularity is that you can put any digital asset or transaction in the blocking chain, the industry does not matter. Blockchain technology has infiltrated all areas of our lives, from manufacturing to healthcare and beyond. Cybersecurity is an industry that has been significantly affected by this technology and may be more so in the future. Blockchain for Cybersecurity and Privacy: Architectures, Challenges, and Applications is an invaluable resource to discover the blockchain applications for cybersecurity and privacy. The purpose of this book is to improve the awareness of readers about blockchain technology applications for cybersecurity and privacy. This book focuses on the fundamentals, architectures, and challenges of adopting blockchain for cybersecurity. Readers will discover different applications of blockchain for cybersecurity in IoT and healthcare. The book also includes some case studies of the blockchain for e-commerce online payment, retention payment system, and digital forensics.  The book offers comprehensive coverage of the most essential topics, including:    Blockchain architectures and challenges   Blockchain threats and vulnerabilities   Blockchain security and potential future use cases   Blockchain for securing Internet of Things    Blockchain for cybersecurity in healthcare   Blockchain in facilitating payment system security and privacy  This book comprises a number of state-of-the-art contributions from both scientists and practitioners working in the fields of blockchain technology and cybersecurity. It aspires to provide a relevant reference for students, researchers, engineers, and professionals working in this particular area or those interested in grasping its diverse facets and exploring the latest advances on the blockchain for cybersecurity and privacy."
9781393535485,"Blockchain has been brought to mainstream attention with the growing number of cryptocurrencies on the market. The thing is, do we really know what blockchain is and is capable of doing? This book is here to help answer some of the many questions.Blockchain has an increasing number of uses, and it's important to understand what it is before you starting using it. This book will provide you information on: Blockchain technologyBenefits of blockchainThe basics of BitcoinEthereumAnd so much moreIn Blockchain: The Ultimate Guide to Understanding the Technology Behind Bitcoin and Cryptocurrency, you will learn some of the most important parts of blockchain.Get this book today so that you can learn more about a fast-moving technology."
9789403517636,0
9781681738918,"This book introduces all the technical features that make up blockchain technology today. It starts with a thorough explanation of all technological concepts necessary to understand any discussions related to distributed ledgers and a short history of earlier implementations. It then discusses in detail how the Bitcoin network looks and what changes are coming in the near future, together with a range of altcoins that were created on the same base code. To get an even better idea, the book shortly explores how Bitcoin might be forked before going into detail on the Ethereum network and cryptocurrencies running on top of the network, smart contracts, and more. The book introduces the Hyperledger foundation and the tools offered to create private blockchain solutions. For those willing, it investigates directed acyclic graphs (DAGs) and several of its implementations, which could solve several of the problems other blockchain networks are still dealing with to this day. In Chapter 4, readers can find an overview of blockchain networks that can be used to build solutions of their own and the tools that can help them in the process."
9783662607183,"Blockchain-Technologie jenseits von Krypto-W hrungen: Entdecken Sie die vielf ltigen Nutzungsm glichkeiten f r Ihr Unternehmen In diesem praxisorientierten Fachbuch werden die Grundlagen zum Thema Blockchain-Technologie vorgestellt und der Leser erf hrt, wo und wie er diese Technologie sinnvoll in Unternehmensprozessen anwenden kann. Es werden zun chst die allgemeinen Merkmale der Blockchain-Technologie beschrieben; anschlie end wird  ber verschiedene Schritte der eigentliche Use Case entwickelt und vorgestellt. Dazu geh rt eine Stakeholderanalyse sowie die  berpr fung des angedachten Falles mittels des sogenannten Blockchain-Decision-Path. Zudem werden die Kernkonzepte sowie die Rollen, die gem   der Technologie zu besetzen sind, vorgestellt. Aus dem Inhalt Einsatz der Blockchain-Technik und agiles ArbeitenBlockchain-Arten, Protokolle und KonsensmodelleMethoden der Prozessanalyse: Entscheidungspfad und NutzwertanalyseEntwicklung eines individualisierten Blockchain-ModellsZukunftsanalysen zur Blockchain-Technologie  Erhalten Sie einen  berblick  ber Einsatzm glichkeiten, Technik und Status Quo der Blockchain-Technologie Dieses Fachbuch ist sowohl f r Manager, Gesch ftsf hrer, Developer, Strategen und Unternehmensberater als auch f r Studierende geeignet und bietet viele  bungen und Beispiele. Mit Hilfe dieser Lekt re wird es dem Leser m glich sein, seine eigenen, f r ihn notwendigen Schritte zu unternehmen, den geeigneten Unternehmensprozess herauszufiltern sowie die Roadmap f r einen ersten Prototyp zu erstellen. F r die Erstellung eines Prototyps wird  ber User Experience und Frontend-L sungen genauso nachzudenken sein wie  ber die Architektur der Backend-Blockchain-L sung. Die Autorin erl utert dies anhand von Praxisbeispielen, um auch Nicht-Developern den Zugang zu diesen Kenntnissen zu erm glichen. "
9781484250426,"Design, architect, and build Blockchain applications with Azure in industrial scenarios to revolutionize conventional processes and data security. This book will empower you to build better decentralized applications that have stronger encryption, better architectures, and effective deployment structures over the cloud. You'll start with an overview of Blockchain, distributed networks, Azure components in Blockchain, such as Azure Workbench, and independent Blockchain-as-a-service solutions. Next, you'll move on to aspects of Blockchain transactions where the author discusses encryption and distribution along with practical examples. You'll cover permissioned Blockchains and distributed ledgers with the help of use cases of financial institutions, followed by code and development aspects of smart contracts. Here, you will learn how to utilise the templates provided by Azure Resource Manager to quickly develop an Ethereum-based smart contract. Further, you will go through Blockchain points of integration, where the author demonstrates enterprise integration, automated processing of smart contracts, and lifecycle events. Finally, you will go through every deployment of HyperLedger, Ethereum, and other decentralized ledger examples over Azure, thus understanding the elements of creation, design, development, security, and deployment. After reading Unlocking Blockchain on Azure you will be able to design and develop Blockchain applications in Azure to decentralize social networks, financial organisations, and data. You'll be able to implement encryption over a Blockchain and have full control over shared instances digitally. You will be able to program smart contracts to digitize rules and trigger timely transactions.What You Will LearnBuild decentralized applications Program, design, and deploy dynamic smart contractsModel Blockchains in the form of token economics, hybrid networks, and infrastructureDevelop end-to-end encryption and distributed systemsWho This Book Is For Developers and solutions architects who want to develop Blockchain applications in Azure and decentralize applications in different scenarios."
9783030401412,"This book provides a comprehensive introduction to blockchain and distributed ledger technology. Intended as an applied guide for hands-on practitioners, the book includes detailed examples and in-depth explanations of how to build and run a blockchain from scratch. Through its conceptual background and hands-on exercises, this book allows students, teachers and crypto enthusiasts to launch their first blockchain while assuming prior knowledge of the underlying technology. How do I build a blockchain? How do I mint a cryptocurrency? How do I write a smart contract? How do I launch an initial coin offering (ICO)? These are some of questions this book answers. Starting by outlining the beginnings and development of early cryptocurrencies, it provides the conceptual foundations required to engineer secure software that interacts with both public and private ledgers. The topics covered include consensus algorithms, mining and decentralization, and many more. ""This is a one-of-a-kind book on Blockchain technology. The authors achieved the perfect balance between the breadth of topics and the depth of technical discussion. But the real gem is the set of carefully curated hands-on exercises that guide the reader through the process of building a Blockchain right from Chapter 1."" Volodymyr Babich, Professor of Operations and Information Management, McDonough School of Business, Georgetown University ""An excellent introduction of DLT technology for a non-technical audience. The book is replete with examples and exercises, which greatly facilitate the learning of the underlying processes of blockchain technology for all, from students to entrepreneurs."" Serguei Netessine, Dhirubhai Ambani Professor of Innovation and Entrepreneurship, The Wharton School, University of Pennsylvania""Whether you want to start from scratch or deepen your blockchain knowledge about the latest developments, this book is an essential reference. Through clear explanations and practical code examples, the authors take you on a progressive journey to discover the technology foundations and build your own blockchain. From an operations perspective, you can learn the principles behind the distributed ledger technology relevant for transitioning towards blockchain-enabled supply chains. Reading this book, you'll get inspired, be able to assess the applicability of blockchain to supply chain operations, and learn from best practices recognized in real-world examples."" Ralf W. Seifert, Professor of Technology and Operations Management at EPFL and Professor of Operations Management at IMD "
9781838646486,0
9781838647766,0
9781393889151,0
9781543988345,"In this book, we explore how organizations and their product and service developers can prepare their businesses to incorporate three emerging technology trends: Artificial Intelligence (AI), the Internet of Things (IoT) and the Blockchain. We will cover the component resources, i.e., business, technical and legal needed to empower an organization to exploit them now and in the future.We'll start with a discussion of each technology providing introductory material. We will provide the reader with details around the players (e.g., Google, Ethereum, IBM, Microsoft, Amazon, etc.) who are fostering and developing standards for 'Power of 3 implementation. We will discuss the requirements not only technical but also for business and legal compliance with emerging regulation, security and privacy law. We will walk the reader through the steps required to create sample applications and code. This will facilitate, enable and accelerate the readers journey to the implementation of these new technologies. We will additionally explore emerging use cases for applications which integrate combinations of these technologies and most importantly how these technologies will change the way software development is conducted using the power of 3."
9781108482363,"In Blockchain Democracy, William Magnuson provides a breathtaking tour of the world of blockchain and bitcoin, from their origins in the online scribblings of a shadowy figure named Satoshi Nakamoto, to their furious rise and dramatic crash in the 2010s, to their ignominious connections to the dark web and online crime. Magnuson argues that blockchain's popularity stands as a testament both to the depth of distrust of government today, and also to the fervent and undying belief that technology and the world of cyberspace can provide an answer. He demonstrates how blockchain's failings provide broader lessons about what happens when technology runs up against the stubborn realities of law, markets, and human nature. This book should be read by anyone interested in understanding how technology is changing our democracy, and how democracy is changing our technology."
9781838829094,0
