ISBN,書籍簡介
9781801440332,"WHAT DO YOU SAY IF I TEACH YOU EVERYTHING THERE IS TO KNOW ABOUT CRYPTOCURRENCIES AND YOU START TO ACCUMULATE A REAL FORTUNE?Are you curious, right? Yet it is the truth, it's not a coincidence that they are considered the new DIGITAL GOLD If you want to know all the tricks and advantages of bitcoins, you want to understand how to use them or just know what they are, this book will give you all the answers you need. Don't worry, with bitcoin you don't need to have specific skills but just have the right support, adopt the right mental condition to easily understand and be well informed. I will help you throughout the learning process thanks to the easy smoothness in reading The particularity of these virtual coins, is that they are encrypted behind a code. They are a great investment innovation that is depopulating in the digital world and has a really modern features that you can't never imagine Obviously, you will also learn what mining and blockchain are and how they work, because they play a fundamental role in this business. Change your mindset from NOW and start investing first in YOURSELF and in your STUDY. I'm giving you all my knowledge so you can SUCCEED and not end up in bad scams.Trust me, GET THIS BOOK NOW and start learning all the mechanisms behind the most profitable coin ever invented Here some extracts from book: Bitcoin is a new type of currency founded in 2009 by someone unknown who used the alias of Satoshi Nakamoto. Yes, because its true creator is still unknown today. But rest assured, we'll get there. The idea of creating a new currency came to him in 2008 when, following the Great Depression, he registered the Bitcoin.org domainandthen moved on to the next creation based on fundamental principles such as security, volatility, anonymity and scarcity. For many years now we have been talking about Bitcoin without really knowing its meaning and that is why I am writing this book. The substantial difference between Bitcoin and any other currency such as the dollar, pound sterling or euro is that the former is a virtual currency. Virtual coins cannot be touched, you cannot find them in the usual place where you are looking for banknotes, like the wallet, they almost seem not to exist at all, yet virtual coins will change our life. I spoke in the plural because there are so many virtual coins, but let's focus on the most famous. I said that there are many cryptocurrencies, why is Bitcoin the most famous and everyone wants to use it? You'll find the answer in the book"
9781914192029,"Do you know what Blockchain is and how it works?Do you know how to exploit ICOs, IPOs and IEOs?Do you know which are the most important cryptocurrencies in the world, which are the best traders in the world and how they operate?Do you know who are the richest cryptocurrency traders?Would you be interested in what experts say about the future of Bitcoin, Ethereum and other cryptocurrencies?And finally, do you know how Facebbok could change the world of cryptocurrency?If this is what you are looking for, this book can help you Trading in criptocurrencycan be a dangerous game If you are trying to make a profit betting your money on your gut feeling ... try to play at the casino  Successful trading is achieved through study, organization and discipline and more discipline and finally... discipline Starting from this belief, I have written this manual in a simple way especially to help beginners, but not only that, also to help people understand how to be successful in trading.Together we will see: what is the blockchain;what IPO-ICO and IEO are and how to exploit them;history and characteristics of Bitcoin, Ripple, Ethereum and Dash;how to start trading and how to organise successful trading;which could be the future of these new coins;Mark Zuckerberg's bet.But above all, whether you are a novice or not, I strongly advise you to read everything up to the last chapter carefully.Trading can be a tool for obtaining a second income, or, in many cases, even a main activity.Making a living through trading... is possible If you think this could be useful, well, the only thing missing is your action Invest in yourself... Press the button and buy the book, study and... Happy Trading  "
9798567160787,"Do you know what Blockchain is and how it works?Do you know how to exploit ICOs, IPOs and IEOs?Do you know which are the most important cryptocurrencies in the world, which are the best traders in the world and how they operate?Do you know who are the richest cryptocurrency traders?Would you be interested in what experts say about the future of Bitcoin, Ethereum and other cryptocurrencies?And finally, do you know how Facebbok could change the world of cryptocurrency?If this is what you are looking for, this book can help you Trading in criptocurrencycan be a dangerous game If you are trying to make a profit betting your money on your gut feeling ... try to play at the casino  Successful trading is achieved through study, organization and discipline and more discipline and finally... discipline Starting from this belief, I have written this manual in a simple way especially to help beginners, but not only that, also to help people understand how to be successful in trading.Together we will see: what is the blockchain;what IPO-ICO and IEO are and how to exploit them;history and characteristics of Bitcoin, Ripple, Ethereum and Dash;how to start trading and how to organise successful trading;which could be the future of these new coins;Mark Zuckerberg's bet.But above all, whether you are a novice or not, I strongly advise you to read everything up to the last chapter carefully.Trading can be a tool for obtaining a second income, or, in many cases, even a main activity.Making a living through trading... is possible If you think this could be useful, well, the only thing missing is your action Invest in yourself... Press the button and buy the book, study and... Happy Trading   "
9781914192999,"Do you know what Blockchain is and how it works?Do you know how to exploit ICOs, IPOs and IEOs?Do you know which are the most important cryptocurrencies in the world, which are the best traders in the world and how they operate?Do you know who are the richest cryptocurrency traders?Would you be interested in what experts say about the future of Bitcoin, Ethereum and other cryptocurrencies?And finally, do you know how Facebbok could change the world of cryptocurrency?If this is what you are looking for, this book can help you!Trading in criptocurrencycan be a dangerous game!If you are trying to make a profit betting your money on your gut feeling ... try to play at the casino! Successful trading is achieved through study, organization and discipline and more discipline and finally... discipline!Starting from this belief, I have written this manual in a simple way especially to help beginners, but not only that, also to help people understand how to be successful in trading.Together we will see: what is the blockchain;what IPO-ICO and IEO are and how to exploit them;history and characteristics of Bitcoin, Ripple, Ethereum and Dash;how to start trading and how to organise successful trading;which could be the future of these new coins;Mark Zuckerberg's bet.But above all, whether you are a novice or not, I strongly advise you to read everything up to the last chapter carefully.Trading can be a tool for obtaining a second income, or, in many cases, even a main activity.Making a living through trading... is possible!If you think this could be useful, well, the only thing missing is your action!Invest in yourself... Press the button and buy the book, study and... Happy Trading!!"
9788293791119,"Do you want to finally get a grip on Fintech today?... or do you see everyone else making money with cryptocurrency? Are you tempted to start learning finally see why Fintech matters? Do you feel ignorant, unclear what big data is, and why it can change your life?Are you terrified of ending up old having wasted years not taking part in the data revolution right from the start?If you stay ignorant of Fintech, you will be passed by.Is this positive for you?Fintech: Hacking, Blockchain, Big Data, Cryptocurrency gets you up to speed fast, including an exploration of the history and future of cryptocurrency. This is a book of knowledge and doesn't just tell you to try harder. Life rewards those who take matters into their own hands, and this book is where to start.Fintech is full of real-life examples of how big data impacts people just like you. These examples are backed up by countless data expert studies, all of which will arm you with a knowledge primed for success with using Big Data immediately.Easy-to-implement small changes and practical takeaways for immediate action.What happens if you ignore cryptocurrency? - Learn the history of cryptocurrency. - Why should you care about becoming an expert in cryptocurrency? - What could you achieve with tips in the right direction - The consequences of ignoring cryptocurrency in your businessHow will you learn to compete in this data-driven age? - Identify the keys to mastering Fintech - Which tools are used to win at this game - Tricks for getting your feet on the ground today - How to develop the competency you are lackingWhat happens when you don't let life pass you by? - Never wonder ""what if"" you could have made millions with cryptocurrency  - Wake up every day with high energy and desire  - Inspire yourself and others to become experts at Fintech.  - Fulfill your destiny and start getting paid for this knowledge. Find out how to let go of your lack of knowledge and take flight towards being a Hacking expert, period.Create the business of your dreams around this Data Revolution.Try Fintech: Hacking, Blockchain, Big Data, Cryptocurrency today by clicking the BUY NOW button at the top right of this page P.S. You'll be on your way to being part of the Fintech revolution within 24 hours."
9781801209076,"Join the Blockchain Revolution with this Bundle Learn Everything You Need to Know About Blockchain and CryptocurrencyIn the past few years, the world has seen the tendency towards favoring decentralized systems, rather than depending on a central authority. The infrastructure that is allowing this revolution to take place is called Blockchain.What is it? In the words of Don and Alex Tapscott, two of the biggest experts in the cryptocurrency sphere, ""The blockchain is an incorruptible digital ledger of economic transactions that can be programmed to record not just financial transactions, but virtually anything of value.""On the blockchain, different cryptocurrencies have been developed. Today, there are more than 1300 cryptos on the market, each one with its own features.The market of cryptocurrencies has now reached over 350 billion dollar in evaluation. It is a remarkable achievement, since now this industry is bigger than McDonald's and Pepsi. If this phenomenon could be left outside the media a few years ago, now it is impossible to deny that there is a true revolution in act. With his flawless style and his profound knowledge, Corey managed to put together a simple yet efficient approach to introduce people to the world of blockchain and cryptos. This manual goes into well researched and newbie friendly reflections about the most important aspects of blockchain and cryptocurrency, such as: What Blockchain isBlockchain's FutureDifferences Between Blockchain and BitcoinPros and Cons of the Blockchain InfrastructureThe Relationship between Blockchain and the Financial IndustryHow can Blockchain affect other Industries What Hard Forks are The Big Impact of BlockchainWhat Is a Cryptocurrency?Basic Knowledge of Cryptocurrency LanguageWhat Are Altcoins?What Is An ICO?How Many Cryptocurrencies Are There?Main Cryptocurrencies How Do You Store Cryptocurrencies?Chapter 8: ExchangesShort-Term Trading and Long-Term InvestingHow to Build a Profitable PortfolioDetermining a Cryptocurrency's Future ValueBy reading this book, you not only get a better understanding of cryptocurrencies and blockchain's world in general, but you get access to powerful information that provide a 360  education. Disclaimer: this book is not for you if your goal is to get a quick and superficial grasp of cryptos and blockchain. Corey fully believes in this new financial system and wanted to offer a complete education trough this manual, while still letting the average Joe to understand it easily. Do you want to understand the world of cryptos and blockchain and join the Financial Revolution?This bundle will accelerate your education.Join thousands of readers and get this bundle today "
9781492047186,"Mastering Corda provides you with a consistent, linear, and paced path to learning Corda and building modern enterprise-grade decentralized applications. Using this book, anyone from a complete blockchain beginner to an experienced blockchain or enterprise architect can rapidly understand and write applications like a pro while exploring the technical nuances and intricacies of the Corda platform.Corda is designed for use cases such as finance and investments, supply chain, healthcare, trade finance, insurance, and real estate that require a high-volume of transactions, scalability, and data privacy. If you have basic Java skills, this book will help you understand blockchain and show how you can get started immediately and be involved in the disruption of the future.With this book, you will: Understand Corda's value proposition and alignment with business strategies--particularly relevant to business executives and architectsDive deep into Corda's architecture and blockchain fundamentalsRapidly gain extensive knowledge of and hands-on experience with building Corda applicationsCompare and contrast Corda with Bitcoin, Ethereum, and HyperledgerEffectively prepare for the Corda certification exam and job interviews involving blockchainPerform data analytics and machine learning on Corda nodes"
9781541578777,"In January 2009, a mysterious software developer, Satoshi Nakamoto, exchanged a specially designed code with another developer. The code was a digital currency that Nakamoto had proposed several months before in a paper titled ""Bitcoin: A Peer-to-Peer Electronic Cash System."" This was the first Bitcoin transaction.  Since then, Bitcoin has become the face of a tech revolution in digital cryptocurrencies based on blockchain technology. Its success has sparked a tech revolution that could fundamentally change global economics. Author Brendan January delves into the world of coders, libertarians, criminals, financial regulators, and crypto-detectives to understand what digital cryptocurrencies have to offer, their limitations and potential pitfalls, security issues, and how they may affect government and financial regulations in the future."
9781484262054,"Your company has committed to AI. Congratulations, now what? This practical book offers a holistic plan for implementing AI from the perspective of IT and IT operations in the enterprise. You will learn about AI's capabilities, potential, limitations, and challenges. This book teaches you about the role of AI in the context of well-established areas, such as design thinking and DevOps, governance and change management, blockchain, and quantum computing, and discusses the convergence of AI in these key areas of the enterprise.Deploying AI in the Enterprise provides guidance and methods to effectively deploy and operationalize sustainable AI solutions. You will learn about deployment challenges, such as AI operationalization issues and roadblocks when it comes to turning insight into actionable predictions. You also will learn how to recognize the key components of AI information architecture, and its role in enabling successful and sustainable AI deployments. And you will come away with an understanding of how to effectively leverage AI to augment usage of core information in Master Data Management (MDM) solutions. What You Will LearnUnderstand the most important AI concepts, including machine learning and deep learningFollow best practices and methods to successfully deploy and operationalize AI solutionsIdentify critical components of AI information architecture and the importance of having a planIntegrate AI into existing initiatives within an organizationRecognize current limitations of AI, and how this could impact your businessBuild awareness about important and timely AI researchAdjust your mindset to consider AI from a holistic standpointGet acquainted with AI opportunities that exist in various industries Who This Book Is ForIT pros, data scientists, and architects who need to address deployment and operational challenges related to AI and need a comprehensive overview on how AI impacts other business critical areas. It is not an introduction, but is for the reader who is looking for examples on how to leverage data to derive actionable insight and predictions, and needs to understand and factor in the current risks and limitations of AI and what it means in an industry-relevant context. "
9781484256107,"Leverage Kubernetes for the rapid adoption of emerging technologies. Kubernetes is the future of enterprise platform development and has become the most popular, and often considered the most robust, container orchestration system available today. This book focuses on platforming technologies that power the Internet of Things, Blockchain, Machine Learning, and the many layers of data and application management supporting them.  Advanced Platform Development with Kubernetes takes you through the process of building platforms with these in-demand capabilities. You'll progress through the development of Serverless, CICD integration, data processing pipelines, event queues, distributed query engines, modern data warehouses, data lakes, distributed object storage, indexing and analytics, data routing and transformation, query engines, and data science/machine learning environments. You'll also see how to implement and tie together numerous essential and trending technologies including: Kafka, NiFi, Airflow, Hive, Keycloak, Cassandra, MySQL, Zookeeper, Mosquitto, Elasticsearch, Logstash, Kibana, Presto, Mino, OpenFaaS, and Ethereum. The book uses Golang and Python to demonstrate the development integration of custom container and Serverless functions, including interaction with the Kubernetes API. The exercises throughout teach Kubernetes through the lens of platform development, expressing the power and flexibility of Kubernetes with clear and pragmatic examples. Discover why Kubernetes is an excellent choice for any individual or organization looking to embark on developing a successful data and application platform. What You'll Learn Configure and install Kubernetes and k3s on vendor-neutral platforms, including generic virtual machines and bare metalImplement an integrated development toolchain for continuous integration and deploymentUse data pipelines with MQTT, NiFi, Logstash, Kafka and ElasticsearchInstall a serverless platform with OpenFaaSExplore blockchain network capabilities with Ethereum Support a multi-tenant data science platform and web IDE with JupyterHub, MLflow and Seldon CoreBuild a hybrid cluster, securely bridging on-premise and cloud-based Kubernetes nodes  Who This Book Is ForSystem and software architects, full-stack developers, programmers, and DevOps engineers with some experience building and using containers. This book also targets readers who have started with Kubernetes and need to progress from a basic understanding of the technology and ""Hello World"" example to more productive, career-building projects. "
9781989874097,"*Learn my Complete Blueprint to Easily Start Investing and Profiting from Bitcoin Today*Are you interested in investing in Bitcoin?Want to learn how cryptocurrency works?Or how Bitcoin can benefit your business strategy?If the answer is YES, this informative guidebook is for you...Bitcoin remains exciting and popular, and as it transitions through recent fluctuations the questions are still; will it rise again, should you start investing in it and what steps should you take?The answers to these questions are provided inside Mastering Bitcoins 101: How to Start Investing and Profiting from Bitcoin, Blockchain, and Cryptocurrency Technologies Today, which gives you simple, informative and actionable strategies for: What is blockchain technologyHow to buy and invest in BitcoinHow to choose the right traderHow mining worksHow to sell BitcoinWhat issues to expect from exchange platformsTips to maximize your successCommon dangers and pitfalls to beware ofAnd much more...Every crypto-currency beginner should have access to information that is understandable and simple, yet informative, that will set you on the right path.This book will help you decide whether Bitcoin is right for you and how to proceed if and when you decide it is.Get started with Mastering Bitcoin with just one click "
9781989874400,0
9780197515082,"Following the catastrophic events of the 2008 global financial crisis, an anonymous hacker released Bitcoin to claw back power from commercial and central banks. It quickly garnered an enthusiastic following who sought to forge a stable and democratic global economy--a world free fromhierarchy and control. In their eyes, Bitcoin's underlying architecture, blockchain, hailed the dawn of decentralisation. Money Code Space shatters these emancipatory claims. In their place, Jack Parkin constructs a new framework for revealing the geographies of power that lie behind blockchain networks. Drawing on first-hand experience in cryptocurrency communities and start-up companies from Silicon Valley to London, Parkin untangles the complex web of culture, politics, and economics that truly drive decentralisation."
9787929604250," Quiere unirse a la revoluci n tecnol gica que est  arrasando con el mundo de las finanzas?DOMINANDO EL BITCOIN es la traducci n al espa ol del best seller de Andreas M. Antonopoulos que explica y simplifica el mundo aparentemente complejo de Bitcoin, que le proporciona los conocimientos necesarios para participar en el 'Internet de dinero y entienda completamente qu  es el blockchain, qu  es bitcoin, c mo usarlo y la programaci n que lo sustenta.Que est  construyendo la pr xima aplicaci n asesina relacionada con Bitcoin, invirtiendo en una startup de blockchain y/o fintech, o simplemente tiene curiosidad acerca de esta tecnolog a revolucionaria y de c digo abierto, este libro es una lectura esencial y la mejor opci n para comenzar con el pie derecho.Bitcoin, la primera moneda digital descentralizada y exitosa a n est  en su infancia y a n no tiene Cre  una econom a global por valor de cientos de miles de millones de d lares. Esta nueva econom a est  abierta a cualquier persona con el conocimiento, el deseo y la pasi n de participar. Master Bitcoin proporciona el conocimiento, tanto t cnico como te rico que necesita, solo tiene que ponerle pasi n. Este libro incluye: - Una amplia introducci n a bitcoin y la cadena de bloques que la sustenta, ideal para usuarios de baja tecnolog a, inversores y ejecutivos de negocios.- Una explicaci n de las bases t cnicas de bitcoin, criptograf a y monedas virtuales; adecuado para desarrolladores de software y sistemas, ingenieros y arquitectos.- Detalles sobre la red descentralizada de bitcoin, la cadena de bloques, la arquitectura de igual a igual (p2p), el ciclo de vida de la transacci n y los principios de seguridad - Historias de usuarios, analog as elegantes, ejemplos y fragmentos de c digo que ilustran conceptos clave. Andreas M. Antonopoulus es un conocido tecn logo y empresario que se ha convertido en una de las figuras m s conocidas y respetadas en el campo de Bitcoin., escritora y profesora. Andreas es consultor para nuevas empresas de tecnolog a y organiza conferencias y eventos p blicos en todo el mundo.""Cuando hablo de Bitcoin, a veces me preguntan""  C mo funciona realmente? "". Ahora tengo la verdadera respuesta a esta pregunta,  por qu ? cualquiera que lea Mastering Bitcoin tendr  un conocimiento profundo de c mo funciona y estar  bien equipado para escribir la nueva generaci n de programas de criptomoneda fant sticos ""-Gavin Andersen (Cient fico jefe de la Fundaci n Bitcoin""El libro de Andreas lo ayudar  a unirse al software que est  revolucionando el mundo de las finanzas ""- Naval Ravikant (co-fundador de AngelList)"
9781838822293,0
9781641379205,0
9789811218958,"Digital transformation continues to create new growth opportunities for businesses and improve the lives of citizens. To help businesses seize these opportunities, the Infocomm Media Development Authority (IMDA) launched the Digital Economy Framework for Action in 2018. This living document aims to enhance Singapore's digital competitiveness and become a global node in Asia.As part of Singapore's push for a Digital Economy, IMDA and the Singapore University of Social Sciences have collaborated to jointly publish the Artificial Intelligence, Data and Blockchain in a Digital Economy, First Edition. This book explains how frontier technologies such as blockchain and artificial intelligence can empower Singapore's digital transformation. It also highlights and provides insights on transformative services and how frontier technology can impact the nation's digitalisation journey."
9789811219948,0
