書名,書籍網址,作者,出版社,ISBN,圖片網址
Borges in Sicily: Journey with a Blind Guide,https://www.eslite.com/product/1001150112681957324005,Alejandro Luque,UNIVERSITY OF CHICAGO,9781909961623,https://s.eslite.dev/upload/product/l/2681957324005/20201216160814532002.jpg
National Geographic The Photo Ark Vanishing: The World's Most Vulnerable Animals,https://www.eslite.com/product/1002152112832593,Joel Sartore,NATIONAL GEOGRAPHIC BOOKS,9781426220593,https://s.eslite.dev/upload/product/l/2681862469006/20200313011901825028.jpg
Sweet Sorrow,https://www.eslite.com/product/1002149602773133,David Nicholls,HODDER & STOUGHTON LIMITED,9781444715415,https://s.eslite.dev/upload/product/l/2681775887003/20190702113324803116.jpg
100 Side Hustles: Unexpected Ideas for Making Extra Money Without Quitting Your Day Job,https://www.eslite.com/product/1002144282762403,Chris Guillebeau,TEN SPEED PRESS,9780399582578,https://s.eslite.dev/Upload/Product/201911/l/637100963793735000.jpg
Guido Mocafico: Leopold & Rudolf Blaschka: The Marine Invertebrates,https://www.eslite.com/product/1002167922754431,Guido Mocafico; Alexandra Baudelot/ Isabelle Pirotte/ Emmanuel G. Reynaud/ Text,STEIDL,9783958293984,https://s.eslite.dev/Upload/Product/201911/l/637100132826078750.jpg
NOS4A2 (TV Tie-in Ed.),https://www.eslite.com/product/1002150262736776,Joe Hill,"WILLIAM MORROW AND COMPANY, INC.",9780062935335,https://s.eslite.dev/Upload/Product/201911/l/637099230011703750.jpg
Realistic Portraits in Colored Pencil: Learn to Draw Lifelike Portraits in Vibrant Colored Pencil,https://www.eslite.com/product/1002141022766030,Karen Hull,WALTER FOSTER PUBLISHING,9781633227279,https://s.eslite.dev/upload/product/l/2681761734007/ec1765864.jpg
Ed Sheeran: Super Easy Songbook,https://www.eslite.com/product/1002138942794296,Ed Sheeran,HAL LEONARD PUBLISHING CORPORA,9781540043153,https://s.eslite.dev/upload/product/l/2681807361006/20190912161101635128.jpg
"Really Easy Guitar Series: 22 Songs with Chords, Lyrics & Basic Tab",https://www.eslite.com/product/1002138942761742,Various,HAL LEONARD PUBLISHING CORPORA,9781540040626,https://s.eslite.dev/upload/product/l/2681755269003/ec1757901.jpg
Don McCullin,https://www.eslite.com/product/1002157652768924,Simon Baker/ Shoair Mavlian/ Text,Tate Publishing,9781849766197,https://s.eslite.dev/upload/product/l/2681767258002/ec1775410.jpg
"The Story So Far…the Best of (2LP+7"" single Vinyl/Deluxe Edition)",https://www.eslite.com/product/1004123082735892,Def Leppard,環球國際唱片股份有限公司,0602567910367,https://s.eslite.dev/Upload/Product/201901/l/636821126375507500.jpg
Relaxing Songs For Fingerstyle (Guitar+Audio Access),https://www.eslite.com/product/1002138942834709,Mark Hanson,HAL LEONARD PUBLISHING CORPORA,9781495096051,https://s.eslite.dev/upload/product/l/2681864914009/20200323164842880008.jpg
蘭登奧斯汀與朋友們: 純粹情歌 2,https://www.eslite.com/product/1004228342675224,蘭登．奧斯汀,光華實業社,9555633001012,https://s.eslite.dev/upload/product/l/2681576819005/ec1466604.jpg
Edward Weston,https://www.eslite.com/product/1002167382576341,Terence Pitts,TASCHEN GmbH,9783836564502,https://s.eslite.dev/Upload/Product/202004/l/637219332018605000.jpg
對話 dialogue 6x6,https://www.eslite.com/product/1004292712484550,楊瑞瑟,好有感覺音樂事業有限公司,4713012740081,https://s.eslite.dev/upload/product/l/2681271803002/539917.jpg
經典: 林哥．史達,https://www.eslite.com/product/1004123082401894,林哥．史達,環球國際唱片股份有限公司,0602537975303,https://s.eslite.dev/Upload/Product/201503/l/635627152653036250.jpg
五分錢樂團: 精選第一章,https://www.eslite.com/product/1004142252286593,五分錢樂團,ROADRUNNER RECORDS,0016861759223,https://s.eslite.dev/Upload/Product/201311/l/635212462956677500.jpg
Macrame Pattern Book: Includes Over 70 Knots and Small Repeat Patterns Plus Projects,https://www.eslite.com/product/1002156662853327,Marchen Art Studio,ST. MARTIN'S PRESS,9781250034014,https://s.eslite.dev/upload/product/l/2681891825002/20190409093656655747.jpg
Grosses Wasser (180g Vinyl),https://www.eslite.com/product/1004324871927871,Cluster (簇樂團),Bureau B,4047179303514,https://s.eslite.dev/upload/product/l/2680484469005/20200713133304554104.jpg
