ISBN,書籍簡介
9781838660512,"NIKE官方授權品牌專書《Better is Temporary》國際知名品牌NIKE創立半個多世紀來，在運動潮流界，總是扮演著重要的革命性角色：無論在商品的設計或創新，總是領先其他品牌，創造出最具時代代表性的運動用品。其商品定位和廣告亦不斷推陳出新，往往引領整個運動產業，成為歷史經典。作者Sam Grawe是首位獲得NIKE獨家授權的作家，得以進入NIKE核心創意團隊採訪，完整剖析品牌設計哲學、探究NIKE全球瘋迷原因。此專書內副大量圖片，紀錄商品設計完整過程，其中包含許多未對外公開過的品牌經典回顧影像，因此是運動迷與Nike鐵粉必備收藏。同時，《Better is Temporary》也是對廣告、潮流服飾設計、娛樂產業有興趣的讀者們，必須拜讀的品牌打造範例經典。NIKE精確且獨特的品牌定位，讓其風格從職業運動員橫跨到日常街頭潮流。成為全球辨識度最高的品牌。在設計、材質、版型、機能方面，對於創新的執著、一路走來挑戰極限、追求完美的突破與成就，皆記錄在此書中。For more than half a century, Nike has played a pivotal role in the evolution of design and innovation in sport, producing some of the most iconic footwear, apparel, and ad campaigns in industry history. With exclusive access to the Nike campus and through conversations with key members of the creative and leadership teams, author Sam Grawe delves deep into the company’s internal design philosophy to reveal precisely what makes Nike such a global phenomenon. A one-of-a-kind, immersive visual survey, Nike: Better is Temporary celebrates the groundbreaking achievements that can result from the pursuit for perfection.Key Selling Points Essential reading for fans of Nike, as well as anyone interested in design, fashion, sport, creative collaboration, and how to create a successful, innovative, and boundary-pushing business Gives exclusive, behind-the-scenes access to Nike’s core design approach – a constantly evolving mind-set that shifts seamlessly from high-performance athlete apparel to everyday streetwear Features Nike’s most industry-defining and globally recognized products, as well as never-before-seen designs, sketches, materials, prototypes, ephemera, and more Reflections from Nike insiders, as well as key collaborators such as Serena Williams, Jun Takahashi, and Tom Sachs, help to capture the company’s game-changing vision."
9781646090846,"With its captivating characters, striking visual design, and intense gameplay, Final Fantasy VII set a new standard for the RPG genre and became one of the top video game releases of all time. Now, with Final Fantasy VII Remake, players return to Midgar in a stunning new rendition of a timeless classic. This World Preview volume offers both new players and longtime fans essential information on characters, settings, gameplay, and more, as well as introductory comments from producer Yoshinori Kitase and director Tetsuya Nomura."
9780811875004,"Star Wars fans the world over are buzzing in anticipation of what promises to be a defining moment in the history of multiplayer online gaming: the release ofStar Wars: The Old Republic. The game follows the escalating war between the Jedi and the Sith thousands of years before the events of theStar Wars films, and its innovative design allows players to choose sides and help shape the history of the galaxy. This gorgeous, full-color volume features the detailed art behind this highly anticipated release from BioWare and LucasArts. With character sketches, interviews, and artwork featuring the game's new weapons, starships, and previously unexplored worlds,The Art and Making of Star Wars: The Old Republic is the ultimate chronicle of the newestStar Wars experience.Star Wars  fans the world over are buzzing in anticipation of what promises to be a defining moment in the history of multiplayer online gaming: the release of Star Wars: The Old Republic. The game follows the escalating war between the Jedi and the Sith thousands of years before the events of the Star Wars films, and its innovative design allows players to choose sides and help shape the history of the galaxy. This gorgeous, full-color volume features the detailed art behind this highly anticipated release from BioWare and LucasArts. With character sketches, interviews, and artwork featuring the game s new weapons, starships, and previously unexplored worlds, The Art and Making of Star Wars: The Old Republic is the ultimate chronicle of the newest Star Wars experience."
