ISBN,書籍簡介
9781801123525,"If You Are Very Much Worried About The Security Structure Of Your Network Or Server And Want To Prevent All Forms Of Attacks Along With Vulnerabilities On Your System, Then Keep ReadingYou might come across several problems at the time of installing Kali Linux on your system (and it is not funny). Also, if you are unable to install the same properly, you will fail in getting access this awesome softwere and you will be irritated. But just like existing problems, there is also a wide range of troubleshooters which yuo can learn through this book helping in getting rid of all forms of problems that come in the way of installation. But why is kali linux so imprortantant to have?You need to know that Kali Linux is much more than just hacking. It comes with some advanced forms of features which can help in making your tasks of programming along with hacking lot more easier. But this software does not only provide help at the time of hacking but it also comes along with various tools which helps the users in testing out their networks for finding out the vulnerabilities in their network or system. I know programming and hacking in Linux can be tough but thanks to this excellent book you will receive the proper knowledge about the functioning of Kali Linux regarding programming and hacking, thus you will be able to program and hack without any form of problem in this software. Furthermore Kali Linux is integrated with several functions which when carried out together, can actually do wonders. It can be regarded among the most effective software in today's world. Most of the big companies today seek the help of Kali Linux for the purpose of tracing and checking the various forms of vulnerabilities which are present within a system and thus ensures 100% security for an organization. Unless and until you are unaware of the basics, you will not be able to use this software. In fact for carrying out an effective form of ethical hacking, you will need to learn about the various attacks along with the forms of networks. You can easily find this information in this book.Here is some of all the main elements which you can find in this book: -Installing and Downloading Kali LinuxTroubleshooting installations-Essential and advanced Linux terminal command-Adding and removing software -Controlling file and directory permissions-Real world application for kali Linux and useful tools-Programming in Linux using: C, C++, Python, Java, Bash-Network Basics-Wireless hacking and penetration testing with Linux -How to carry out an effective attackAnd Much More Okay, but why can this book help me?Because this book will give you a detailed structure about the installation of Kali Linux software on your system and how you can configure the same. The chapters that you are going to find in this book are arranged with information, exercises and explanations in a very orderly manner which can easily answer all your questions and can clear all your doubts regarding hacking and Kali Linux. This book will be the perfect choice for you. It is something which you really need to have if you want to improve the security of your system or if you want to learn programming by using Kali Linux.Even if you have never installed kali linux in your computer; Even if you do not know anything about programming and hacking, do not worry because this book has been designed for peaple like you  Click on ""Buy Now "" and Get Your Copy Now"
9781801091572,"55% OFF for bookstores  Your customers never stop to use this book Do you feel that informatics is indispensable in today's increasingly digital world? Do you want to introduce yourself to the world of hacking? Do you want to have a head start in the job market by learning some of the most important future skills? If the answer to these questions is yes, then keep reading...Maybe you feel that Ethical Hacking will be a very valuable skill in the future, or maybe you simply think you'll have fun. If you want to teach yourself actual hacking (not just copy pasting a virus or a similar non-industry kind of hacking), then this is the book for you First of all, we'll need to look at what an ethical hacker actually is. This book is filled with reasons why you should learn ethical hacking, as well as a few helpful tutorials to help you learn in the quickest way.This book assumes no programming knowledge at the start,  so we'll be teaching you from the ground up. After all, you can't really teach yourself all that well if you don't have the fundamentals set.Ethical hacking can be, and for many people is, an extremely lucrative career to be enjoyed.The first thing you probably think of when you hear the word hackers is a criminal that works via the Internet. However, this book is here to teach you that there's more to it than meets the eye. Within these pages, you'll find a true trove of information and learn not only the raw theory, but also some practical applications.Here's a sneak peek of what you'll learn with this book: - What Ethical Hacking is (roles and responsibilities of an Ethical Hacker) - Hacking as a career- Making money freelance- Most common security tools- The three ways to scan your system- The seven proven penetration testing strategies...and much more.Arm yourself with all this knowledge Buy it NOW and let your customers get addicted to this amazing book "
9781801091565,"55% OFF for bookstores  Do you feel that informatics is indispensable in today's increasingly digital world? Do you want to introduce yourself to the world of hacking? Do you want to have a head start in the job market by learning some of the most important future skills? If the answer to these questions is yes, then keep reading... Your customers never stop to use this book Maybe you feel that Ethical Hacking will be a very valuable skill in the future, or maybe you simply think you'll have fun. If you want to teach yourself actual hacking (not just copy pasting a virus or a similar non-industry kind of hacking), then this is the book for you First of all, we'll need to look at what an ethical hacker actually is. This book is filled with reasons why you should learn ethical hacking, as well as a few helpful tutorials to help you learn in the quickest way.This book assumes no programming knowledge at the start, so we'll be teaching you from the ground up. After all, you can't really teach yourself all that well if you don't have the fundamentals set.Ethical hacking can be, and for many people is, an extremely lucrative career to be enjoyed.The first thing you probably think of when you hear the word hackers is a criminal that works via the Internet. However, this book is here to teach you that there's more to it than meets the eye. Within these pages, you'll find a true trove of information and learn not only the raw theory, but also some practical applications.Here's a sneak peek of what you'll learn with this book: - What Ethical Hacking is (roles and responsibilities of an Ethical Hacker) - Hacking as a career- Making money freelance- Most common security tools- The three ways to scan your system- The seven proven penetration testing strategies...and much more.Arm yourself with all this knowledge Buy it NOW and let your customers get addicted to this amazing book  "
9781914058127,"★★ Do you want to learn how to set up a new network? Do you want to learn more about Network Security? If you want to know more about Computer Networking, then keep reading. ★★Computer networking has been around for ages, starting from the wired to the present wireless systems. We have been able to do justice to everything you need to kick start your knowledge of computer networking in this book. Getting familiar with the components and implementing your own networks should come easier. Networking of Computers requires so many infrastructures for a seamless operation. The various types of network structures require different parts. These will be looked at extensively in the course of this book.Physical network infrastructures are needed for a Computer Network, which includes but is not limited to; switches, routers, wireless access points, etc. There is also some underlying firmware that makes these infrastructures function correctly. Other than the physical systems, there is also the needed software deployed to monitor, manage, and secure the network.For advanced networks, there is a need for standard protocols, which are designed to perform numerous discrete functions. These protocols are also used to communicate different data types, irrespective of the underlying hardware.  For instance, in the telephone system, a voice over IP (VoIP) can bring about the transportation of IP telephony traffic from one point to another, once these points support the protocol. This is also similar to what occurs in the browser, with the HTTP providing portals to accessing webpages. Also, over an IP based network, the IP protocols to transport data and services, since there is protocol compatibility.This guide will focus on the following: - Types of computer networking- Components of a network- Mobile networks- Wired network technology- How to automate the network?- Introduction to IP addressing- Packets, frames, and headers- What is the airport extreme?- Information technology vulnerability- Sniffing and spoofing- About CCNA routing and switching... AND MORE Even if you've never know anything about computer networks in your life, you can learn it just in few days.Get a copy of Networking for Beginners Now "
9781952559761,0
9781914058134,"★★ Do you want to learn how to set up a new network? Do you want to learn more about Network Security? If you want to know more about Computer Networking, then keep reading. ★★Computer networking has been around for ages, starting from the wired to the present wireless systems. We have been able to do justice to everything you need to kick start your knowledge of computer networking in this book. Getting familiar with the components and implementing your own networks should come easier. Networking of Computers requires so many infrastructures for a seamless operation. The various types of network structures require different parts. These will be looked at extensively in the course of this book.Physical network infrastructures are needed for a Computer Network, which includes but is not limited to; switches, routers, wireless access points, etc. There is also some underlying firmware that makes these infrastructures function correctly. Other than the physical systems, there is also the needed software deployed to monitor, manage, and secure the network.For advanced networks, there is a need for standard protocols, which are designed to perform numerous discrete functions. These protocols are also used to communicate different data types, irrespective of the underlying hardware.  For instance, in the telephone system, a voice over IP (VoIP) can bring about the transportation of IP telephony traffic from one point to another, once these points support the protocol. This is also similar to what occurs in the browser, with the HTTP providing portals to accessing webpages. Also, over an IP based network, the IP protocols to transport data and services, since there is protocol compatibility.This guide will focus on the following: - Types of computer networking- Components of a network- Mobile networks- Wired network technology- How to automate the network?- Introduction to IP addressing- Packets, frames, and headers- What is the airport extreme?- Information technology vulnerability- Sniffing and spoofing- About CCNA routing and switching... AND MORE Even if you've never know anything about computer networks in your life, you can learn it just in few days.Get a copy of Networking for Beginners Now "
9781838646301,"Explore self-driving car technology using deep learning and artificial intelligence techniques and libraries such as TensorFlow, Keras, and OpenCVKey Features  Build and train powerful neural network models to build an autonomous car Implement computer vision, deep learning, and AI techniques to create automotive algorithms Overcome the challenges faced while automating different aspects of driving using modern Python libraries and architectures  Book Description Thanks to a number of recent breakthroughs, self-driving car technology is now an emerging subject in the field of artificial intelligence and has shifted data scientists' focus to building autonomous cars that will transform the automotive industry. This book is a comprehensive guide to use deep learning and computer vision techniques to develop autonomous cars. Starting with the basics of self-driving cars (SDCs), this book will take you through the deep neural network techniques required to get up and running with building your autonomous vehicle. Once you are comfortable with the basics, you'll delve into advanced computer vision techniques and learn how to use deep learning methods to perform a variety of computer vision tasks such as finding lane lines, improving image classification, and so on. You will explore the basic structure and working of a semantic segmentation model and get to grips with detecting cars using semantic segmentation. The book also covers advanced applications such as behavior cloning and vehicle detection using OpenCV, transfer learning, and deep learning methodologies to train SDCs to mimic human driving. By the end of this book, you'll have learned how to implement a variety of neural networks to develop your own autonomous vehicle using modern Python libraries. What you will learn  Implement deep neural network from scratch using the Keras library Understand the importance of deep learning in self-driving cars Get to grips with feature extraction techniques in image processing using the OpenCV library Design a software pipeline that detects lane lines in videos Implement a convolutional neural network (CNN) image classifier for traffic signal signs Train and test neural networks for behavioral cloning by driving a car in a virtual simulator Discover various state-of-the-art semantic segmentation and object detection architectures  Who this book is for If you are a deep learning engineer, AI researcher, or anyone looking to implement deep learning and computer vision techniques to build self-driving blueprint solutions, this book is for you. Anyone who wants to learn how various automotive-related algorithms are built, will also find this book useful. Python programming experience, along with a basic understanding of deep learning, is necessary to get the most of this book."
9783030421274,0
9798629849124,"Become A Python Expert From Scratch Python's popularity is growing tremendously and it's becoming more and more relevant economically and technologically. The fields of appliaction of the language range from machine learning, over computer networking to business applications.In this 7 in 1 version you get a full collection of The Python Bible series. From the first volume on, you will be lead on a structured way to the mastery of Python. Besides the basics and the intermediate concepts, you will also learn how to apply it in areas like machine learning, financial analysis and neural networks. At the end you will additionally be introduced to one of the most interesting fields of computer science, which is computer vision After reading this collection, you will not only understand the programming language but you will also be able to work on projects in the stated fields. You will become a true Python expert What You Will Learn: Beginner Level: - Basics of Programming with Python- Automation of Simple Processes- Programming of Modular Python Applications- Easy Transition to Other Languages (Java, C++ etc.)Intermediate Level: - Object-Oriented Programming- Network Programming- Penetration Testing with Python- Regular Expressions- Multithreading- XML Processing- Database Programming- LoggingData Science: - Analyzing and Processing Big Data- Statistical Calculations with Python- Visualization of Data- Working with NumPy, Matplotlib and PandasMachine Learning: - Predicting Data with Machine Learning- Building Neural Networks with Tensorflow- Recognizing Handwritten Digits with Neural Networks- Applying Linear Models like Regression- K-Nearest-Neighbors Classification- K-Means Clustering- Support Vector MachinesFinance: - Financial Analysis with Python- Analyzing and Graphing Stock Data- Plotting Trendlines- Predicting Share Prices with Machine LearningNeural Networks: - Generating Poetic Texts with Neural Networks- Predicting Sequential Data (Stocks, Weather etc.)- Processing Audio and Video Data- Recognizing Objects Like Horses, Cars and Trucks on Images- Understanding Recurrent Neural Networks- Understanding Convolutional Neural NetworksComputer Vision: - Making unreadable texts readable again with thresholding- Extracting essential information out of images and videos- Edge detection- Template matching and feature matching- Movement detection in videos- Professional object recognition with OpenCVStart Your Journey And Become A Python Expert With The Python Bible "
9781647481810,"If you've always wanted to discover the startling world of ethical hacking, then keep reading...Ever feel like you don't even own the hardware and software you paid dearly for?Ever get the impression that you have to ask for permission before installing or changing a program on your device?Ever feel like Facebook and Instagram are listening to your conversations to show you relevant ads?You're not alone.Half-baked products and services that chip away at your sense of ownership, independence and privacy are a part of a global wave of corporate indifference that micromanages and spies on honest, uniformed customers. None of it is intentional or meant to cause harm, which makes it all the more damning.There's a silver lining in all of this, and that is ethical hacking. This book will shine a light on how engineers think and show you how to discern their original intentions, helping you adopt their attitude and perfect their products despite managerial crud doing their worst to stop you.In a world where everything is slowly becoming more managed and overbearing, this book is an attempt to take back some of that original awesomeness envisioned by engineers and at least make your world a slightly better place.Here's just a tiny fraction of the topics covered in this book:   Fighting against companies Ethical Hacking Defined War on the internet Engineer's mind The Almighty EULA The danger of defaults John Deere Copyright YouTube ContentID Tracking users DRM GEMA, the copyright police Torrents Sports channels Megaupload and Anonymous Julian Assange Patents Penetration testing Jailbreaking Android/iPhone Shut up Cortana How an hacker could go about hacking your WiFi And much, much more   If you want to learn more about ethical hacking, then scroll up and click ""add to cart"" "
9781484242933,"Know how to set up, defend, and attack computer networks with this revised and expanded second edition.You will learn to configure your network from the ground up, beginning with developing your own private virtual test environment, then setting up your own DNS server and AD infrastructure. You will continue with more advanced network services, web servers, and database servers and you will end by building your own web applications servers, including WordPress and Joomla . Systems from 2011 through 2017 are covered, including Windows 7, Windows 8, Windows 10, Windows Server 2012, and Windows Server 2016 as well as a range of Linux distributions, including Ubuntu, CentOS, Mint, and OpenSUSE.Key defensive techniques are integrated throughout and you will develop situational awareness of your network and build a complete defensive infrastructure, including log servers, network firewalls, web application firewalls, and intrusion detection systems.Of course, you cannot truly understand how to defend a network if you do not know how to attack it, so you will attack your test systems in a variety of ways. You will learn about Metasploit, browser attacks, privilege escalation, pass-the-hash attacks, malware, man-in-the-middle attacks, database attacks, and web application attacks.What You'll LearnConstruct a testing laboratory to experiment with software and attack techniquesBuild realistic networks that include active directory, file servers, databases, web servers, and web applications such as WordPress and Joomla Manage networks remotely with tools, including PowerShell, WMI, and WinRMUse offensive tools such as Metasploit, Mimikatz, Veil, Burp Suite, and John the RipperExploit networks starting from malware and initial intrusion to privilege escalation through password cracking and persistence mechanismsDefend networks by developing operational awareness using auditd and Sysmon to analyze logs, and deploying defensive tools such as the Snort intrusion detection system, IPFire firewalls, and ModSecurity web application firewallsWho This Book Is For This study guide is intended for everyone involved in or interested in cybersecurity operations (e.g., cybersecurity professionals, IT professionals, business professionals, and students)  "
9781681730219,0
9781545355053,"Would You Like to Learn Exactly What It Means to be a Hacker? - NOW INCLUDES FREE GIFTS  (see below for details)  Have you always secretly admired how tech savvy hackers are?  Does the word ""hacker"" make you think of the cool kids who don't obey society's rules?  Or does the idea of someone hacking your system and stealing your data make you break out into a cold sweat?  Do you want to understand how hacking works for once and for all?  If the answer to any of these questions is yes, this book will provide you with the answers you've been looking for   What might come as a surprise to you is that hacking does not need to mean having mad computer skills. You need to know some basics, naturally, but hacking a computer system is a lot simpler than you might think. And there are a lot of software and tools out there that can help you grow from a hacking novice to a hacking expert in a very short period of time.  The truth is that no system is ever truly 100% safe. Most systems have coding errors that make them more vulnerable to attack simply for the reason that programmers have to rush to get the latest apps, etc. to market before anyone else does. It is only when there is a glitch or when the system is actually hacked that these errors are even found. And, if the hacker wants to maintain access to the system, they will work at hiding these vulnerabilities from everyone else so they might never come to light.  And passwords are not the ultimate answer either. Even the strongest passwords can be cracked if you have the right software and enough time.  If you want to learn how to beat a hacker at their own game, you need to start thinking as they do.  And what about if you are more interested in the other side of the coin? Becoming the hacker and avoiding detection? Well, this book looks at things from both sides of the equation. You need to learn how to be a hacker yourself if you really want to be effective at beating other hackers. How you use the information provided is up to you at the end of the day.  It can be a rollercoaster that will sometimes have you wondering if you have the stuff to make it. But I can promise you one thing. Whether you are the hacker or are working to prevent a system being hacked, you are guaranteed an interesting ride.  When hacking a system depends on buying yourself enough time to allow the password cracker to do its work, or when it means outsmarting someone on the other end of the line, it can be a real adrenaline rush.  Being a successful hacker is about using the right tools for the right job and, ultimately, being the smartest person in that battle. Do you have what it takes? Why not read on and see?  In this book, we will look at:   How Hacking Works   Hacking Networks and Computer Systems    Information Gathering    Using the Data You Gathered    Password Cracking for Beginners   Applications to Gain Entry to Systems   Wireless Hacking  ...and much more   Also included for a limited time only are 2 FREE GIFTS, including a full length, surprise FREE BOOK   Take the first step towards becoming an expert hacker today. Click the buy now button above for instant access. Also included are 2 FREE GIFTS  - A sample from one of my other bestselling books, and full length, FREE BOOKS included with your purchase"
9788461314775,This manual aims at walking the reader through the design of a water supply network in a Development context by explaining in a simple manner how to build and analyze a computer model of a water network with Epanet.Epanet is a free and widely used software from the U.S Environmental Protection Agency that models the hydraulic and water quality behavior of water distribution piping systemsArnalich Water and Habitat is an organization that helps improve the impact of humanitarian actors through training and consultancy in the fields of Water Supply and Environmental Engineering.
9780471193661,0
9789865031589,本書是譯自DouglasE.Comer之著作『ComputerNetworksandInternets-6/E』，書中完全採用比喻和範例的方式來闡釋觀念、取代傳統複雜的數學式證明。內容共分五大部分，涵蓋網路與網際網路應用的簡介、資料通訊、封包交換與網路技術、採用TCP/IP的網路互連、電腦網路的其他層面。其用意在於回答基本的問題：「電腦網路與網際網路是如何運作的？」從最底層的資料傳遞過程一路用遊歷般的解說方式寫到最高層的應用軟體程式。
